Sentence,Paraphrase,Formal_10,Formal_15,Formal_20,Informal_10,Informal_15,Informal_20
 Yes . I like cooking very much . I got this hobby when I was 12 years sold . ,I have a passion for cooking and I started having a passion when I was sold 12 years ago.,I have a passion for cooking and I started having sex when I was 12 years old and sold my hobby.,I have a passion for cooking and I started having sex when I was 12 years old and sold my hobby.,I have a passion for cooking and I started having sex when I was 12 years old and sold my hobby.,Cooking always dreaded me... I did when I sold my hobby 12 years ago - I still love it.,Cookg's ok - I had this hobby 'til I was sold off and sold it 12 years ago.,Cookg's ok - I had this hobby 12 years ago back then when i sold it to a friend.
 Why do you like it ? ,What is it about this that you find appealing?,What is it about this that you find appealing?,What is it about this that you find appealing?,What is it about this that you find appealing?,How it's good and what'olls you reason about it a?,How it's good and what'olls you reason about it a?,How it's good and what'olls you reason about it a?
 I have no idea . I like cooking by myself . I like to taste delicious food . ,I have no idea. I enjoy cooking on my own and relishing the taste of delectable dishes.,I have no idea. I enjoy cooking by myself.I like to taste delectable food..,I have no idea. I enjoy cooking by myself.I like to taste delectable food..,I have no idea. I enjoy cooking by myself.I like to taste delectable food..,Cooking alone... I like taste.I know I don't know...I like to cook on my own...i like eat delicious food.,"Cooky chicks who know what to do (I know nothing at all) I like to cook by myself, I love to taste.","Cooky chicks who know what to do (I know nothing at all) I like to cook by myself, I love to taste."
 That's wonderful ! ,That's awesome!,That's fantastic!,That's fantastic!,That's fantastic!,Nice one!,Nice one!,Nice one!
" And I love trying new recipes , which I usually test with my friends . You can come , too . ","I have a fondness for trying out new recipes, especially ones that I usually share with my friends. I welcome you to join me in this endeavor.","I have a fondness for trying out new recipes, especially ones that I usually share with my friends. I welcome you to join me in this endeavor.","I have a fondness for trying out new recipes, especially ones that I usually share with my friends. I welcome you to join me in this endeavor.","I have a fondness for trying out new recipes, especially ones that I usually share with my friends. I welcome you to join me in this endeavor.","If you'r my type, I also love trying out new recipes, so it's something I usually do with my friends... and I hope you enjoy it too.",If you know me & want to come to see me cook some new recipes - I love trying new things out with my friends... and I really enjoy trying out new dishes.,If you know me & want to come to see me cook some new recipes - I love trying new things out with my friends... and I really enjoy trying out new dishes too.
 Really ? I hope I can have a chance to taste it . Don't forget to tell me . ,Can you tell me if you can try it? I want to be able to taste it. Don't forget to let me know.,Can you tell me if you can try it? I want to be able to taste it. Don't forget to let me know.,Can you tell me if you can try it? I want to be able to taste it. Don't forget to let me know.,Can you tell me if you can try it? I want to be able to taste it. Don't forget to let me know.,Really?? If you could just give me a taste? Just ask if you can tell me.,Really?? If you could just give me a taste... what would you like to eat?,Really?? If you could just give me a taste... what would you like to eat?
 Certainly . ,Certainly.,Certainly.,Certainly.,Certainly.,Well damn it...,Well damn it anyway.,Well damn It.
Anyone home ? Jen ! ,"Jen, are you still at home with anyone?","Jen, are you still at home with anyone?","Jen, are you still at home with anyone?","Jen, are you still at home with anyone?",Whos home at the moment? Jen,Whos home at the moment? Jen,Whos home at the moment? Jen
 I'm in the kitchen ... let yourself in ! ,I'm in the kitchen... enter yourself!,I'm not in the kitchen - come and see me in it : Vivre?,I've got the kitchen stocked up... let’s make yourself at ease!,I've got the kitchen stocked up with food... let’s have a chat!,Kitchen time... oh so... enter me!,Kitchen time... oh so... enter me!,Kitchen time... oh so... enter me!
 Wow ! You're really working up a storm ! ,hey there! You're doing really well!,": Oh wow, you're so talented!",": Oh wow, you're so talented!",": Oh wow, you're so talented!","WOW, you're doing TONS of good!","WOW, you're doing TONS of good!","WOW, you're doing TONS of good!"
 I know . I've even worked up a sweat . ,I've pushed myself to work out my sweat.,I've pushed myself to work out my sweat.,I've pushed myself to work out my sweat.,I've pushed myself to work out my sweat.,Well I know I'm going to sweat.,Well I know I'm going to sweat.,Well I know I'm going to sweat.
 You look like a cooking show host--only messier . ,"You're like a cast of a cooking show, but with a messier appearance.",You're like a presenter on NBC - but with fewer distractions.,You're like a presenter on NBC - but with fewer distractions.,You're like a presenter on NBC - but with fewer distractions.,Just because I thought I was a cooking show host makes you all messed up.,Just because I thought I was a cooking show host makes you all messed up.,Just because I thought I was a cooking show host makes it all the more unpolitelsy!
You look so tan and healthy ! ,Stunningly tanned and healthy!,Stunningly tanned and healthy!,Stunningly tanned and healthy!,Stunningly tanned and healthy!,Nice job! I love the tan and healthy look!,Nice job tan and healthy boobs!,Nice one! I love your smoky tan and healthy look!
 Thanks . I just got back from summer camp . ,Thanks.. I just got home from summer camp and I feel much better.,"Thanks. : I just got home from summer camp and I really appreciate it, many th owe you a lot!",Thanks. I had just returned from summer camp - thank you so much...,Thanks. I had just returned from summer camp - thank you so much...,"Back in the house after e-mailing you all about summer camp. Ways to go. Many thanks. Just back from summer camps... just back to you.. Hi guys, I just got back into summer summer Camp and I needed a nice, big hug today!",Back in LA from summer camp... and thanks again... thank you.,Back in LA from summer camp... and thanks again... thank you.
 How was it ? ,What was your experience like?,What was your experience like?,What was your experience like?,What was your experience like?,How it went in?,How it went your friend?,How it went your friend?
 Great . I got to try so many things for the first time . ,I got to experiment with many things for the first time.,I had the opportunity to experiment with many things for the first time.,I had the opportunity to experiment with many things for the first time.,I had the opportunity to experiment with many things for the first time.,Exhlz. I got to experiment with so many things for the first time.,Exhlz. I got to experiment with so many things for the first time.,"Exhlz, I got to experiment with so many things for the first time ever."
 Like what ? ,What is the question?,What is the question?,What is the question?,What is the question?,How?,How?,How?
" I went sailing , fishing , and horseback riding . ","I engaged in sailing, fishing, and horseback riding.","I engaged in sailing, fishing, and horseback riding.","I engaged in sailing, fishing, and horseback riding.","I engaged in sailing, fishing, and horseback riding.",Out when I went to do sailing and fishing and horseback riding.,Out when I went to do sailing and fishing and horseback riding.,Out when I went to do sailing and fishing and horseback riding.
 I ’ m so jealous . ,I'm feeling incredibly envious.,I'm feeling incredibly envious.,I' ve compiled a list of things that make me extremely jealous.,I' ve compiled a list of things that make me extremely jealous.,EXPLOUD? I DESERVE IT!,EXCITED!,EXCITED!
 The counselors were so nice too . It was the best summer ever . Except for all those mosquitoes ! ,"The summer was amazing, with only mosquitoes present.","The summer was fantastic, with mosquitoes being the only thing that could kill me.","The summer was fantastic, with mosquitoes being the only thing that could kill me.","The summer was fantastic, with mosquitoes being the only thing that could kill me.","Everything good...just kidding! It was the most amazing summer ever..so far, mosquitoes weren’t one of them.’!","Everything good...just kidding! It was the most amazing summer ever..so far, mosquitoes weren’t one of them.’!","Everything good...just kidding! It was the most amazing summer ever..so far, mosquitoes weren’t one of them.’!"
"Diana , do you like the perfume I gave you ? ","Diana, do you like the scent I gave you?","Diana, do you like the scent I gave you?","Diana, do you like the scent I gave you?","Diana, do you like the scent I gave you?",How you all got on with the perfume I gave you Diana - do you guys like it?,How you all got on with the perfume I gave you Diana - do you guys like it?,How you all got on with the perfume I gave you Diana - do you guys like it?
" It ’ s good . But to tell you the truth , I don ’ t wear perfume . ",It's good. But let's be honest - I don't even bother with perfumes.,"It's a good idea. However, I don't really wear perfume.","It's a good idea. However, I don't really wear perfume.","It's acceptable. However, I don't really wear perfume.","Nice... it is, but I don't even bother wearing perfume.","Nice... it is, but I don't even bother wearing perfume.","Nice... it is, but I don't even bother wearing perfume."
 I ’ m sorry . I didn ’ t know that . ,I didn't realize until later that I had.,I didn't realize until later that I had.,I didn't realize until later that I had.,I didn't realize until recently.,Just saying. I don't know.,Just saying. I don't know.,Just saying. I don't know.
 That ’ s all right . Thank you all the same . ,That's all to myself. Thank you in advance.,That's correct. Thank you very much.,That's correct. Thank you very much.,That's correct. Thank you very much.,"Nice one, everyone.","Nice one, everyone.","Nice one, everybody. X. Sorry guys."
"Ah , ah , ah ... ","Ah, ah, ah, ah...","Ah, ah. : hh, sh ; dh sh sh.","Ah, ah. : hh, sh ; dh sh sh.","Ah, ah. : hh, sh ; dh sh sh.","Ug, uh nay - thnk.","Ug, uh nay - thnk.","Ug, uh nay - thnk."
" All right , Bill.Here ' s your daily exercise schedule . You are to jog before breakfast . ","Bill, can you share your daily exercise routine with me? Specifically, you will be jogging before breakfast.","Bill, can you share your daily exercise routine with me? Specifically, you will be jogging before breakfast.","Bill, can you share your daily exercise routine with me? Specifically, you will be jogging before breakfast.","Bill, can you share your daily exercise routine with me? Specifically, you will be jogging before breakfast.","Just chill out, I hear, Bill. I know you said it's a daily routine, right? Just run jogging, and then run before you start your day (minus your morning routine) Just in case you didn't realize it.","Just chill out, I hear, Bill. I know you said it's a daily routine, right up there with jogging before even going to bed...for breakfast that' s it?","Just chill out, I hear, Bill. I know you said it's a daily routine, right up there with you to jog before your out-of-body healthy for breakfast right after bk."
 Jog ? ,"What is the meaning of ""Jog""?","What is the meaning of ""Jog""?","What is the meaning of ""Jog""?","What is the meaning of ""Jog""?",Whos jogging?,Whos jogging?,Whos jogging?
" Then , you are to walk to work . ","Afterward, you must go to work by foot.","Afterward, you must go to work by foot.","Afterward, you must go to work by foot.","Afterward, you must go to work by foot.",Next time... walk to work.,If you walk that much on... then you''re able go to work.,If you walk that much on... then you''re able go to work.
 Walk ? ,Walk?,Walk a?,Walk a?,Walk a?,Who all talk?,Who all talk?,Who all talk?
 Thirty minutes in gym at lunch time . ,Thirty minutes in the gym during lunch time.,Thirty minutes in the gym during lunch time.,Thirty minutes in the gym during lunch time.,Thirty minutes in the gym during lunch time.,"30 minute gym class, ate lunch time there.","30 minute gym class, ate it with lunch at lunchtime.","30 minute gym class, ate it with lunch at lunchtime."
 Oh no . ,Oh no.,Oh no.,Oh yes.,Oh yes.,U r h.,U r h.,U r h.
" Use the stairs , never the elevator . ","Never use the elevator, but instead use the stairs instead.",Always use the stairs instead of the elevator.,Always use the stairs instead of the elevator.,Always use the stairs instead of the elevator.,If you go up & down the stairs - never the elevator.,If you go up & down the stairs - never the elevator.,If you go the other way down use the downstairs gang - never the elevator.
" Oh , dear . ","Oh, my goodness, what a relief.","Oh, my goodness, what a relief.","Oh, my goodness, what a relief.","Oh, my goodness, what a relief.","U hwo, mate.","U hwo, mate.","U hwo, mate."
" And three times a week , you can either swim , play racketball , or hand ball . ","Swimming, racketball, and hand ball are all options available, and you can swim or play them three times a week.","Three times a week, you can choose to swim, racketball, or handball as your leisure activity, and more.","Three times a week, you can choose to swim, racketball, or handball as your leisure activity, and more.","Three times a week, you can choose to swim, racketball, or handball as your leisure activity, and more.","3 times a week, you can go for 3 different pas time,sheep & racketball.","3 times a week, you can go for 3 different pas pas, e.go. swimming, racketball, or hand ball, etc.","3 times a week, you can go out for fun, like swimming, rinks, and balls, all of it."
 Oh no . ,Oh no.,Oh no.,Oh yes.,Oh yes.,U r h.,U r h.,U r h.
" OK , you can stop now.It ' s time for the dance class . ","OK, you can stop right away, but it's time to go to the dance class.","OK, you can stop right away, but it's time to go to the dance class.","OK, you can stop right away, but it's time to go to the dance class.","OK, you can stop right away, but it's time to go to the dance class.",Stop right away... it's all well and good. It'll be time'nce for the dance class.,Stop right away... it's all well and good. It'll be time'nce for the dance class.,Stop right away... it's all well and good. It'll be time'nce for the dance class.
 Dance class ! I don't know how . ,I'm so excited to take a dance class! I don't even know how to do it.,I'll have to take a dance class - I don't know how to do that.,I'll have to take a dance class - I don't know how to do that.,I'll have to take a dance class - I don't know how to do that.,How i can go to a dance class! I don't know what to do.,How i can go to a dance class! I don't know what to do.,How i can go to a dance class! I don't know what to do.
 You will . ,You will.,You will.,You will.,You will.,If you.,If you.,If you.
 Oh ... ,Oh...,Oh.,Oh.,Oh.,Well me too...,Well me too...,Well me hahaha...
"Hi Bill , I saw your grandma yesterday . ","Bill, I noticed you today when you visited your grandmother.","Bill, I noticed you today when you visited your grandmother.","Bill, I noticed you today when you visited your grandmother.","Bill, I noticed you today when you visited your grandmother.","Back in Florida I saw your big sister's kitty yesterday! Good luck, Bill!",Back in Florida (Lake AZ) I saw your grandma yesterday!! Regards Bill.,Back in Florida (Lake AZ) I saw your grandma yesterday!! Regards Bill.
 Oh where was that ? ,Where can I find that?,Where can I find that?,Where can I find that?,Where can I find that?,Didnt he know about that?,Didnt he know about that?,Didnt he know about that?
 I was running around the track at my college and there she was walking around the same track . ,I was running around the track at my college when she saw me walking around the same track and there she was.,I was frantically running along the track at my college while she was walking along it.,I was frantically running along the track at my college while she was walking along it.,I was paced around the track at my college while she was walking around it.,Running around kart tracks on my college track took me two minutes because there was someone walking around the same track.,"Running around kart at my college, I saw her walking around that same race, and there she was.","Running around kart at my college, I saw her walking around that same race, and there she was."
 Grannie always tries to stay fit and healthy.She is always making us kids eat the proper foods . ,"Grannie is committed to staying healthy and in shape, and she is always urging her children to eat properly to maintain their fitness.","Grannie is committed to staying healthy and in shape, and she is always urging her children to eat properly to maintain their fitness.","Grannie is committed to staying healthy and in shape, and she is always urging her children to eat properly to maintain their fitness.","Grannie is committed to staying healthy and in shape, and she is always urging her children to eat properly to maintain their fitness.",Grnnie never sleepsagend on a regular regular base it is physiotherapy & healthy...she is always making us eat properly and making sure our kids are eating the proper foods.,Grnnie never sleepsagens giddy and healthy.she always makes us kids eat properly and makes them savor healthy food.,Grnnie never sleepsagens giddy and healthy.she always makes us kids eat properly and makes them savor healthy food.
" Well , it pays off for her.How old is she anyway ? ",How old is she when she realizes that her efforts are being valued?,I think she'll be able to make a good income. How old is she?,I think she'll be able to make a good income. How old is she?,"At what age is she currently, and does it pay off for her?","How OLD IS MY HEA? Well, it pays for her anyways.","How OLD IS MY HEA? Well, it pays offs well, how old is she?","How OLD IS MY HEA? Well, it pays offs well, how old is she?"
 She will be 86 next month . ,She will be 86 next month and has just turned.,She will be 86 next month and has just turned.,She will be 86 next month and has just turned.,She will be 86 next month and has just turned.,"Next month after hitting 2 1/2 years, she'll be 86 years old.","Next month after hitting 2 1/2 years, she'll be 86 years old.",Next week after 86 kilomiles she is next month she turns 87 next year...
 That is truly amazing ! ,That's simply amazing!,That's simply amazing!,That's simply amazing!,That's simply amazing!,WOW!,WOW!,WOW!
I would like to register for a class today . ,I am interested in taking a class today and would like to register.,I am interested in taking a class today and would like to register.,"I would like to join a class today, can you assist me with the registration process?","I would like to join a class today, can you assist me with the registration process?",How m I enrol in a class?,How & when? I need to join a class today?,How & when? I need to join a class today?
" No problem , what class would you like to take ? ","I'm not a big fan of any specific classes, could you please inform me which ones you would like to take?","I'll be glad to help you decide on a course to study, but I can't say the class you're interested in. What's your favorite?","I'll be glad to help you decide on a course to study, but I can't say the class you're interested in. What's your favorite?","I'll be glad to help you decide on a course to study, but I can't say the class you're interested in. What's your favorite?",How you got orienteered - I'm not sure wid your class pick but I would like to know which one you'd like the most RIGHT now?,How you got orienteered - I'm not sure wid your class pick but I would like to know which one you'd like the most RIGHT now?,How you got orienteered - I'm not sure wid your class pick but I would like to know which one you'd like too?
 I would very much enjoy taking a Psychology class.Because I'm crazy . ,"I'm not sure how to handle taking a Psychology class, but I'm intrigued and wish to take it anyway because I'm feeling crazy.","I'd be incredibly keen to take a Psychology class, but I don't know if I would be cool enough to participate.","I'd be incredibly keen to take a Psychology class, but I don't know if I would be cool enough to participate.","I'd be incredibly keen to take a Psychology class, but I don't know if I would be cool enough to participate.","Because I'm crazy about taking a Psychology class, I would absolutely love it!","Because I'm crazy about taking a Psychology class, I would absolutely love it!","Because I'm crazy about taking a Psychology class, I would really like it."
 There are two classes that are still open . ,"Two classes are still open, and they are the second one.","Two classes are still open, and they are the second one.","Two classes are still obtainable, which are open for application.","Two classes are still obtainable, which are open for application.",Douching 2 classes.,Douching 2 classes.,Douch drew tww classes still neathed in two reemergency rmcns.
 Which days are these classes on ? ,What are the days of the week for these classes?,What are the days of the week for these classes?,What are the days of the week for these classes?,What are the days of the week for these classes?,How/ When?,How/ When?,How/ When?
 The first class is a Tuesday and Thursday class from two to three . ,Classes from two to three are held on Tuesdays and Thursdays in the first class.,Classes from two to three are held on Tuesdays and Thursdays in the first class.,Classes from two to three are held on Tuesdays and Thursdays in the first class.,Classes from two to three are held on Tuesdays and Thursdays in the first class.,Monday though Thursday i have class a two to three class.,Monday though frind Wednesday the first class i.e. from one day up nihilism one nd class is from two to three on tny Tuesday and thursday.,Monday though frind Wednesday the first class i.e. from one day up nihilism one nd class is from two to three on tny Tuesday and thursday.
 What about the other class ? ,What about the other class?,What about the other class?,What about the other class?,Can you explain the concept of the other class?,How'd you guys get the other class?,How'd you guys get the other class?,How' it supposed to do with the other class?
 The other class is on Monday and Wednesday from 10 am - 12 . ,The other class is available from 10 am to 12 pm on Monday and Wednesday.,The other class is available from 10 am to 12 pm on Monday and Wednesday.,The other class is available from 10 am to 12 pm on Monday and Wednesday.,The other class is available from 10 am to 12 pm on Monday and Wednesday.,Monday thru Wednesday 10:00 am EST & 2:30 ELSE on the other class.,Monday thru Thursday 9 am -12 pm ET ETERNARD & 12 am ET WEEKEND ENDING CLASS.,Monday thruWEEK from 10 am to 12 p.m. Other classes start everyday from Monday to play on all days.
 Are you sure there are no more open classes ? ,Are you convinced that there are no more open classes?,Are you convinced that there are no more open classes?,Are you convinced that there are no more open classes?,Are you convinced that there are no more open classes?,How real it you?? Were you sure there wont be any more open classes?,How real it you?? Were you sure there wont be any more open classes?,How real it you?? Were you sure there wont be any more open classes?
 I'm positive . ,I'm sure I can.,I'm confident that...,I'll be alarmed.,I'll be alarmed.,I can tell you that...,Am in thrall that...,Am in thrall that...
 Sign me up for Monday and Wednesday . ,Sign me up on Monday and Wednesday.,Be on my schedule for Monday and Wednesday.,Be on my schedule for Monday and Wednesday.,Be on my schedule for Monday and Wednesday.,Dont forget to sign me up on Monday and Wednesday.,Dont forget to sign me up on Monday and Wednesday.,Dont forget to sign me up on Monday and Wednesday.
" Okay , I'll sign you up . ","OK, I'll give you a signed up pass.","OK, I'll give you a signed up pass.","OK, I'll give you a signed up pass.","OK, I'll give you a signed up pass.",okay I'll sign you up.,okay I'll sign you up.,okay I'll sign you up.
"Dad , why are you taping the windows ? ","Dad, what is the purpose of you tapping the windows?","What is the reason for you tapping the windows, Dad?","What is the reason for you tapping the windows, Dad?","Father, what's the purpose of you covering the windows with tape?",Dad why you are tapping the windows? Why are you tapping them?,Dad why you are tapping the windows? Why are you tapping them?,Dad why you are tapping the windows?
" Honey , a typhoon is coming . ","A typhoon is approaching, honey be careful.","A. tychone is coming - honey, bear with me a bit ht.","A. tychone is coming - honey, bear with me a bit ht.","A. tychone is coming - honey, bear with me a bit ht.","Tyhyoons, typhoon honey, we're here to stay.","Tyhyoons, honey!","Tyhyoons, honey!"
" Really ? Wow , I don't have to go to school tomorrow . ",Is it true that I won't have to go to school tomorrow?,Is it true that I won't have to go to school tomorrow?,Is it true that I won't have to go to school tomorrow?,Is it true that I won't have to go to school tomorrow?,Really?? I don't have to go to school tomorrow?,Really?? I don't have to go to school tomorrow?,Really?? I don't have to go to school tomorrow?
