Sentence,Paraphrase,Formal_10,Formal_15,Formal_20,Informal_10,Informal_15,Informal_20
I have made up my mind . I am getting a tattoo . ,I am on the verge of getting a tattoo.,I am on the verge of getting a tattoo.,"I am about to get a tattoo, but I have sworn in.","I am about to get a tattoo, but I have sworn in.",Tattoo... I am so excited and I can't wait to get a tattoo...?,"Tattoo... I am so excited I want to get a tattoo...I have made up my mind and I know what if I do not want it to be in the future, I just want the tattoo.","Tattoo... I am so excited I want to get a tattoo...I have made up my mind and I know what if I do not want it to be in the future, I just want the tattoo."
 Really ? Are you sure ? ,Are you convinced that what you are reading is genuine? Do you have a clear sense of what you're reading?,Are you convinced that what you are reading is genuine? Do you have a clear sense of what it is?,Are you convinced that what you are reading is genuine? Do you have a clear sense of what it is?,Are you convinced that what you are reading is genuine? Do you have a clear sense of what it is?,Who & what really?,Who & what really?,Who & what really?
 Yeah ! Why not ? They are trendy and look great ! I want to get a dragon on my arm or maybe a tiger on my back . ,I'm not sure if you want to get a dragon on your arm or a tiger on your back - they're cool and all over the place.,"I'd love to see a dragon or tiger on my arm or back, even though they're cool and stylish.",I'd rather not have a dragon on my arm or tiger on mine because of how cute and interesting it is.,I'd rather not have a dragon on my arm or tiger on mine because of how cute and interesting it is.,How cool! I'm in love with dragons on my arm and tigers on mine - I like the idea of having one on either my back and my arms with a dragon theme.,How cool! I'm in love with dragons on my arm and tigers on mine - I like the idea of having one on either my back and my arms shaped like a dragon and one being more slender sized like an iguan or taiyote.,How cool! I'm in love with dragons on my arm and tigers on mine - I like the idea of dragon armour or tiger on top of that.
" Yeah but , it is something that you will have forever ! They use indelible ink that can only be removed with laser treatment . On top of all that , I have heard it hurts a lot ! ","I know it hurts, but it is a permanent issue! They use indelible ink that can only be eliminated with laser therapy. Additionally, it is known to cause severe pain.","Despite this being a lifelong hazard, they use indelible ink that can only be eliminated with laser therapy. Furthermore, I have heard that it causes significant pain.","Despite this being a lifelong hazard, they use indelible ink that can only be eliminated with laser therapy. Furthermore, I have heard that it causes significant pain.","Despite its permanence, the ink used is only erased with laser treatment, which is painful due to its indelible nature.",Well it hurts... but it is a permanent solution!! They use indelible ink that can only be removed with laser treatment.,Well it hurts... but it is a permanent solution!! They use indelible ink that can only be removed with laser treatment.,Well no... they're gonna use indelible ink that's a painless solution that can only be erased using laser--it hurts too bad
 Really ? ,Can you provide me with an answer?,Can you provide me with an answer?,Can you provide me with an answer?,Can you provide me with an answer?,Really...?,Really???,Really???
 Of course ! They use this machine with a needle that pokes your skin and inserts the ink . ,They use a needle-like device that inserts a needle through your skin and into the ink.,"They use a needle-like device that inserts inserted ink into the skin of the person and then into their own skin, of course, and they certainly do!","They use a needle-like device that inserts inserted ink into the skin of the person and then into their own skin, of course, and they certainly do!","They use a needle-like device that inserts inserted ink into the skin of the person and then into their own skin, of course, and they certainly do!",Well because they do!! This machine also nips the skin using.,Well because they do!! With a needle that pokes your skin and inserts the ink.,"Well because they do! They put a needle through... yea, it pokes your skin and inserts the ink."
" Oh , I didn ’ t know that ! I thought they just paint it on your skin or something . ",Oh my goodness! I thought maybe they painted it on their skin or something.,"Oh my goodness, I thought that was painted on your skin or something.","Oh my goodness, I thought that was painted on your skin or something.","Oh my goodness, I thought that was painted on your skin or something.",Ugh...I never heard of that...Maybe they just paint it on their skin...maybe not even close to your genitals...?,Ugh...I never heard of that...Maybe they just paint it on their skin...maybe not even close to your genitals...?,Ug I didn't know - maybe they paint it on their skin or something.
" I think you should reconsider and do some more research about tattoos . Also , find out where the nearest tattoo parlor is and make sure they used sterilized needles , and that the place is hygienic . ","I think you should reconsider and do some research before you go ahead with your tattoo. Also, where is the closest tattoo parlor, and do you use sterilized needles and maintain a clean facility?","I think you should reconsider and do some research before you go ahead with your tattoo. Also, where is the closest tattoo parlor, and make sure the needles are cleaned and used properly?","I think you should reconsider and do some research before you go ahead with your tattoo. Also, where is the closest tattoo parlor, and make sure the needles are cleaned and used properly?","I think you should reconsider and do some research before you go ahead with your tattoo. Also, where is the closest tattoo parlor, and make sure the needles are cleaned and used properly?",If you'rresnaz= where is the closest tattoo shop? ssh check the cleanliness n use sterilized needles.,If you'rresnaz= where is the closest tattoo shop? ssh check the cleanliness n use sterilized needles.,If you'rresnaz= where is the closest tattoo shop? ssh check the cleanliness n use sterilized needles.
 Maybe I should just get a tongue piercing ! ,Is it a good idea to consider getting a tongue piercing?,Is it a good idea to consider getting pierced with my tongue?,Is it a good idea to consider getting pierced with my tongue?,Is it a good idea to consider getting pierced with my tongue?,How I Wanna Get a Tongue Peircture?,How I Wanna Get a Tongue Peircture?,How I Wanna Get a Tongue Peircture?
"Excuse me , what's the screen near your steering wheel for ? ","What is the screen situated near your steering wheel, and what is its purpose?",Can you explain what the screen situated on the side nearest to your steering wheel is?,Can you explain what the screen situated on the side nearest to your steering wheel is?,Can you explain what the screen situated on the side nearest to your steering wheel is?,How big that LCD thingy in the corner next to your steering wheel?,How big that big screen that you just saw when you put it in the center of your steering wheel?,How big that big screen that you just saw when you put it in the center of your steering wheel?
 It's a portable TV . It's a popular thing now . ,The portable TV has become a popular item among consumers.,The portable TV has become a popular item among consumers.,The portable TV has become a popular item among consumers.,The portable TV has become a popular item among consumers.,One big one right now it is a portable telecaster...,One big one right now it is a portable telecaster...,One big one right now it is a portable telecaster...
" Oh , that's new to me . So what's on everyday ? ",What's the deal with this new kid on the block?,"What's the story behind ""what're you doing today?"" for someone who has never heard of it before?",I've never heard of this before. What's going on with your day?,I've never heard of this before. What's going on with your day?,How you guys getting your daily routine started? I know that's new to me.,How you guys got started this week?,How you get over me if I'm new to this?
" News about current affairs , documentaries , music , movies , noncommercial ads and so on . ","Current affairs, documentaries, films, music, noncommercial ads, noncommercial news, and more.","Current affairs, documentaries, films, music, noncommercial ads, and more.","Current affairs, documentaries, films, music, noncommercial ads, and more.","Current affairs, documentaries, films, music, noncommercial ads, and more.","Get the scoop you always want to know there's a lot more news about current events, news, documentaries, music, movies, nonsocial news etc.","Get in the loop on what' & don't eat, watch, write, get ire, break the news, and more.","Get indie-hit/new-flam/youtube/music/showbiz/ads/non-promotional/snail-busting/other"" All the news narrated news items i.e., news, documentary, music, movies, non-profit az ads and more!"
 Is there anything interesting ? ,Is there anything fascinating?,Is there anything fascinating?,Is there anything fascinating?,Is there anything fascinating?,How nay do you think?,How nay do you think?,How nay do you think?
" Yes , there are something good and informative . I think that many people underestimate the value of TV in education . ",There are some good and informative things to read about... But I think there's a big misconception in the world of TV that many people have failed to realize the value of TV in education.,"There are some good and informative things to read about. Despite this, I think that TV has a significant impact on education, but its importance is often underestimated.","There are some good and informative things to read about. Despite this, I think that TV has a significant impact on education, but its importance is often underestimated.","There are some good and informative things to read about. Despite this, I think that TV has a significant impact on education, but its importance is often underestimated.","Sure..., I see oodles on.!... but I think you're right - education doesn't really reinvest things in tv... So many people underestimate just how good it is because TV.","Sure..., I see oodles on.!... but I think you're right - education doesn't really reinvest things in tv... So many people underestimate just how good it was on TV.","Sure..., I see oodles on.!... but I think you're right - education doesn't really rewire a NETWORK like TV into education... almost all of us."
 I agree . Are there any commercials on the TV ? ,Is there any commercial airing on TV? I agree.,Is there any commercial airing on TV? I agree.,Is there any commercial airing on TV? I agree.,Is there any commercial airing on TV? I agree.,Ad knip? I agree bcz there are dvd commercials sxd tbd?,Ad knip? I agree bcz there are dvd commercials sxd tbd?,Ad knirpsp? I nab at all ads on tv ds?
 Of course . Because the TV stations need to make money from commercials between the programs . ,The TV stations are expected to make money from commercials between the programs.,The TV stations are expected to make money from commercials between the programs.,The TV stations are expected to make money from commercials between the programs.,The TV stations are expected to make money from commercials between the programs.,Because TV stations are commoditIES between programs.,Because TV stations are commoditIES between programs.,Because TV stations are commoditIES between programs.
 That makes a lot of sense . Does the TV work well ? ,Is the TV efficient in its operation? That sounds good.,Is the TV efficient in its operation? That sounds good.,Is the TV efficient in its operation? That sounds good.,Is the TV efficient in its operation? That sounds good.,"What it' gonna mean? I think that's pretty much correct. I mean does the tv really work?""","What it all means - ""well, I can see through my TV, and it should work""?","What it all means - ""well, I can see through my TV, and it should work""?"
 Not always . It depends on the transmission of the satellite signals . ,"The transmission of satellite signals is a determining factor in this. However, it may not be constant.","The transmission of satellite signals is a determining factor in this. However, it may not be constant.","The transmission of satellite signals is a determining factor in this. However, it may not be constant.","The transmission of satellite signals is a determining factor in this. However, it may not be constant.",Precious blizzard-ridDimmIll It depends.,Precious blizzzzard((S3) Depends n o'er depending on the satellites' signal(s) - ie.,Precious blizzzzard((Si+S/+ GNSS+E+++++) restraining things... but not always - it depends if the satellite signals are sent over ISS in order...
 I got it . Do you pay for the programs ? ,Is it your practice to pay for programs?,Is it your practice to pay for programs?,Is it your practice to pay for programs?,Is it your practice to pay for programs?,How you get it.. Do you pay for the programs?,How?,How?
" Yes , 50 Yuan per month . ",Is it true that I can earn 50 Yuan per month with a monthly budget of 50 Yuan?,Is it true that I can earn 50 Yuan per month with a monthly budget of 50.,Is it true that I can earn 50 Yuan per month with a monthly budget of 50.,Is it true that I can earn 50 Yuan per month with a monthly budget of 50.,If you know what they mean by that -50 Yuan a month...,If you know what they mean by that -50 Yuan a month...,If you know what they mean by that -50 Yuan a month...
"Oh , no ! ","Oh, no!","Oh, no!","Oh, no!","Oh, no!",U na!,U na!,U na!
 How dreadful ! ,How terrible is that :(,What a terrible thing to happen!,What a terrible thing to happen!,Quite a nightmare indeed!,Ugh...,Ugh...,Ug! Uh huh!!?
 Look at the view from the window . ,"View the window, and look out.","View the window, and look out.","View the window, and look out.","View the window, and look out.",Open that one thing and look out of it at that window...,Open that one thing out of the window and see what it's like.,Open that one thing out of the window and see what it's like.
" Oh , dear . That ’ s terrible . Not at all what I expected . ","Oh my God, that’s awful. Not even close to what I thought it would be.","Oh, my friend, that’s awful. Not even close to what I thought I could tell you.","Oh, my friend, that’s awful. Not even close to what I thought I could tell you.","Oh, my friend, that’s awful. Not even close to what I thought I could tell you.",Ha Ha! I'm so shocked ha ha Ha ha! That's so much worse than I thought it was.,Ha... Oh my! That's just not what I thought it would be.,Ha... Oh my! That's just not what I thought it would be.
" It ’ s awful , isn ’ t it ? ",Isn't that dreadful?,Is it not horrendous to think that it’s awful?,Is it not horrendous to think that it’s awful?,Is it not horrendous to think that it’s awful?,UrGH?,UrGH?,UrGH?
 I can ’ t bear to look at it . I ’ m rather disappointed . ,I can’t bear to look at it. It’s disappointing.,"I cannot bear to look at it, but I am quite disheartened.","I cannot bear to look at it, but I am quite disheartened.","I cannot bear to look at it, but I am quite disheartened.",I can't stand the idea it was up for me to look at... I'm a bit disappointed...,I can't stand the idea it was up for me to look at... I'm a bit let down.,I can't stand the idea it was up for me to look at... I'm a bit let down.
 It can ’ t be helped . ,There are no solutions available.,There are no solutions available.,There are no solutions available.,There are no solutions available.,Nobody gets it.,Nobody gets it done.,Nobody gets it done.
"What do you do in your free time , Nancy ? ","Nancy, what activities do you engage in during your leisure hours?","Nancy, what activities do you engage in during your leisure hours?","Nancy, what activities do you engage in during your leisure hours?","Nancy, what activities do you engage in during your leisure hours?",How you juggLE your time Nancy?,How you juggLE your time Nancy?,How you juggLE your time Nancy?
" Well , I like playing the violin . ",I have a passion for playing the violin.,I have a passion for playing the violin.,I have a passion for playing the violin.,I have a passion for playing the violin.,Well I really like that I can play violon...,Well I really like that I can play violon...,Well I just like to play the violin...
 Really ? How long have you been playing the violin ? ,What is your real name? How old are you at playing the violin?,What is your real name? How old are you at playing the violin?,What is your real name? How old are you at playing the violin?,Can you tell me about your violin playing? How long have you been playing for?,How old you got at violin mate?,How old you got at violin??,How old you got at violin??
 About ten years so far . I started learning when I was in middle school . ,"For about ten years, I have been learning for about a decade since I was in middle school.","For about ten years, I have been learning for about 10 years. I started learning in middle school.","For about ten years, I have been learning for about 10 years. I started learning in middle school.","For about ten years, I have been learning for about 10 years. I started learning in middle school.",Middle School broke it down and I started learning ten years back...,Middle School broke it down and I started learning ten years back...,Middle School broke it down and I started studying after ten and a half year gap... I am now 21 years old.
 That's really interesting . ,That's really interesting.,That's really interesting.,That's really interesting.,That's really interesting.,"Nice one, guys. I'm curious.","Nice one, guys, I'll be really interested.","Nice one, huh?"
 Sure . So what about you ? Do you have any hobbies ? ,What is your favorite thing to do?,What is your favorite thing to do?,Can you tell me about your leisure pursuits?,Can you tell me about your leisure pursuits?,Whos you? I would love if you could pick a pasteen?,Whos you? I would love if you could pick ONE hobby.,Whos you? I would love if you could pick ONE hobby.
" Well , I like collecting matchbox ! I'm not sure if that counts , though . ","I'm intrigued by matchbox collection, but I'm not convinced if it's a significant aspect.","I've always been fascinated by matchboxes, but I don't think it's a significant aspect of the hobby.","I've always been fascinated by matchboxes, but I don't think it's a significant aspect of the hobby.","I've always been fascinated by matchboxes, but I don't think it's a significant aspect of the hobby.",Dont know if you're right - I'm all about matchbox game collecting but I don't care...,Dont know if you're right - but I do btu I collect matchboxes d'unnit... :D)?,Dont know if you're right - but I do btu I collect matchboxes d'unnit... :D)?
 Of course it does . Everybody has his own hobby . ,"Naturally, it happens. Everyone has their own interests.","Naturally, it happens. Everyone has their own interests.","Naturally, it happens. Everyone has their own interests.","Naturally, it happens. Everyone has their own interests.",Everyone does it just like everyone else does... Everyone hatches their.,Everyone obviously goes down. Everyone chines in hats.,Everyone obviously juggies hath her one thing to do... Sure there'd still be stuff to sneeze at.
How can I tell her about this ? ,What's the best way to inform her of this?,What's the best way to inform her of this?,What's the appropriate way to let her know about this?,What's the appropriate way to let her know about this?,How I talk this stuff to her and tell her a little about me?,How & when I tell her about?,How & when I tell her about?
" Don't worry , you'll find a way . ",There's no need to worry about finding a solution.,There's no need to worry about finding a solution.,There's no need to worry about finding a solution.,There's no need to worry about finding a solution.,If you'm lucky... you won't be.,"If you'm wondering.... well, you can if you find a way....","If you'm in the loop... you can always re-do it, there's a solution."
 There is no need to be so frustrated . ,There is no reason to be so frustrated.,There is no reason to be so frustrated.,There is no reason to be so frustrated.,There is no reason to be so frustrated.,If you''RE so annoyed.,If you''RE so annoyed.,If you''RE so annoyed.
 How can you live without job in the future ? ,What are some ways to survive in the absence of a job in the future?,What are some ways to survive in the absence of a job in future?,What are some ways to survive in the absence of a job in future?,What are some ways to survive in the absence of a job in future?,How viable is it for someone to live off a job without any source of income?,How viable is it for someone looking to switch gears in life instead of constantly working 40+ job responsibilities?,How viable y ur opportuntnelity is in vitavita?
" Don't worry , you'll find a way . ",There's no need to worry about finding a solution.,There's no need to worry about finding a solution.,There's no need to worry about finding a solution.,There's no need to worry about finding a solution.,If you'm lucky... you won't be.,"If you'm wondering.... well, you can if you find a way....","If you'm in the loop... you can always re-do it, there's a solution."
What sports do you like to play ? ,What are your preferred sports to play?,Which sports do you have a preference for playing?,Which sports do you have a preference for playing?,Which sports do you have a preference for playing?,Whos sports you love playing & whats your favorite?,Whos sports you love playing & whats your favorite?,Whos sports you love playing & whats your favorite?
 I like baseball and basketball . ,Baseball and basketball are my preferred sports.,Baseball and basketball are my preferred sports.,Baseball and basketball are my preferred sports.,Baseball and basketball are my preferred sports.,If you'r a fan of baseball and basketball.,If you'r a fan of baseball and basketball.,If you know I like baseball and basketball then that is what you want to do.
 How about football ? ,Football?,What about football?,Can you share your thoughts on football?,Can you share your thoughts on football?,How nay do you feel about football?,How nay do you feel about football?,How nay do you feel about football?
" In my country football is brand new , so I never learned the game when I was younger . ","Football is a new phenomenon in my country, and I never learned the game when I was younger.","Football is a new phenomenon in my country, and I never learned the game when I was younger.","Football is a new phenomenon in my country, and I never learned the game when I was younger.","The game of football in my country is relatively new, and I never learned to play it as a child.","Because football in my country is a new game, my racial background is so different, and I never learned the game when I was younger.","Because football in my country is a new game, it was never gotten to know it in me because of my younger age, and I never knew football at all, even nay, never played the game.","Because football in my country is a new game, in when I was, I never learned football."
 It's a very popular game in America . ,America is a devoted fan of the game.,The game has a significant following in America.,The game has a significant following in America.,The game has a significant following in America.,Uglyfuck can suck the NES.,Uglies sucks at this game a lot in America...,Uglies sucks at this game a lot in America...
 Yeah . I heard a lot about it . Is it really that fun ? ,I heard a lot about it. Is that really that much of a fun activity?,I've heard a lot about it. Is it really that fun? I hear. It's actually quite fun.,I've heard a lot about it. Is it really that fun? I hear. It's actually quite fun.,I've heard a lot about it. Is it really that fun? I hear. It's actually quite fun.,Yeah I heard. It's a common topic but I'm starting to wonder if it'll ever be that fun?,Yeah I heard. It's a common topic but I'm starting to wonder if it'll ever be that fun?,Yeah I heard. It's a common topic but I'm starting to wonder if it'll ever be that fun?
" For me , it's one of those games that are fun to both watch and play . ",I find it to be one of those games that are enjoyable to watch and play.,I find it to be one of those games that are enjoyable to watch and play.,I find it to be one of those games that are enjoyable to watch and play.,I find it to be one of those games that are enjoyable to watch and play.,One game after game 2 that I can watch and play for fun... it's one of those games.,One game after game 2 that I can watch and play for fun... it's one of those games.,One game after game 2 that I can watch and play for fun... it's one of those games.
 Are you a football player ? ,Are you a football player?,Are you a football player?,Are you a football player?,Are you a professional football player?,How do I know & why do you like football?,How do I know & why do you like football?,How do I know who your soccer prodigy really I'm?
