Sentence,Paraphrase,Formal_10,Formal_15,Formal_20,Informal_10,Informal_15,Informal_20
"Say , Jim , how about going for a few beers after dinner ? ","Jim, can you please let me know your thoughts on having a beer and having a good conversation after dinner?","Jim, can you please let me know your thoughts on having a beer and having dinner?","Jim, can you please let me know your thoughts on having a beer and having dinner?","Jim, can you please let me know your thoughts on having a beer and having dinner?","How you guys? I'm planning on having a beer or something. Jim, what about you for dinner...?","How you guys is doing? I need to go out for a beer or something. Jim, what do you do after your meal?",How you guys is doing? I need to go out for a couple beers afternu doz. Jim jibe qld saj na me li koo w câ câ hu x dz?
 You know that is tempting but is really not good for our fitness . ,"Despite its tempting nature, it is not conducive to our fitness.",The idea of it being tempting but not conducive to our physical health is not appealing.,The idea of it being tempting but not conducive to our physical health is not appealing.,The idea of it being tempting but not conducive to our physical health is not appealing.,Fitbit addiction? Yummy! I know that's tempting but it'll hurt.,"Fitbit addiction? YUMMY - It's a good idea, but it'll be bad for you.",Fitbit addiction?
 What do you mean ? It will help us to relax . ,I'm not sure what you're talking about. It's a great way to unwind and unwind.,I'll be glad to hear it.,I'll be glad to hear it.,I'll be glad to hear it.,How would anyone know?...It would really help us relax.,How would anyone know what it means... It'll help you relax.,How to sumber it up? It's a great way on to get some chills.
 Do you really think so ? I don't . It will just make us fat and act silly . Remember last time ? ,Are you convinced of this statement? I don't believe it. It will only lead to weight gain and silly behavior.,Are you convinced of this statement? I don't believe it. It will only lead to weight gain and silly behavior.,Are you convinced of this statement? I don't believe it. It will only lead to weight gain and silly behavior.,Are you convinced of this statement? I don't believe it. It will only lead to weight gain and silly behavior.,How real you feasillie em? I hardly think so - I think it's going to fatten us up and make us all fat and do dumb things.,"Real people... I don't think so.. I'm not so sure. It'll make us fat, make our minds go crazy, and make silly mistakes.","Real people... I don't think so.. I know it will make us fat, it'll make stupid stupid things."
 I guess you are right.But what shall we do ? I don't feel like sitting at home . ,"I think you are correct, but what should we do? I don't feel like sitting at home any longer.","I think you are correct, but what should we do? I don't feel like sitting at home any longer.","I think you are correct, but what should we do? I don't feel like sitting at home any longer.","I think you are correct, but what should we do? I don't feel like sitting at home any longer.","How I wont be sitting at home anymore I guess you are right, but I don't even feel like sitting in.","How I wont be sitting at home anymore I guess you are right, but I don't even feel like sitting in.","How I wont be sitting at home anymore I guess you are right, but I don't even feel like sitting in."
 I suggest a walk over to the gym where we can play singsong and meet some of our friends . ,I propose going to the gym to play sing-along and socialize with friends.,I propose going to the gym to play sing-along and socialize with friends.,I propose going to the gym to play sing-along and socialize with friends.,I propose going to the gym to play sing-along and socialize with friends.,"If you'm gonna go to the gym, walk over there and we can go for a sing at one time place and maybe meet up with some of our friends at the sing-song!","If you'm gonna go to the gym, walk over there and we can go for a sing at one time place and maybe meet up with some of our friends at the sing-sing thing.","If you'm gonna go to the gym, walk over there and we can go for a sing at one time place and maybe meet up with some of our friends at the sing-sing thingy."
 That's a good idea . I hear Mary and Sally often go there to play pingpong.Perhaps we can make a foursome with them . ,That's a great idea. Mary and Sally often go there for a game of ping pong. Would it be possible to have a foursome with them?,That's a great idea. Mary and Sally often go there for ping pong and I'm wondering if we could arrange 'a foursome' with them.,That's a great idea. Mary and Sally often go there for ping pong and I'm wondering if we could arrange 'a foursome' with them.,That's a great idea. Mary and Sally often go there for ping pong and I'm wondering if we could arrange 'a foursome' with them.,"If you'r wondering, maybe Mary and Sally, who drive up there everyday just to play ping pong, and you could have a foursome with them. That's sassy, right?","If you'r wondering, maybe Mary and Sally, who drive up hill first mosh and play ping pong in the same area, and you could tie the knot with a foursome if you wanted to ask them out.",If you know that pedo and ping pong together then I think that's a great idea. Mary & Sally go there to eat Pedal and I imagine you'r maybe able to join in - maybe in foursome.
" Sounds great to me ! If they are willing , we could ask them to go dancing with us.That is excellent exercise and fun , too . ","I think that sounds wonderful!! If they are willing, we could ask them to dance with us, which is great exercise, great fun,and a great way to add some exercise.","I think that sounds wonderful! Besides, we could ask them to dance with us, which is a great way to get some exercise and to have merrymaking - it's also an excellent form of leisurely gratification.","I think that sounds wonderful! Besides, we could ask them to dance with us, which is a great way to get some exercise and to have merrymaking - it's also an excellent form of leisurely gratification.","I think that sounds wonderful! Besides, we could ask them to dance with us, which is a great way to get some exercise and to have merrymaking - it's also an excellent form of leisurely gratification.","Awesome!!!!!!!!!!!!!! If they want to join us, we can do a dance for them! That's great exercise and also it'll be fun!","Awesome!!!!!!!!!!!!!! If they want to join us, we can do a dance for them! That's great exercise and also it'll be fun!","Awesome!!!!!!!!!!!!!! If they want to join us, we can do a dance for them! That's great exercise and also it'll be fun!"
 Good.Let ' s go now . ,Good.Let's go for a good while.,Good.Let's go for a good while.,Good.Let's go for a good while.,Good.Let's go for a good while.,Nice now... Let's go.,Nice now... Let's go.,Nice now... Let's go.
 All right . ,All right.,All right.,All right.,All right.,Ur!,Ur!,Ur!
Can you do push-ups ? ,Are you able to do push-ups?,Are you able to do push-ups?,Are you able to do push-ups?,Are you able to do push-ups?,Push--UPS?,Push it- up or nip it?,Push it- up or it could you do it yourself!
" Of course I can . It's a piece of cake ! Believe it or not , I can do 30 push-ups a minute . ",I can do 30 push-ups in a minute - I know - I can do it a million times.,"I've learned that I can do 30 push-ups in a minute, and I think I have done it perfectly.","I've learned that I can do 30 push-ups in a minute, and I think I have done it perfectly.","I've learned that I can do 30 push-ups in a minute, and I think I have done it perfectly.",If you's looking hard out your mind and do 30 push-ups every 60 seconds then you know what kind of workout you can do - it'll happen in under an hour.,If you's looking hard out your mind you probably won't know that 30 push-ups in ten seconds actually WORKS!,If you add 30 push-ups - and I'll do it in one minute... 30 if you want to look more muscular.
 Really ? I think that's impossible ! ,Is it really impossible to do that? I doubt it!,Is it really impossible to do that? I doubt it!,Is it not possible for you to believe me? I doubt it at all.,Is it not possible for you to believe me? I doubt it at all.,Really??? I think it's impossible!,Really??? I think it's impossible!,Really??? I think it's impossible!
 You mean 30 push-ups ? ,What's the meaning of 30 push-ups?,Are you referring to 30 push-ups?,Are you referring to 30 push-ups?,Are you referring to 30 push-ups?,How you spell the count of 30 push-ups?,How you spell the count of 30 push-ups?,How you spell the count of 30 push-ups?
 Yeah ! ,Is it true?,Is it true?,Is it true?,Is it true?,Yeah...?,Yeah...?,Yeah...?
" It's easy . If you do exercise everyday , you can make it , too . ","It's uncomplicated. If you exercise daily, you can also make it easy.","It's simple. If you exercise daily, you can also make it easy.","It's simple. If you exercise daily, you can also make it easy.","It's simple. If you exercise daily, you can also make it easy.",Easy... If you do it every day you'd make it easy.,Easy... If you do it every day you'd make it easy.,Easy... If you do it every day you''ll be.
Can you study with the radio on ? ,Is it possible for you to use the radio to study with the radio on?,Is it possible for you to use the radio to study with the aid of a radio?,Is it possible for you to use the radio to study with the aid of a radio?,Is it possible for you to use the radio to study with the aid of a radio?,How you go to if you want to study using the radio on?,How you go to if you want to study using the radio on?,How you go to if you want to study using the radio on?
" No , I listen to background music . ","No, I don't listen to music in the background.","No, I don't listen to music in the background.","No, I don't listen to music in the background.","No, I don't listen to music in the background.","Backstage musias? Nah, no problem.","Backstage musias? Nah, no way.",Back in there I can listen to no.
 What is the difference ? ,What distinguishes the dissimilar?,What distinguishes the dissimilar?,What distinguishes the dissimilar?,What distinguishes the dissimilar?,Disrupti once!,Disrupti once!,Disrupti once!
 The radio has too many comerials . ,The radio has an excessive number of comerials.,The radio has an excessive number of comerials.,The radio has an excessive number of comerials.,The radio has an excessive number of comerials.,too funny on the radio because he has too many comers.,too funny on the radio because he has too many comers.,too funny on the radio because he has too many comers.
" That's true , but then you have to buy a record player . ","Yes, it's accurate, but then you have to buy a record player.","Yes, it's accurate, but then you have to buy a record player.","Yes, it's accurate, but then you have to buy a record player.","Yes, it's accurate, but then you have to buy a record player.",Yeah it depends if you can buy a record player too...,Yeah it depends if you can buy a record player too...,Yeah it depends if you can buy a record player too...
Are you all right ? ,Are you in the right place?,Are you in the right place?,Are you in the right place?,Are you in the right place?,"Ok I'm squibbish, mmm r u li tu dos?","Ok I'm squibbish, mmm r u li tu dos?","Ok I'm squibbish, mmm r u li tu dos?"
 I will be all right soon . I was terrified when I watched them fall from the wire . ,"I am going to be all right now. When I saw them fall from the sky, I was terrified.","I am going to be all right now. When I saw them fall from the sky, I was terrified.",I am going to be all right now.’ I was ‘terrified’ when I watched them come down from the wire.,"I am going to be all right soon. When I saw them fall from the sky, I was terrified.",Just wait till I am all right... I was terrified to see them fall from heaven's corner - I'm so afraid of it all the time.,Just wait till I am all right... I was terrified to see them fall from heaven's corner - I'm so afraid of it all the time.,Just wait till I am all right... I was terrified to see them fall from heaven's corner....
 Don't worry.He is an acrobat 。 ,He is an acrobat. Don't worry.He is acrobat too.,He is an acrobat. Don't worry.He is able to perform aerial tricks without any pain.,He is an acrobat. Don't worry.He is able to perform aerial tricks without any pain.,He is an acrobat. Don't worry.He is able to perform aerial tricks without any pain.,Dont worry.He is an acrobat.,Dont worry.He is an acrobat.,"If you'r wondering if he's acrobat, 'No doubt  He'll do it :) Don't worry.He'd be able to do croaking too!"
 I see . ,I see.,I witness.,I witness.,I witness.,Right on here I see 'em.,Right on here I see 'em.,Right on...
"Hey John , nice skates . Are they new ? ","John, I'm curious if you have any new skates for me to try out.","John, I'm curious if you have any new skates for me to try out.","John, I'm curious if you have any new skates for me to try out.","John, I'm curious if you have any new skates for me to try out.","Nice skater guys, does anyone know if these new skates are new?","Nice Skateboarding guys, I'm curious, do you know if they're new?","Nice Skateboarding guys, I'm curious, do you know if they's new?"
" Yeah , I just got them . I started playing ice hockey in a community league . So , I finally got myself new skates . ","I recently acquired new skates, which I'm happy with. I started ice hockey in a community league and got new skates just a few months ago.","I recently acquired new skates, which I'm happy with. I started ice hockey in a community league and got new ones just whith out some new tires.","I recently acquired new skates, which I'm happy with. I started ice hockey in a community league and got new ones just whith out some new tires.","I recently acquired new skates, which I'm happy with. I started ice hockey in a community league and got new ones just whith out some new tires.",Yeah I just got them. Finished ice hockey in a community league so I finally got my skates.,Yeah I just got them. Finished ice hockey in a community league so I finally got my skates.,Yeah I just got them. Finished ice hockey in a community league so I finally got my skates.
 What position do you play ? ,What is your preferred position?,What is your preferred position?,What is your preferred position?,What is your preferred position?,Whos in what position do you play?,Whos in what position do you play?,Whos in what position do you play?
 I ’ m a defender . It ’ s a lot of fun . You don ’ t have to be able to skate as fast on defense . ,"Being a defender is enjoyable. However, you don’t have to be lightning fast on defense.","Being a defender is enjoyable. However, you don’t have to be lightning fast on defense.","Being a defender is enjoyable. However, you don’t have to be lightning fast on defense.","Being a defender is enjoyable. However, you don’t have to be lightning fast on defense.","Because I'm a defender, it's pliable and fun. You don't have to play fast on defense.","Because I'm a defender, it's pliable and fun. You don't have to play fast on defense.","Because I'm a defender, it's pliable and fun. You don't have to play fast on defense."
" Yeah , you ’ re a pretty big guy . I play goalie , myself . ","I'm a goalkeeper and you're a pretty big guy, right?",I've been a goalkeeper for ages and I feel like I could be pretty good.,I've been a goalkeeper for ages and I feel like I could be pretty good.,I've been a goalkeeper for ages and I feel like I could be pretty good.,Yeah you crazed big guy.’ I’m a goalie myself.,Yeah you go... you’re gonna be a pretty big guy.’ I’m also claiming to be the goalie.,"Yeah I know you're a pretty big guy. I'm, and I work."
" Oh , yeah ? Which team ? ",What's the team? YES?,"What's the team? Y'know, yeah?","What's the team? Y'know, yeah?","Which team is on?  oh, huh?",Whos the team?,Whos the team?,Whos the team?
 The Rockets . ,Rockets.,The Rockets.,The Rockets.,The Rockets.,Rocketz.,Rocketz.,Rocketz.
" Really ? I think we play you guys next week . Well , I have to go to practice . See you later . ",Is it true? I believe we're playing together next week. I have to go to practice. See you later.,Is it true? I believe we're playing together next week. I have to go to practice. See you later.,Is it true? I believe we're playing together next week. I have to go to practice. See you later.,Is it true? I believe we're playing together next week. I have to go to practice. See you later.,"Really?...It's probably next week we're playing together. I'm joking to go to practice. Hopefully, we can see each other again.","Really did I just ask? I reckonwe'll play you guys next week? Wait, I can't go for practice... See you later.","Really did I just ask? I reckonwe'll play you guys next week? Wait, I can't go for practice... See you later."
" All right , see you later . ","All right, I'll see you later.","All right, I'll see you later.","All right, I'll see you later.","All the best, I'll see you later.","Ok I'm gonna say, I can't wait for you.","Ok I'm gonna say, I can't wait for you.","Ok I'm gonna say, I can't wait for you."
"Hey Lydia , what are you reading ? ","Lydia, can you tell me what you're reading?","Lydia, can you tell me what you're reading?","Lydia, can you tell me what you're reading?","Lydia, can you tell me what you're reading?",Nice one Lydia! :) What's up today?,Nice one Lydia! Just a question for you :).,Nice one Lydia! Just catching some some xD What's up there?
" I ’ m looking at my horoscope for this month ! My outlook is very positive . It says that I should take a vacation to someplace exotic , and that I will have a passionate summer fling ! ",Horoscopes: This month I have a very positive horoscope which says that I should go for a trip to a foreign country and have a fling or something with my significant other this summer - can you help me out if I'm wrong?,"My upcoming horoscope for the month of June is very positive, with a positive outlook on taking ostensibly exotic trips and summer flings!","My upcoming horoscope for the month of June is very positive, with a positive outlook on taking ostensibly exotic trips and summer flings!","My upcoming horoscope for the month of June is very positive, with a positive outlook on taking ostensibly exotic trips and summer flings!","Horrible! Just last month it was horoscope. It's very positive! It says that next month' I should go for a nerd trip to AZ, and besides that i would also have sex on sunday!",Horrible! Just in 2 weeks I would go for a trip to'somewhere exotic' and go on AN all-day summer fling!! This month's horoscope is very positive,Horrible! Just in 2 weeks I would go for a trip to'somewhere exotic' and go on AN all-day summer fling!! This month's horoscope is very positive
 What are you talking about ? Let me see that ... What are horoscopes ? ,Can you explain the concept of horoscopes?,Can you explain the concept of horoscopes?,Can you explain the concept of horoscopes?,Can you explain the concept of horoscopes?,Ur horoscope? Please explain,Ur horoscope? Please explain,Ur horoscope? Please explain
" It ’ s a prediction of your month , based on your zodiac sign . You have a different sign for the month and date you were born in . I was born on April 15th , so I ’ m an Aries . When were you born ? ",Is there a month and date in which you can predict based on your zodiac sign? I was born on April 15th and I am an Aries.,Is there a month and date in which you can predict based on your zodiac sign? I was born on April 15th and I am an Aries.,Is there a month and date in which you can predict based on your zodiac sign? I was born on April 15th and I am an Aries.,Is there a month and date in which you can predict based on your zodiac sign? I was born on April 15th and I am an Aries.,How I know what month it was for you based off your zodiac sign (I am Aries) I was born on 15th April and you have a different sign for the month and date of your birth?,"How I know what month it was for you based off zodiac sign - Aries or Moon, & Date. I was born on 15th April 1969 and I have a different zodion. Can you tell me your birth date if you were born in Arie on that date and month?","How I know what month it was for you based off zodiac sign - Aries or Moon, etc.... I was born on 15th April, so which zodion sign am I?"
 January 5th . ,January 5th marked the beginning of the current week.,January 5th marked the beginning of the current week.,January 5th marked the beginning of the current week.,January 5th marked the beginning of the current week.,1st. of YER.,1st. of YER.,1st. of YER.
" Let ’ s see . . . you ’ re a Capricorn . It says that you will be feeling stress at work , but you could see new , exciting developments in your love life . Looks like we ’ ll both have interesting summers ! ","Capricorn is a sign that indicates work-related stress, but also offers opportunities for love and romance.","Capricorn is a sign that indicates work-related stress, but also offers opportunities for love and romance.","Capricorn is a sign that indicates work-related stress, but also offers opportunities for love and romance.","Capricorn is a sign that indicates work-related stress, but also offers opportunities for love and romance.","Scorpion!! Work the stress out of you, but love the new girl! Summers are going to be so exciting!","Scorpion!! Work the stress out of you, but love the new girl! Summers are going to be so exciting!","Scorpion!! Work the stress out of you, but love the new girl! Summers are going to be so exciting!"
" That ’ s bogus . I don't feel any stress at work , and my love life is practically nonexistent . This zodiac stuff is all a bunch of nonsense . ","I don't experience stress at work, and I have no romantic life. All of this is a sham. This zodiac information is all bogus.","I've come to the realization that my zodiac signs are a hoax. I don't experience stress at work, and my love life is hardly ever present.","I've come to the realization that my zodiac signs are a hoax. I don't experience stress at work, and my love life is hardly ever present.","I've come to the realization that my zodiac signs are a hoax. I don't experience stress at work, and my love life is hardly ever present.","Dont worry, I can't stress out enough around people, their work... there's no love, no real life! Don'' t know what to think about all this zodiac stuff...?","Dont worry I don't stress out at work, and I feel like I can feasillade in love... all of this zodiac stuff is a hoax.","Dont worry I don't stress out at work, and I feel like I can feasillade in love... all of this zodiac stuff is a hoax."
" No , it ’ s not , your astrology sign can tell you a lot about your personality . See ? It says that an Aries is energetic and loves to socialize . ","Aries is a person who is energetic and enjoys socializing, according to astrology, but this can be a big deal because your zodiac sign can also tell you a lot about your personality.","Aries is a luminous sign who enjoys socializing, according to astrology, but this is not purely based on personal preference.","Aries is a luminous sign who enjoys socializing, according to astrology, but this is not purely based on personal preference.",A sign of Aries can be a great indicator of your personality as it can tell you if you are an energetic and social person.,How it all works - because an Aries is a really energetic person who loves to spend time together... or else it's not really important what your zodiac sign is telling you about your personality :/?,How it all works - because an Aries is a really energetic person who loves to spend time together... or else it's not really important what your zodiac sign is telling you about your personality :/?,How it all works - because an Aries is a really energetic person who loves to spend time together... or else it's not really important what your zodiac sign is telling you about your personality :/?
" Well , you certainly match those criteria , but they ’ re so broad they could apply to anyone . What does it say about me ? ","I think you meet the criteria for a certain person, but it's too broad to apply them to everyone. What does this say about me?","I've got some criteria that you meet, but they're so extensive that they could be used by anyone. What does this say about me?","I've got some criteria that you meet, but they're so extensive that they could be used by anyone. What does this say about me?","I've got some criteria that you meet, but they're so extensive that they could be used by anyone. What does this say about me?",How am I supposed to know that even though you meet a couple more crierile criteria based icily but if they apply to anyone besides me?,"How am one heckler know that... well you definitely meet some but your criterion are so broad that they could be true on any of them.... What does it say about me, exactly!","How am one heckler know that... well you definitely meet some but your criterion are so broad that they could be true on any of them.... What does it say about me, he/she also & everything I say, is a lot of data on me just because hey, I posted something similar but for someone who doesn't really matter what I said?"
