Sentence,Formal_15
"Say , Jim , how about going for a few beers after dinner ? ","Jim, can you suggest a few beers for me to have after dinner?"
 You know that is tempting but is really not good for our fitness . ,"Despite its tempting nature, it is not conducive to our fitness."
 What do you mean ? It will help us to relax . ,I'm not sure what you're talking about. It's a great way to unwind and unplug.
 Do you really think so ? I don't . It will just make us fat and act silly . Remember last time ? ,Is it true? I don't think so. It will make us fat and make silly mistakes.
 I guess you are right.But what shall we do ? I don't feel like sitting at home . ,"I think you are correct, but what should we do? I don't feel like sitting at home any longer."
 I suggest a walk over to the gym where we can play singsong and meet some of our friends . ,I propose going to the gym to have a sing-along session and meet some of our friends.
 That's a good idea . I hear Mary and Sally often go there to play pingpong.Perhaps we can make a foursome with them . ,I think that's a good idea. Mary and Sally often go there for ping pong and I hear they play there often. Would it be possible to have solitary time with them?
" Sounds great to me ! If they are willing , we could ask them to go dancing with us.That is excellent exercise and fun , too . ","I think that sounds wonderful! Besides, we could ask them to join us in dancing, which is a great way to get some exercise and also enjoy the company."
 Good.Let ' s go now . ,Good. Let's go.
 All right . ,"I'm not sure if it's okay, that'll be fine."
Can you do push-ups ? ,Do you have the ability to do push-ups?
" Of course I can . It's a piece of cake ! Believe it or not , I can do 30 push-ups a minute . ",I can do 30 to 60 push-up minutes in a minute and I think I'm doing that.
 Really ? I think that's impossible ! ,I'm not sure if I can say it perfectly. Is that really possible?
 You mean 30 push-ups ? ,Is it accurate to say 30 push-ups?
 Yeah ! ,"Is it possible to say ""yes""?"
" It's easy . If you do exercise everyday , you can make it , too . ","I mean, you can make it easy by doing it every day."
Can you study with the radio on ? ,Is it possible for you to use the radio to study with the aid of a radio?
" No , I listen to background music . ","No, I don't listen to music in the background."
 What is the difference ? ,What distinguishes the dissimilar?
 The radio has too many comerials . ,"There are an excessive number of comerials on the radio, too."
" That's true , but then you have to buy a record player . ","Yes, it's accurate, but then you have to buy a record player."
Are you all right ? ,Is it true that you are satay?
 I will be all right soon . I was terrified when I watched them fall from the wire . ,I'm sure I will be fine soon. I was frightened to see them fall from the sky.
 Don't worry.He is an acrobat 。 ,"I think he's a good crooner. There're no remorse in my eyes, but I can't help but notice that."
 I see . ,I see.
"Hey John , nice skates . Are they new ? ","I've heard good things about your skates, John. Are these new, new skaters?"
" Yeah , I just got them . I started playing ice hockey in a community league . So , I finally got myself new skates . ","I recently acquired new skates, which I'm a ice hockey rinkr who started in."
 What position do you play ? ,What is your preferred position?
 I ’ m a defender . It ’ s a lot of fun . You don ’ t have to be able to skate as fast on defense . ,"I'm a defender and it's piqued my interest. You don't have to be lightning fast on defense, though."
" Yeah , you ’ re a pretty big guy . I play goalie , myself . ",I'm a goal-setter and I think you're essentially slender.
" Oh , yeah ? Which team ? ","Which team do you think is the best fit for, oh please, the right team?"
 The Rockets . ,A group of The Rockets.
" Really ? I think we play you guys next week . Well , I have to go to practice . See you later . ",I'm assuming we'll play against each other next week. I have to go to practice. See you later.
" All right , see you later . ",I'll be back later.
"Hey Lydia , what are you reading ? ","Lydia, can you tell me what you're reading?"
" I ’ m looking at my horoscope for this month ! My outlook is very positive . It says that I should take a vacation to someplace exotic , and that I will have a passionate summer fling ! ","My horoscope for the following month is very optimistic, and it suggests that I should take a trip to unforeseen places and have sex this summer. I can also share my upcoming romantic plans for next month!"
 What are you talking about ? Let me see that ... What are horoscopes ? ,What is your perspective on horoscopes? Let me enlighten you on what they mean.
" It ’ s a prediction of your month , based on your zodiac sign . You have a different sign for the month and date you were born in . I was born on April 15th , so I ’ m an Aries . When were you born ? ","I'm wondering when you were born, considering that you have a different zodiac sign for the month you are born in and your zodic month is April 15th."
 January 5th . ,January 5th marked the beginning of the current week.
" Let ’ s see . . . you ’ re a Capricorn . It says that you will be feeling stress at work , but you could see new , exciting developments in your love life . Looks like we ’ ll both have interesting summers ! ","Capricorn, it means that you will experience work-related stress, but you may experience exciting new experiences in your love life, and we both look forward to having exciting summers!"
" That ’ s bogus . I don't feel any stress at work , and my love life is practically nonexistent . This zodiac stuff is all a bunch of nonsense . ","I'm not experiencing any stress at work or in a committed relationship, so I don't think this zodiac information is accurate. It's all phony."
" No , it ’ s not , your astrology sign can tell you a lot about your personality . See ? It says that an Aries is energetic and loves to socialize . ","Aries is an aristocratic sign that enjoys socializing, but it's not purely based on astrology, which can reveal much about one' s personality."
" Well , you certainly match those criteria , but they ’ re so broad they could apply to anyone . What does it say about me ? ","I'm sure you meet those criteria, but it's a broad range of criteria that could be interpreted by anyone. What does this imply about me?"
 A Capricorn is serious-minded and practical . She likes to do things in conventional ways . That sounds just like you ! ,Capricorn is an astute and pragmatic persona. She enjoys doing things in a conventional manner. Sounds like you could be referring to me!
"Frank ’ s getting married , do you believe this ? ","Is it your belief that Frank is getting married, as he is rumored to be?"
 Is he really ? ,Is he truly sincere?
" Yes , he is . He loves the girl very much . ","Yes, he is. He has a great love for the girl."
 Who is he marring ? ,Is there a person he is attempting to misrepresent by mutilating?
" A girl he met on holiday in Spain , I think . ",I believe he met a girl en route to Spain during.
 Have they set a date for the wedding ? ,Is there a tentative date for the wedding?
 Not yet . ,I haven't acted yet.
I hear you bought a new house in the northern suburbs . ,I heard that you have recently acquired a new property in the northern suburbs.
" That ’ s right , we bought it the same day we came on the market . ",We acquired it on the day we went on our first day of the market.
 What kind of house is it ? ,What is the classification of the house?
 It ’ s a wonderful Spanish style . ,A delightfully Spanish way of doing things.
" Oh , I love the roof tiles on Spanish style houses . ","Oh, I love the Spanish style of houses with their roof tiles."
 And it ’ s a bargaining . A house like this in river side costs double the price . ,A two-for-one bargain is the solution when a house like this on the river side is twice as expensive.
" Great , is it a two bedroom house ? ","Is this house, which has two bedrooms, a two-bedroomed dwelling?"
" No , it has three bedrooms and three beds , and has a living room with a twelve-foot ceiling . There ’ s a two-car garage . ","No, it doesn't, as it has three bedrooms and three beds, and a living room with ice twelve feet ceiling. Additionally, there's onsite sand parking for two cars."
 That ’ s a nice area too . It ’ ll be a good investment for you . ,That's a lovely place as well. It'll be advisable to invest in that area.
" Yeas , when will you buy a house ? ","When do you plan to buy a house, as I understand it?"
" Not untill the end of this year , you know , just before my wedding . ","I'm assuming it's not until late next year, right before my wedding."
" Right , congratulations . ","Well, congratulations."
 Thank you . ,I appreciate your response.
"Hi , Becky , what's up ? ","Hi, Becky - what's the latest news?"
" Not much , except that my mother-in-law is driving me up the wall . ","I'm doing okay, except for the fact that my mother-in-law is putting a significant portion of my energy into being."
 What's the problem ? ,What's the matter?
 She loves to nit-pick and criticizes everything that I do . I can never do anything right when she's around . ,"I can't do any good work around her, but she has a tendency to criticize everything and pick up flaws when I don''."
 For example ? ,What is an example of?
" Well , last week I invited her over to dinner . My husband and I had no problem with the food , but if you listened to her , then it would seem like I fed her old meat and rotten vegetables . There's just nothing can please her . ","I invited her for dinner last week and although she was fine with us, if you listen carefully, she will think that I fed her old meat and rotten vegetables. There's no telling what she wants."
" No , I can't see that happening . I know you're a good cook and nothing like that would ever happen . ",I can't imagine that happening. I know you're a good cook and that's not happening with me.
 It's not just that . She also criticizes how we raise the kids . ,"In addition to that, she also slams our parenting style."
" My mother-in-law used to do the same thing to us . If it wasn't disciplining them enough , then we were disciplining them too much . She also complained about the food we fed them , the schools we sent them too , and everything else under the sun . ","My mother-in-law and I used to discipline our children too much, but now we're facing a lot of criticism from each other. She also expressed concern about the food we fed them, the schools we sent them to, and everything else that went wrong."
 You said she used to ? How did you stop her ? ,What measures did you take to stop her from doing what you said she used to do?
" We basically sat her down and told her how we felt about her constant criticizing , and how we welcomed her advice but hoped she'd let us do our things . She understood , and now everything is a lot more peaceful . ","We discussed our feelings towards her constant criticism and offered her counsel, but ultimately she accepted and everything is now calmer."
 That sounds like a good idea . I'll have to try that . ,I'm willing to give it a try. That sounds like sănătious. Thanks.
How are Zina's new programmers working out ? ,What is the progress report for Zina's new programmers in terms of their performance?
" I hate to admit it , but they're good . And fast . The Filipino kid is a genius . ","I'm not sure I believe it, but they're good and fast. The Filipino kid is a true thinker."
" So you'll make the Stars.com deadline , and have us up and running next week ? ",We're hoping you can get us up and running on Stars.com next week by using the deadline. Do you have your back?
" It'll be close , but we'll make it . ","We'll make it, but it's a close call."
" Good . After Stars.com starts paying us , we won't need Vikam's cash anymore . ","We'll be able to pay Vikam's cash once they start paying us, but it'd be good to have Stars.com pay us."
" And if we don't need them , we won't need Zina , either . ","We don't need them, but we don’t even need Zina."
Do you like cooking ? ,Is it your nature to cook?
 Yes . I like cooking very much . I got this hobby when I was 12 years sold . ,I have a passion for cooking and I started having sat for 12 years when I was sold.
 Why do you like it ? ,What is it about this that you find appealing?
 I have no idea . I like cooking by myself . I like to taste delicious food . ,I have no idea. I enjoy cooking by myself and I like to taste delectable dishes.
 That's wonderful ! ,That's really cool!
" And I love trying new recipes , which I usually test with my friends . You can come , too . ","I have a fondness for trying out new recipes, especially ones that I usually share with my friends. I welcome you to join me too."
 Really ? I hope I can have a chance to taste it . Don't forget to tell me . ,"Is it possible for you to give me a taste of this dish? If not, please let me know."
 Certainly . ,Certainly.
Anyone home ? Jen ! ,"Jen, are you currently at home with any of you? I'm curious if anyone here has any home-based contacts or a nearby relative who can help me?"
 I'm in the kitchen ... let yourself in ! ,I'm in the kitchen... enter 'I've come to the clinch - let's have some fun!
 Wow ! You're really working up a storm ! ,"I really like what you're up to! I think you have some real good stuff to say about it :( ) And I thought I was going to take a picture with you and put my writing together as if on tv with X. I believe I saw you as an inspiration, but then I realized I didn't realize until later that although I wanted to give it to you, it was just BSBS that the name was implied, I mean"
 I know . I've even worked up a sweat . ,I've pushed myself to the brink. I know. Those are some tough times.
 You look like a cooking show host--only messier . ,"Despite being a mess, you still look like if you were on t.v. With some slap and some elbow grease, but your appearance is more like that of Mauricio Batlle."
You look so tan and healthy ! ,Y'all look so sass and a hygie?
 Thanks . I just got back from summer camp . ,Thanks for the reminder. I just got back from summer camp.
 How was it ? ,What was your experience like?
 Great . I got to try so many things for the first time . ,I got to experiment with many things for the first time.
 Like what ? ,What is the question?
" I went sailing , fishing , and horseback riding . ","I engaged in sailing, fishing, and horseback riding."
 I ’ m so jealous . ,I'm feeling envious – I can't help but feel jealous too.
 The counselors were so nice too . It was the best summer ever . Except for all those mosquitoes ! ,"I've been to a few schools and stayed with my counselor for the summer. The summer was fantastic, except for mosquito bites."
"Diana , do you like the perfume I gave you ? ","I'm wondering if you find the perfume I gave you, Diana - do you like it?"
" It ’ s good . But to tell you the truth , I don ’ t wear perfume . ",I'm okay with that. But I don't really wear perfume.
 I ’ m sorry . I didn ’ t know that . ,I didn't realize until later that I had.
 That ’ s all right . Thank you all the same . ,I'm okay with that. Thank you very much.
"Ah , ah , ah ... ","Ah, ah. :... oh, dear!"
" All right , Bill.Here ' s your daily exercise schedule . You are to jog before breakfast . ","I'm curious about your daily exercise routine. Ideally, you should jog before breakfast. Bill, thank you for your insight."
 Jog ? ,Is jogging something that you know about?
" Then , you are to walk to work . ","Afterward, you must make your way to work by walking to your office."
 Walk ? ,Is it possible to take a walk?
 Thirty minutes in gym at lunch time . ,"At lunch time, spend thirty minutes in the gym."
 Oh no . ,Oh no.
" Use the stairs , never the elevator . ","To avoid the hassle, use the stairs instead of the elevator."
" Oh , dear . ","Oh, my goodness, what a relief."
" And three times a week , you can either swim , play racketball , or hand ball . ","Three times a week, you can choose to swim, racketball, or handball as your leisure activity, and more."
 Oh no . ,Oh no.
" OK , you can stop now.It ' s time for the dance class . ","OK, you can stop right away, but it's time to go to the dance class."
 Dance class ! I don't know how . ,I'm at a loss for how to proceed with completing - I can't recall how I joined 'cafe' in dread class.
 You will . ,You will.
 Oh ... ,Oh...
"Hi Bill , I saw your grandma yesterday . ","Hi Bill, I saw your grandma yesterday."
 Oh where was that ? ,Where can I find that?
 I was running around the track at my college and there she was walking around the same track . ,"I was running around the av at my alma mat, but there was likewise her walking around that same track."
 Grannie always tries to stay fit and healthy.She is always making us kids eat the proper foods . ,"Grazie is a committed and diligent person who strives to maintain optimum health and fitness, and is frequently urging her children to eat as they please."
" Well , it pays off for her.How old is she anyway ? ","I'm wondering how old she is at at the moment, but it's worth remembering."
 She will be 86 next month . ,Her upcoming month of 86 years will see her reaching the age of 85.
 That is truly amazing ! ,"I'm really, really impressed!"
I would like to register for a class today . ,I'd like to sign up for a class today.
" No problem , what class would you like to take ? ","I'm not sure what class you want to take, can you suggest one?"
 I would very much enjoy taking a Psychology class.Because I'm crazy . ,"I'm interested in taking a Psychology class, but I don't think I would be cool enough."
 There are two classes that are still open . ,"Two classes are currently being offered, but they are not fully booked."
 Which days are these classes on ? ,What are the days of the week for these classes?
 The first class is a Tuesday and Thursday class from two to three . ,Classes from two to three are held on Tuesdays and Thursdays in the first class.
 What about the other class ? ,What about the other class?
 The other class is on Monday and Wednesday from 10 am - 12 . ,"On Monday and Wednesday, the other class is available from 10 am to 12."
 Are you sure there are no more open classes ? ,Are you convinced that there are no more open classes?
 I'm positive . ,I'm sure I can.
 Sign me up for Monday and Wednesday . ,I'll be taking a break on Monday and Wednesday.
" Okay , I'll sign you up . ","OK, I'll give you a signed up pass."
"Dad , why are you taping the windows ? ","What is the reason for you tapping the windows, my dear father?"
" Honey , a typhoon is coming . ","A typhoon may be approaching, as indicated by the recent reports of the event."
" Really ? Wow , I don't have to go to school tomorrow . ",Is it true that I don't have to go to school for the day tomorrow?
" Jenny , come and help , we need to prepare more food . ","Help us prepare more food, Jenny, come and help us."
 OK . Dad ! I'm coming . ,OK. Dad! Come on in.
"Hi , my name is Lean , and I'm from Russia . ","Hi there, my name is Lean from Russia."
" Nice to meet you , Lean . My name is Alike . I'm from Japan . ","Hello, I'm Lean from Japan. My name is Alike and I came from there."
 To me English is a difficult language . ,I find English to be a difficult language to master.
 A second language is always difficult . ,Learning a second language is arduous.
" True , but English is harder than most . It's a crazy language . ","Although English is a challenging language, it is more difficult than other languages. It's incredibly hard to get fluent in – it'll take 3-5 years to master X."
 A crazy language ? Why do you say that ? ,A language that's a bit crazy? What're the reasons behind that?
 One letter can have several pronunciations and one word can have several meanings . ,A letter can have multiple pronunciations and a single word can hold multiple meanings.
 No wonder you say English is a crazy language . ,No wonder you say English is a language that's thrown off course.
Can I help you ? ,Is there any way I can assist you?
" I hope so . I'm looking for some material for a paper I'm writing , and I'm not quite sure where to look . ",I'm struggling to find suitable material for my writing assignment. Can you provide some guidance?
 I'll certainly try to help you . What topic is your paper on ? ,I'll give it my best shot and assist you. What is the subject of your paper?
 My paper is on the influence of television on children . ,My article investigates the impact of television on children.
 There are several possible sources you might use for that topic . I suggest you use the computer and the computer will give you a list of every scientific journal that talks about children and television . ,"There are many sources you can use to explore the topic of children and television, but the most likely is the computer, which will give you a list of all scientific journals that cover the subject."
 Thank you for you help . ,I am grateful for your help and want to express my appreciation.
Here ’ s your hot dog and beer . What happened ? Did I miss anything ? ,Is there anything I missed out on? I'm curious about what happened between hot dogs and beer.
" Yeah , Cal Ripen just hit a home run . ","Well, Cal Ripen had a home come and hit."
 What ’ s the score ? ,What is the numerical value of the score?
" Well it was 3 to 4 , but Ripen ’ s home run made it 5 to 4 since another player was on first base . ","Ripen's home long home did not make the score 3 to 4, but it was eventually 5 to 4 when he made it two by going to first base and another player was out on the bases."
 So Baltimore is winning ? ,Is it accurate to say that Baltimore is the victor in the upcoming state?
 Right . ,Irrespective.
 This is a really great place to watch a baseball game . ,This is an excellent location to view a baseball game.
" Yeah , there isn ’ t a bad seat in the place . ",There's no doubt that there is a decent seat in the place.
" The fans are great here , too . Not like in Philadelphia . ","Although not as popular as Philadelphia, the fans are friendly and there's a good atmosphere here."
 It was a great idea to spend a day watching a game . ,I thought it would be great to watch a game for 'the game' for the day.
" Yeah , it reminds you why they say baseball is America ’ s favorite pastime . ",I'm reminded of the fact that baseball is considered America's most cherished hobby.
How do you like the pizza here ? ,What's your opinion on the pizza you're seeing?
 Perfect . It really hits the spot . ,I'm in awe of this one - it's spot on. Perfect.
Do you have a light ? ,Is there a light available in your residence?
" Sorry , I don't smoke . ","I'm sorry, I don't smoke."
I was scared stiff of giving my first performance . ,I was nervous about putting on my first performance due to my fear of proving to be a shaky and unprepared performer.
 Were you ? your performance was excellent . ,Were you able to do so? Your performance was outstanding.
 Thank you for your kindly words . ,I appreciate your kind words and many thanks for your time and effort.
Excuse me . Could you please take a picture of us with this camera ? ,I'm wondering if you could take a picture of us with this camera.
 Sure . Which button do I press to shoot ? ,I'm unsure which button to press to start the shoot. Can you provide guidance?
 This one . ,This one.
 Do I have to focus it ? ,Is it necessary for me to concentrate on it?
" No , this is a focus-free camera . All you have to do is point and press the button . ","This is a focus-free camera, so you can use it with your other hand by simply pointing and pressing the button."
 All right . Say cheese ! ,"I'll give you the ""good stuff."" Good. Cheese!"
Every country should face the history . ,History must be confronted by every country.
" Yeah , we don ’ t live in the vacuum . We have traditional values and long but different history . ","We have a long and varied history and traditional values, but we don't live in emptiness."
" Sometimes , we , human beings , really had done something wrong , so we should admit it at first . ","Sometimes, we as humans have made mistakes, and we may not be ready to accept it at first."
 But there is always somebody who wants to turn his back on the true history . ,"Nevertheless, there is always a person who wishes to turn their back on the authentic history."
" I believe such things won ’ t be realized , just daydreaming . ","I don't think such things will ever be real, just imagining."
"Do you like traveling , Kathy ? ","Kathy, do you have a preference for traveling as compared to other people?"
" I like traveling for pleasure to get places for vacation for instance . But I don ’ t like traveling to work , waiting for buses , or ... ","I have a fondness for traveling, whether to work, play on the train, or go on errands. However, I don’t enjoy traveling to the office, waiting for trains, and relying on waiting staff."
 Or getting stuck in traffic jams when you ’ re driving . ,Getting stuck in a rut while driving or getting stuck at horns.
 Exactly . ,In fact Exactly.
Your house is too small . Why not buy a big one . ,Your house may be too little for you. So why not consider purchasing a big one?
 I do wish I could afford one . ,I wish I could purchase a.
 You can get a loan from the bank . You know LPF program provides low cost loans for participants home purchases . ,"In the LPF program, participants can obtain a low-cost loan from ICICI Bank for their home purchases."
