Sentence,Formal_15
 Of course I know that . But don't you notice that the house price is skyrocketing ? ,"I understand your point about how much the house price is going up in the market, but I'm also aware that it's going to be a significant price to pay."
"How do you do , Prof.Smith . ","How do you do, Prof.Smith."
" How do you do , Ms . Yang.You speak very good English . ","Ms. Yang, your English is very swt. How would you like to answer this M?"
 Thank you . I begin to like English even when I was a child . ,"I appreciate your efforts. Even as a child, I developed sensitivity to the language and English."
 Where did you learn it ? ,Where did you gain the knowledge you are currently seeking?
" At school , in China.This is my first time to be out of my own country . ","I'm currently in China as a Chinese student, and this is the first time I have been away from home for  one year."
 It's amazing . ,I'm awestruck.
Do you want black or white coffee ? ,"Which type of coffee do you prefer, black or white?"
" White , please ","I'm hoping for a message from Mr. White, White is White, please read more."
 Look ! there's a Folk concert tomorrow evening . Do you Want to go ? ,Folk music: Do you happen to be able to go to a Folk concert tomorrow evening?
 I don't like Folk music very much . ,I'm not a big fan of Folk music.
 What kind of music do you like ? ,What type of music do you typically listen to?
 I like classical music . Do you ? ,Is it possible for you to enjoy classical music like I do?
 Not very much . Classical music sends me to sleep ,I'm not very fond of it. I find myself falling asleep to classical music.
 I don't believe you . ,I doubt your sincerity.
 It ’ s true . ,It’s accurate.
 You are funny ! ,I find you funny!
 So are you ! How about another coffee ? ,"I'm glad you're having another cup of coffee, too."
What do you like to do in your spare time ? ,What is your preferred way to spend your spare time?
 I like playing chess . ,I have a fondness for chess and I enjoy playing it.
 Do you have any hobbies besides playing chess ? ,"Apart from playing chess, do you have any other hobbies or pastimes?"
 I'm afraid not . ,I'm afraid I don't.
 Do you have any hobbies like playing tennis or things like that ? ,"Is there anything else you enjoy, like playing tennis or anything similar?"
" Oh , yes . I like playing basketball . ",I'm a basketball enthusiast.
 Can you tell me why you like it ? ,What's the reason behind your fondness for it?
 Because I like the feeling of cooperating with others . ,I find solace in being able to work with others.
Where is John ? I can't find him anywhere . ,I'm having trouble locating John. Is there anyone who can help me find him?
 Haven't you heard that he is in prison ? ,Is it not true that he is currently in jail?
 What ? Beg your pardon . ,I ask you to grant me mercy.
 John is in prison now . He was copped outstealing . ,"John, who was a thief with policing, is presently incarcerated."
 I just cann't believe my ears ! ,I'm having a hard time believing what I just heard!
Can I help you ? ,Is there any way I can assist you?
" I hope so . I'm looking for some material for a paper I'm writing , and I'm not quite sure where to look . ",I'm struggling to find suitable material for my writing assignment. Can you provide some guidance?
 I'll certainly try to help you.What topic is your paper on ? ,I'll do my best to assist you. What topic would you recommend for your paper?
 My paper is on the influence of television on children . ,My article investigates the impact of television on children.
 There are several possible sources you might use for that topic . I suggest you use the computer and the computer will give you a list of every scientific journal that talks about children and television . ,"There are many sources you can use to explore the topic of children and television, but the most likely is the computer, which will give you a list of all scientific journals that cover the subject."
 Thank you for you help . ,I am grateful for your help and want to express my appreciation.
"Hey , Ted . What are you up to this Friday ? ","Hey there, Ted. Can you tell me what's happening with you on Friday?"
" Well , I have the day off from work . ",I have a day off from my responsibilities at my job.
 That ’ s great ! Do you have any plans ? ,I think that's great! What are your plans for today?
" Well , I ’ Ve been working so hard lately , so I ’ ll probably just take it easy . ",I'll probably take a break from working on errands since I haven't been able to make the most of my time.
 Sounds nice . ,I'm thinking it sounds lovely.
" Yeah , I ’ ll probably just stay in and relax . Maybe watch a few movies . ","I'll probably just sit back and enjoy myself, maybe watching a few movies."
 Can I stop by ? ,Is it possible for me to visit you?
 Sure . Any time . ,At any time. Sure.
You honestly believe the world ’ s improving every year ? ,Do you really think that the world is getting better with each passing year?
" Yes , I do . I think that science is making us wiser . What do you think ? ",Is it accurate to say that science is making us more intelligent?
 I don ’ t think you ’ re right there . ,I don’ t think you’re right there.
 I believe industry is making us wealthier . ,I think that industry is a driving force behind our economic growth.
 I don ’ t believe that . ,I don’ t think that...
" And in my opinion , medicine is making us healthier . ",I think that medicine is actually making us feel better.
" I agree with you in the sense . But we ’ re all more miserable than ever , aren ’ t we ? ","I think I understand your point, but I also think we're all experiencing more misery right now, isn't it?"
" I don ’ t agree with you . I maintain that we ’ re healthier , wealthier and wiser than we were a hundred years ago . ","I disagree with you. I believe that we are now a better, wealthier, and more intelligent society than we were 100 years ago."
 That ’ s your opinion not mine . ,"I'm not stating that as an individual, but rather that it's your opinion."
What do you plan to do for your birthday ? ,What are your plans for your birthday celebration?
" I want to have a picnic with my friends , Mum . ","I'm looking forward to a picnic with my dearest friend, Mum."
 How about a party at home ? That way we can get together and celebrate it . ,Is it possible to have a party at our house and hold.
" OK , Mum . I'll invite my friends home . ","OK, Mum. I'll bring my friends a bb and boo."
How may I help you ? ,In what ways can I assist you?
 I would like to return this book . ,I want to give this book back.
 Is that all you need ? ,Is that all that's required of you?
 I also want to check out this video . ,I also want to watch this video.
 Is that all you would like to check out ? ,Is that all that matters to you?
 That ’ s all I need . ,That's the sole thing I'll ask for.
 Do you have your library card ? ,Is it possible for you to keep a record of your library card information?
 Here it is . ,Here it is.
 Make sure to take proper care of this video . ,Ensure that you maintain the care required for this video.
 That won ’ t be a problem . ,There's no need to worry about that.
" If you damage the video , you will be fined . ",A fine may be imposed if you cause any damage to the video that you damage.
 I won ’ t damage it . ,I will not harm it.
What's the matter with you then ? You look miserable . ,What's the problem with you then? You look gloomy.
 It's us . ,We.
 What do you mean by us . ,"What is your interpretation of the term ""us""?"
" Well , you always say you're busy . ","I'm aware that you're always joking around, but you haven't been able to take it seriously."
 That's right . ,And that's right.
 And you often go back to live with your parents and leave our son in the room by himself . ,"Often, you go back to live with your parents and leave our son alone in the living room."
" I ... I ... I miss my parents , also they miss me . ","I... I miss my parents, and they miss me."
" Oh I remember , I cut terrible calls , and you didn't say anything about it . ","I'm reminded that I made terrible calls, and you didn't address it."
 You mean I am groaned a few words ? ,Is it just a few words to express my frustration?
 Totally not . Perhaps it's about our marriage . ,Clearly not. Perhaps it's about our relationship and marriage.
"Hi , Mary . You look pale today . What's the matter with you ? ","Hi Mary, I noticed you're pale these days. What's up with your pale skin? I'm wondering."
 I think I've caught a cold . Now I'm aching all over . ,I believe I've been sick with a cold. Now I have aching muscles all over my body.
 You'd better take some medicine and have a good rest . I hope you'll be yourself pretty soon . ,I suggest you take some medicine and have a good night's sleep. I hope you're feeling better soon.
 Thank you . I suppose I should go to see a doctor . ,I appreciate your response. I think I should visit a doctor.
"I feel like going for a drink , it's been a long day . ","I'm longing for a drink, it's been chilly today."
" Great idea ! Peter , I could use the drink . ","I'm tempted to grab a drink, Peter - thanks, great idea."
 How about the new bar across road ? ,What about the new bar on the other side of the road?
" Sounds good . The food there is fantastic , too . ",There's a good feeling to it. The food at that place is simply mouth-watering.
" I agree , I had lunch there last week . ","I concur, I had lunch there last week."
 excellent ! That sounds like a plan . ,I think that's a great idea! That sounds like snobbish.
"Could you tell me the right time , please ? ",Is there a specific time that you would suggest I should start?
 Well . My watch says five past two . But it ’ s no use rely on it because it has been gaining and losing these last a few days . ,"My watch has been fluctuating for the past few days, and although it indicates five past two, I don't believe it."
 You have to go and fix it . ,It's your responsibility to mend it.
 Yes . I will . ,Yes. I will - I said 'yes'.
does your family have a record of your ancestors ? ,Is there any documentation of your ancestors in your family tree?
 sure . My mom has been working on our family tree for years . She ’ s always updating it . ,My mother has been diligently working on updating our family tree for several years. I'm sure that she's right.
 do you have a copy of your family tree in your house ? I ’ d love to see it . ,Is there a copy of your family tree that you keep in your house? I’d like to see if you can share it with me.
" I can show it to you now , if you like . I think it goes back about 8 generations so far . ","I'd be delighted to show you it now, if you want to see it. I believe it has been around for 8 generations."
 that ’ s amazing . Do you have a large extended family ? ,"I'm wondering if you have a large extended family, can you share some insights on how it might be?"
 I ’ Ve got 30 cousins on my mom ’ s side and 10 cousins on my dad ’ s side . ,I've got 30 or so cousins on my mother’s side and 10 or more on the father’ s.
 are you very close to your first-cousins ? ,Are you very close to your first-cousins?
" the ones that are my age are close relatives . Now that I ’ m older , I don ’ t spend as much time with them as I used to , so I don ’ t know my younger cousins as well as the older ones . ","I don’t get to see my younger siblings as often as I used to when I was younger, so I’m not as close to them as my close relatives."
 I see . who ’ s the head of your household ? ,"I'm curious, who is in charge of your household?"
" it ’ s definitely my mother . And , her mother is definitely the matriarch of the bigger family . ","My mother is undoubtedly my mother, and her mother's lineage is rooted in the larger family."
 that ’ s interesting . What does your grandfather think of your step-mother ? ,I'm curious to know what your grandfather thinks of your step-mother. Can you provide some insight?
" at first , she was quite critical of her , but now that they ’ Ve been married for a few years , she ’ s starting to accept the fact that my father divorced my mother . ","Initially, she was highly critical of her, but now that they have been married for a few years, her perspective has changed to accept the fact that my father divorced my mother."
" that ’ s pretty much how you feel about your step-mother . Like grandmother , like grandson . ","When it comes to your step-mother, it's similar to the way you feel about grandmother and grandson."
"Hi , Mr . Wang . Do you feel like going boating with me ? ","Hi Mr. Wang, would you be open to embarking on a boat trip with me?"
" Sounds interesting , I haven't gone boating for some time now , and what time ? ","I've been boating for a while, but I haven't been for some time. When might it be possible to start?"
 How about tomorrow afternoon ? ,What's the plan for tomorrow afternoon?
 Sure . Where shall I meet you ? ,I'm curious to meet you. Where can I find you at first?
 At the gate of the park . ,At the entrance of the park.
 Great . I look forward to meeting you . ,I'm eagerly anticipating meeting you. Great. I can't wait to meet you...
 See you then . ,I'll see you then.
 See you . ,I hope you are alright.
I hear that you've been to the Saikei Ski Resort for the weekend . Did you enjoy it ? ,I've been to Saikei Ski Resort over the past two weekends. Was your visit enjoyable?
" Yes , it's so exciting , though I had the most falls in our skiing team . ","Although I had the most falls among the skiers, it's still exhilarating to watch it."
 Isn't there any coach to teach you how to ski ? ,Is it possible to find a ski coach that can teach you the basics of skiing?
 Of course there is . The top-level coaches there are from the State Sports General Administration . ,There is no denying that there is. The top-notch coaches there are those who come from the State Sports General Administration.
 Could you move smoothly ? ,Is it possible for you to move quickly?
 Yes.My face even ached in the icy wind . ,"I shivered in the cold, and yes, I could feel the heat in my face."
 What happened afterwards ? ,What transpired after the event?
 I was skiing on and on excitedly until I realized one thing-I could not stop ! You can just imagine how terrified I was . ,"I was eagerly anticipating going on a skiing trip, but one thing I soon realized was that I could not stand and I couldn't stand it! It was incredibly scary."
 Poor girl ! ,A poor and needy young lady!
You look pale recently . ,"Recently, you appeared pale and looked pale."
 Yeah . I have got much pressure in the company . I have tobe wrapped upon my work . ,"I'm under a lot of pressure in the company, and I have to be wrapped up at work."
 Take good care of yourself . ,Ensure that you are taking care of yourself.
 Thank you . I will . ,I am grateful and grateful. I will take this opportunity to thank you.
"Hey , Maggy , Did you hear about David ? ","Hi Maggy, did you know about David?"
" About David ? No , I didn ’ t hear anything . ","I didn't hear anything about David, so I'm sorry."
" You know , about David and his new boss . ",I'm talking about David and his new supervisor.
" Sorry , I don ’ t quite follow you . ","I'm not sure if I can follow you back properly, sorry."
" Well , I heard David has been fired . ",I have been informed that David has been dismissed.
" Oh , that is a shame . He is really hard working . ","I'm sorry, that's a bit of pity. He works incredibly hard, too."
how do you usually get to school ? ,What is your usual mode of transportation to and from school?
 I usually ride my bike . Which form of transport do you prefer to use ? ,Is there a particular mode of transportation that you find most convenient for yourself?
" I feel that I can see more when I pedal a bicycle , but when I feel lazy , I drive my car . ","I find that my eyesight improves when I ride my bike, but when my mind is occupied, I opt to drive my car."
 I think we should discourage people from using their private cars . They produce too much pollution ! ,I think we should deter people from using their private cars as they are responsible for causing too much pollution.
" I agree , but I would find it difficult to stop using my car . It's just so convenient . ","I'm okay with using my vehicle, but I would struggle to give up. It's so convenient."
" cars might be convenient , but they're so bad for the environment . ","While cars may be a convenient option, they are not advisable as they pose ill-advised environmental consequences."
 do you have a car ? ,Do you have a vehicle in your possession?
" no . I used to have one though . Once I started using my bicycle to get around , I found that I didn't really need it . ","I used to ride my bike, but I didn't really need it. I'm not sure if I even needed it anymore."
" maybe if I sold my car now , I wouldn't be so tempted to use it . ","I'd probably be less interested in using my car if I had just sold it, but maybe now I could."
 you could try . It would save you a lot of money . ,There's no denying that it could result in a considerable amount of money saving.
" that's true . Every month , I spend hundreds of dollars on gas , insurance , and repairs . ","I've been spending a significant amount of money each month on gas, insurance, and repairs, totaling hundreds of dollars."
" if you got to class by riding a bicycle every day instead of driving , you will get lots of exercise , too ! ","Besides being able to commute to class on a bicycle daily rather than driving, you can also get accustomed to the physical and mental benefits of cycling to your class!"
 I could stand to lose a few pounds . Having a car has made me lazy . I never end up walking anywhere ! ,"I'm able to lose weight and feel like I could be healthier. However, I have a tendency to be lazy with my car. I never have the energy to walk anywhere!"
 let's go to a car dealership . I'll help you try to sell your car for a good price . ,I'll show you how to sell your car at a nearby car lot and offer.
 sounds good ! Let's go ! ,"I mean, it sounds really good! Let's go for a while!"
What's wrong with him ? ,What's the matter with him?
 His nose is out of joint because we forgot to invite him to the party . ,"We neglected to remind him to come to the party, causing his nose to be out of place."
"What are you going to do for one year abroad , Tom ? ","Tom, what are your plans for spending a year in another country?"
" Study , study , study . I want to learn a lot . ","I am eager to learn more as I study, study, learn."
 You are going to take courses ? ,Are you taking up any courses?
 Yes . I am going to take some university courses there . ,"Yes, I am going to attend some university there and take some courses."
 Sounds hard . ,Isn't it a struggle to hear?
" Yes , but I think it's probably for the best . ","Yes, I'm saying, but it's probably not going to be good."
 Won ’ t you get lonely ? ,Is it possible for you to avoid feeling lonely?
" Hey , I am a pretty cool guy . I will make friends , and I'll have a lot of extracurricular activities too . You know , like fencing , or theater or something . ","I'm a cool-looking, kind-hearted individual who can make friends and participate in various extracurricular activities, such as fencing, theater, or anything else."
"Isn't this lovely weather ? Will you help me water the flowers , Jack ? ","Isn't this delightful weather? Will you aid me in watering the flowers, Jack?"
" Well , do you think I have to ? ",Is it your opinion that I should?
 I do.We haven't watered them for quite a few days . ,"We haven't drenasked them for several days, and I know."
 Please look at the sky.Don ' t you see the dark clouds ? It's going to rain soon . ,I'm curious to see what's happening in the sky. Are you noticing the dark clouds? It'll start raining soon.
 Good.So we don't have to work.How nice ! ,"I appreciate it so much, that it's not necessary to work. Good luck!"
 But I don't think it's so nice . ,"Nevertheless, I don't believe it's so pleasant."
 Why ? ,What is the explanation for?
 The weather report says it's going to rain for a whole week . ,"According to the weather report, it is expected to rain for the next seven days."
" Oh , I'm afraid all the flowers will die in the rain . ",I'm worried that all the flowers will perish in the rain.
"On , darn . The grocery store is closed . ",I'm sorry to inform you that the grocery store is not open.
" Yeah , this one closes at ten . We could drive to the 24 - hour store on sixth . ","We could opt for the 24-hour store on sixth. Unfortunately, this one usually ends at ten."
 Alright . We are out of everything . ,We are no longer in a position to do anything.
 I wish the store close to us was open 24 - house a day . ,"I desire that the store nearby is open 24 hours a day, making it convenient for us to visit."
" I know , our schedules are so weird . Sometimes , the little corner store is the only thing within walking distance that ’ s open when we get home . ","We have such strange schedules. Occasionally, the little corner store is the only one that's open for us to walk to home."
" Yeah , and the prices there are very high . ","Yes, and the prices there are very high."
 I know . Three dollars for milk . ,I know. Three dollars for milk.
Do you think they two will get married ? ,Is it likely that they will get hitched?
 You can count on it . ,Trust me when I say.
" I think so.Yes , they get along so well . ",I think so. They have a good relationship.
 I like him.He ' s good for her . ,I have a liking for him.He's good for her.
 You're right . He sure is . ,I think you're right. He definitely is.
"Dad , where are we off to ? ","Where is my dearest destination, my Dad?"
 First we will go to the city centre and stop for something to drink . Then we will visit the University Museum . ,We will start by having a brew in the city centre and stop for drinks before heading to the University Museum.
 Where are we going to have a drink ? ,Where can we have a drink?
 There is a coffee shop round the corner . Can you see that big building at the end of the road ? ,Is it possible to spot the large edifice that looms over the road and is located just past the coffee shop on the corner?
 Yes ? ,Is it correct to say that yes?
 That is a bank . The coffee shop is opposite the bank . ,"A coffee shop can be found across from the bank, which is a bank."
 Good . I will have hot chocolate . ,I'm savoring some hot chocolate. Good ice cream.
 A stop ! Wait for the lights to turn green . ,Wait for the lights to turn green and then proceed.
 When crossing the road you must always pay attention to what's around you . ,"When driving across the road, it is crucial to pay close attention to the surroundings."
 Sorry . How far is the museum ? ,What is the distance between me and the museum?
 I am not sure . We will ask for directions in the coffee shop . ,I am uncertain. We will ask for directions in the coffee shop.
 Here we are . You find us a table and I'll get the drinks . ,We're at a table and I'll take the drinks. You find.
How about going to the cinema tonight ? ,"I'm planning on going to the movies tonight, can you tell me how I can make it?"
 That's great . What's on tonight ? ,I think that's great. What'll be happening tonight?
" I am not sure about the name of the film , but I know it's a romantic one . ","I'm not entirely familiar with the movie's title, but I do acknowledge it'd be a romantic-themed movie."
 Romantic ? I am afraid I like thrillers better . ,"Is it possible that I am not into Romance novels? I have a preference for thrillers, but I find them more thrilling."
 Don't you think it's too bloody ? ,"Isn't it too much of a stretch to say ""No, not at all""?"
" On the contrary , very exciting . ",Quite exhilarating on the other hand.
I feel so uncomfortable . ,I feel so uneasy.
 Are you sick ? ,Is your illness affecting you?
 No . The teacher is dragging the chalk over the blackboard . It set my teeth on edge . ,My teeth are nauseous because the teacher is dragging the chalk that I'm seeing over the blackboard.
 He ’ ll finish writing in a minute . ,"In a minute's time, he'll be finished writing."
I have made up my mind . I am getting a tattoo . ,I have decided to get a tattoo. I am not sure what to do.
 Really ? Are you sure ? ,Is it true? Do you have confidence in your answer?
 Yeah ! Why not ? They are trendy and look great ! I want to get a dragon on my arm or maybe a tiger on my back . ,I'm not sure if you want to get a tiger on your back or squirting dragon on my arm since they're cool and I can't seem to keep it from being cool.
" Yeah but , it is something that you will have forever ! They use indelible ink that can only be removed with laser treatment . On top of all that , I have heard it hurts a lot ! ","I understand that they use indelible ink that can only be erased with laser treatment, and it can be a painful experience."
 Really ? ,What is the real question?
 Of course ! They use this machine with a needle that pokes your skin and inserts the ink . ,"They use a needle-like device that inserts inserted ink into the skin of the person and then into their own skin, of course, as if to make it conceivable."
" Oh , I didn ’ t know that ! I thought they just paint it on your skin or something . ",I was just thinking of something that's just painted on your skin or something. I thought that was really interesting...
