Sentence,Paraphrase
 It can ’ t be helped . ,There are no solutions available.
"What do you do in your free time , Nancy ? ","Nancy, what activities do you engage in during your leisure hours?"
" Well , I like playing the violin . ",I have a passion for playing the violin.
 Really ? How long have you been playing the violin ? ,What is your real name? How old are you at playing the violin?
 About ten years so far . I started learning when I was in middle school . ,"For about ten years, I have been learning for about a decade since I was in middle school."
 That's really interesting . ,That's really interesting.
 Sure . So what about you ? Do you have any hobbies ? ,What is your favorite thing to do?
" Well , I like collecting matchbox ! I'm not sure if that counts , though . ","I'm intrigued by matchbox collection, but I'm not convinced if it's a significant aspect."
 Of course it does . Everybody has his own hobby . ,"Naturally, it happens. Everyone has their own interests."
How can I tell her about this ? ,What's the best way to inform her of this?
" Don't worry , you'll find a way . ",There's no need to worry about finding a solution.
 There is no need to be so frustrated . ,There is no reason to be so frustrated.
 How can you live without job in the future ? ,What are some ways to survive in the absence of a job in the future?
" Don't worry , you'll find a way . ",There's no need to worry about finding a solution.
What sports do you like to play ? ,What are your preferred sports to play?
 I like baseball and basketball . ,Baseball and basketball are my preferred sports.
 How about football ? ,Football?
" In my country football is brand new , so I never learned the game when I was younger . ","Football is a new phenomenon in my country, and I never learned the game when I was younger."
 It's a very popular game in America . ,America is a devoted fan of the game.
 Yeah . I heard a lot about it . Is it really that fun ? ,I heard a lot about it. Is that really that much of a fun activity?
" For me , it's one of those games that are fun to both watch and play . ",I find it to be one of those games that are enjoyable to watch and play.
 Are you a football player ? ,Are you a football player?
" No , I just for fun with my friends . We play two hand touch or flag football . We're too old to play tackle football . ","My friends and I only engage in games like two-handed or flag football, but we're too old to play tackle football as it's too old to participate."
 What is two hand touch and flag football ? ,What is the difference between two hand touch and flag football?
" Instead of tackling somebody , you just have to touch them with two hands , or if it is flag football , grab the flag that the ball carrier is wearing . ","Rather than tackling someone, you can simply touch them with your hands or, in flag football, with the flag that the ball carrier is carrying."
 I see . It's safer then right ? ,Is it safe to assume that it's not a risky action?
" Exactly . We play every Saturdays on the field by the tennis courts . If you want to learn and play a little , you're welcome to join us . ","We play on Saturdays on the tennis courts' field. If you're interested in learning and playing a little, come along to us."
 I'll give it a try . Give me a call and let's go down together . ,Let's go for a chat and hit the road together.
 Ok . I'll call you Saturday morning . ,Ok. I'll call you on Saturday morning.
 Great . ,Great.
What upsets you ? ,What are the things that bother you the most?
" My parents called . As usual , they reminded me again that I should have a plan to marry by my late 20s . Easier said then done . Who should I marry ? I have no time to go on a date . ",My parents called me again and again to remind me that I need to plan a marriage by my late 20s. Who should I marry? I have no time to go on a date.
 It is not your mother finding one for you ? ,Is it not your mother finding a boyfriend for you?
" I will find one myself , of course . I ’ m a modern girl . ","I'll find one myself, of course, as a modern woman."
" Perhaps you can try the three minutes date , the latest type . ","It might be a good idea to test out the three minutes date, the most recent variant."
" You mean dozens of the opposite sex meet each other for three minutes in a dimly bar serving alcohol , I hate that idea . ","I don't get the idea of people of different genders meeting in a dimly lit bar for three minutes to drink, don't you think?"
" No , there is an updated virgin , three minutes video date . I know an online dating website providing such service with a microphone and webcam , you can sigh for it . You can be face-to-face with a guy talking for maximum three minutes . ","No, not at all, but there is an online dating site where you can have a three-minute video date and see an updated virgin. The virgin has a microphone and webcam, which means you can be in real life with a guy talking for up to three minutes."
 I don ’ t think it makes sense . Three minutes is such a short time . ,I don’t think it’s even logical. Three minutes is too brief for me.
" I think you can find out if there is a possibility of romance within the first second of meeting someone , so-called love at first sight . ","Love at first sight is a way to determine if there is any romance within a second of meeting someone, as it is often referred to."
" Anyway , I don ’ t want to post my face up for sale on the internet like that . ",I am not interested in selling my face online or putting it up for sale.
" Don ’ t worry . There are many other options using the internet as dating methods . Some sites operate at international standard even have got certifications . Of course , for these sites , you have to pay a membership fee . But all in all , it is more serious and professional . The chance of meeting a good and serious person who does not play games is higher . ","There are many other dating sites available online that offer a more serious and professional profile than those that are solely online. These sites offer certifications and have a membership fee, but overall, it is a more effective way to meet someone who is serious about serious seriousness and doesn't have a passion for playing games."
 I don ’ t want to post my personal information on the internet . I ’ m not knowing who is reading it . ,"I'm afraid I'll lose interest and put my personal information on the internet, but I'm not sure who might be reading it."
Are you going to the party on Saturday ? ,Will you be at the party on Saturday?
 I was thinking about it . Are you ? ,I was pondering it. Are you occupied with this?
" Yeah , I heard it's going to be a lot of fun . ","Yeah, I heard it's going to be a lot of fun."
" Really ? Well , what time does it start ? ",What time exactly does it start?
 It starts at 8 ,The clock reads from 8 AM to 8 PM.
" Well , who all is going to be there ? ","Who will be there, well, who knows?"
 Everyone from school . ,The entire school community.
 How do you know it's going to be so fun ? ,What makes you think it will be a fun time?
" This party is going to have a DJ , food , and drinks . ","A DJ, food, and drinks will be served at the party."
" Wow , that does sound like it's going to be fun . ","Sounds like fun, right?"
 So am I going to see you at the party ? ,Will you be attending the party?
" Yeah , I will be there . ","I will be there, yeah."
Could you talk to me for a few minutes about my grades ? ,Would you be able to chat with me for a minute and ask me about my grades?
 Step into my office for a moment . What is your concern ? ,I invite you to briefly enter my office and we can talk briefly about what concerns you.
 Am I failing ? ,Am I a failure?
 Let's go on the computer to see what's up . Do you think you are doing well ? ,Let's use the computer to check our surroundings. Are you feeling well?
 I am pretty sure that I am in trouble . ,I am pretty sure I am in trouble.
" I can see that you are trying , but where do you think you could improve ? ","I can perceive that you are putting in a lot of effort, but where do you see the potential for improvement?"
 I missed a few classes ; I need to make sure I come to school on a regular basis . ,I'm struggling to attend classes on time; I missed a few of them; I need to make myself a regular contributor to school.
" Having a regular study routine and following it is very important , right ? ",Is it true that a study routine that is regularly followed and followed is essential?
 I'll try ; it's hard ! ,I'll give it my all; it's not easy!
 Thanks for stopping by ! ,Greetings!
Good luck on your test tomorrow . We'll be crossing our fingers for you ! ,We hope your test tomorrow goes well. Good luck with your test tomorrow and we hope you're doing well!
 Thanks . ,I appreciate it a lot.
I'll never ever work together with him ! ,"I'll never work with him again!"""
 What happened ? Quarrel again ? ,What's the latest news on the latest gossip?
 Will you take my materials back from him for me ? Please ! ,Can you please take my materials for me from him and take them back to me?
 Don't ask me . I don't wanna be involved in your quarrel . ,I'm not interested in getting involved in your argument.
"Oh , my God ! I've been cheated ! ",I'm so sorry for being deceived!
 What ? What did you buy ? ,What did you buy?
 It's a brick ! I can't believe how stupid I was . Damn it ! ,I'm so dumb it's like a brick! I can't believe how stupid I was. Damn it!
 What is it ? Why did you buy a brick ? ,What is the object of your purchase? What led you to acquire a brick?
" There was a guy on the sidewalk.He had three new boxes , Panasonic video camera boxes.He said he had to get rid of them quick . ",A man with three Panasonic video camera boxes was seen on the sidewalk. He had just bought three boxes and was told to get rid of them quickly.
