Sentence,Paraphrase,Formal_10,Formal_15,Formal_20,Informal_10,Informal_15,Informal_20
" Yes , I do . I think that science is making us wiser . What do you think ? ",Science is making us wiser. Do you agree with me?,Is it your opinion that science is making us more intelligent?,Is it accurate to say that science is making us more intelligent?,"Is it accurate to say that science is enhancing our wisdom? If so, what is your perspective?",Would you be emoyif?,Would you be emochte?,"Wouldn't Science make you richer? Sure, Science is making everyone smarter."
 I don ’ t think you ’ re right there . ,There's no way you're even in there.,I don’ t think you’re right there.,I don’ t think you’re right there.,I don’ t think you’re right there.,The only thing standing between you and me is you.,The only thing standing between you and me is you.,The only thing standing between you and me is you.
 I believe industry is making us wealthier . ,Industry is a driver of our economic progress.,Industry seems to be a driving force behind our economic progress.,I think that industry is a driving force behind our economic growth.,I think that industry is a driving force behind our economic growth.,Industrial dominance exemplifies wealth creation.,Industrial dominance exemplifier - Industry is making us richer.,Industrial dominance exemplifier - Industry boosts wealth generation.
 I don ’ t believe that . ,I don’ t think that...,I don’ t think that...,I don’ t think that...,I don’ t think that...,The f--- up nipple is a completely different.,The frick never crossed my mind.,The frick never crossed my mind.
" And in my opinion , medicine is making us healthier . ",I believe that medicine is actually making us feel better.,I believe that medicine is actually making us feel better.,I think that medicine is actually making us feel better.,I think that medicine is actually making us feel better.,Medicine appears incredibly effective in making us ill.,"Medicine alone appears on track to make us all healthier - in fact, in real life.","Medicine alone appears on track to make everyone healthier - in fact, in large numbers."
" I agree with you in the sense . But we ’ re all more miserable than ever , aren ’ t we ? ","I share your sentiment, but I think we're all experiencing more misery right now, isn't it?","I share your sentiment, but I think we're all experiencing more misery right now, isn't it?","I think I understand your point, but I also think we're all experiencing more misery right now, isn't it?","I think I understand your point, but I also think we're all experiencing more misery right now, isn't it?","Dong hog the mean s**t, isn't it? We're all going to be giddy up and down in our misery.","Dong hog the mean s**t, isn't it? We're all going to be giddy up and down in our misery.","Donnerner!! I share your point 100%, ""we're all going to be chuffed up now, haven't we?"
" I don ’ t agree with you . I maintain that we ’ re healthier , wealthier and wiser than we were a hundred years ago . ","I disagree with you. I believe that we are now smarter, wealthier, and healthier than we were 100 years ago.","I disagree with you. I believe that we are now a better, wealthier, and more intelligent society than we were 100 years ago.","I disagree with you. I believe that we are now a better, wealthier, and more intelligent society than we were 100 years ago.","I disagree with you. I believe that we are now a better, wealthier, and more intelligent society than we were 100 years ago.","Cant believe it., but you are right.. 100 years aren’t over yet I believe we are ahead of the times – healthier — richer and wiser than we were 100?",Cant believe it won’t be 100 years.!,Cant believe it won’t happen 100 years from now.!
 That ’ s your opinion not mine . ,I'm not in agreement with that.,I'm not in agreement with that.,"I'm not stating that as an individual, but rather that it's your opinion.","I'm not stating that as an individual, but rather that it's your opinion.","Done completely, it's mine, not your one.",Done completely.,Done completely.
What do you plan to do for your birthday ? ,What are your plans for your birthday celebration?,What are your plans for your birthday celebration?,What are your plans for your birthday celebration?,What are your plans for your birthday celebration?,Happy 21st birthday! What do you have in mind?,Happy 21st birthday! How can you make your big day special?,Happy 21st Birthday!! What do you have in mind to do on your birthday?
" I want to have a picnic with my friends , Mum . ",Mum and I are planning a picnic and want to share it with our friends.,"I'm looking forward to a picnic with my friends, Mum, which I hope will be able to enjoy.","I'm looking forward to a picnic with my dearest friend, Mum.","I'm looking forward to a picnic with my dearest friend, my mother, and some other company.",Mother Nature is playing picnic in the corner and I want to join my friends and have a picnic.,Mother knows how to make plans for picnics with her friends.,Mama - It's summertime already and I'm dying for a picnic.
 How about a party at home ? That way we can get together and celebrate it . ,Is it possible to have a party at home and have it organized for us to enjoy?,Is it possible to have a party at our house and have it celebrated?,Is it possible to have a party at our house and hold.,Is it possible to have a gathering at home and have it organized for us to enjoy?,Wouldn't barefoot throwing a party at home make it possible to have supper with everyone present?,Wouldn't have anyone enticed to join us at home and celebrate a party without leaving naughty clothes on the floor - any recommendations?,Wouldnt make ice cream & cookies at home? 3!
" OK , Mum . I'll invite my friends home . ","Mum, I'll be extending an invitation to my friends.","OK, Mum. I'll bring my friends a bbq to join me at their home.","OK, Mum. I'll bring my friends a bb and boo.","OK, Mum. I'll bring my friends a bb and breeches at 'bout when' they come home.",Mum.! - Mum the best... I'm going to bring my friends a lone home '.,"Mum!! Oops, Mum won't you mind bringing dinner to my friends home today.","Mother.! :), I'm going up there with my friends - Mum won't be ok...but I will be sending an invitation if I can ring them home."""
How may I help you ? ,In what ways can I assist you?,In what ways can I assist you?,In what ways can I assist you?,In what ways can I assist you?,Would you be emmancipated if you were in a position to do so?,Would anyone be able to barely describe this greatness to me?,Wouldn't anyone be more pleased if this were a job done for me - in the name of charity?
 I would like to return this book . ,I want to give this book back.,I want to give this book back.,I want to give this book back.,I desire to give this book a try and return it.,Would you be emceeing me back home with book.,Would ever be able to have me rip out this book and read it again.,Would ever be able to have me rip out this book.
 Is that all you need ? ,Is that all you require?,Is that all that's required of you?,Is that all that's required of you?,Is that all that's required of you?,All you need is?,All you ever wanted is?,All you ever wanted is?
 I also want to check out this video . ,I also want to watch this video.,I also want to watch this video.,I also want to watch this video.,I also want to watch this video.,"The video is on point, making it even more worth watching.","The video is on point, entitle me even more.","The video is on point, entitle me even more."
 Is that all you would like to check out ? ,Would you like to see all of this?,Is that all you would like to know about?,Is that all that matters to you?,Is that all that matters to you?,Wouldn't you be able to go inside that's all you want to see?,Would all of you be enticed to go?,All you would ever want to see was this iceberg breaker?
 That ’ s all I need . ,That's all I require.,That's all I'll ask for.,That's the sole thing I'll ask for.,That's the sole means of assisting me.,All you need to do now is...,All my wants are completed.,All my wants are completed.
 Do you have your library card ? ,Have you possessed your library card?,Is it possible for you to keep a record of your library card information?,Is it possible for you to keep a record of your library card information?,Is it possible for you to keep a record of your library card information?,Would you be able to show your library card?,"Would you be ,if you own your library card?",Would the bank ever give you ur library card?
 Here it is . ,Here it is.,Here it is.,Here it is.,Here it is.,The.,The.,The?
 Make sure to take proper care of this video . ,Ensure that you maintain the care required for this video.,Ensure that you maintain the care required for this video.,Ensure that you maintain the care required for this video.,Ensure that you maintain the care required for this video.,Done graduosamente tienemos a proletariat en vivo all the video clips.,Done graduosity on this video.,Done the hard work! Watch this video below and enjoy!
 That won ’ t be a problem . ,There won't be any issue with that.,There's no need to worry about that.,There's no need to worry about that.,There's no need to worry about that.,Nothing will stop it.,Nothing will stop it.,Nothing can stop it.
" If you damage the video , you will be fined . ",A fine may be imposed if you cause damage to the video recording.,A fine may be imposed if you cause damage to the video recording.,A fine may be imposed if you cause any damage to the video that you damage.,A fine may be imposed if you cause any damage to the video that you damage.,Videohacking will result in a fine if you ruin the video.,Finesse has already been applied if you were to damage video footage.,Finesse has already been applied if you were to damage video footage.
 I won ’ t damage it . ,I won’t break it.,I will not harm it.,I will not harm it.,I will not harm it.,Wouldn't break anything if it fell on me.,Wouldn't break anything if it fell on me.,Wouldn t break anything if I were to break it.
What's the matter with you then ? You look miserable . ,What's the problem with you then? You look gloomy.,What's the problem with you then? You look gloomy.,What's the problem with you then? You look gloomy.,What's the problem with you now? You seem like a sappy-haired man.,Wouldn't you be happy if you were this desolate?,Wouldn't you be happy if everyone was talking about you? You seem like a total mess.,Wouldn't anyone be more pleased with what you were up to? You're already in vogue.
 It's us . ,We.,We.,We.,We.,The one'' It's us.,The one.,The one.
 What do you mean by us . ,"What is your interpretation of the term ""us""?","What is your interpretation of the term ""us""?","What is your interpretation of the term ""us""?","What is your interpretation of the term ""us""?","Would you be able to shed light on what you mean by ""us""?","Would you be emmanous if you said: ""We are...""?",Would YOU EVER TALK TO US IF YOU MADE IT OUR THING?
" Well , you always say you're busy . ","You keep claiming to be busy, right?","I'm aware that you're always joking around, but you haven't been able to take it seriously.","I'm aware that you're always joking around, but you haven't been able to take it seriously.","I'm aware that you're always joking around, but you haven't been able to take that action.","Every time you answer me ""you're running late,"" you reveal yourself.",Everybody knows you're busy.,Everybody knows you're occupied.
 That's right . ,That's correct...,That's correct...,And that's right.,And that's right.,All the way!,All done in one hit.,All done in one hit.
 And you often go back to live with your parents and leave our son in the room by himself . ,"Often, you go back to live with your parents and leave our son alone in the room.","Often, you go back to live with your parents and leave our son alone in the living room.","Often, you go back to live with your parents and leave our son alone in the living room.","Often, you go back to live with your parents and leave our son alone in the living room.",Many people move right back home to live with their parents and leave our son alone in the room.,Many people move right back home to live with their parents and leave our son alone in the room.,Many people move right back home to live with their parents and leave our son alone in the room.
" I ... I ... I miss my parents , also they miss me . ",I... I... I miss my parents... I miss my parents too.,"I... I miss my parents, and they miss me.","I... I miss my parents, and they miss me.","I... I miss my parents, and they miss me.",Motherly love... She lands a job just because my parents are still grieving.,Motherly love... She lands incredibly well.,"Motherly love... She knows how much I miss her - she carries me everywhere she goes, she has loads of other things she misses her parents and they have more to give to me."
" Oh I remember , I cut terrible calls , and you didn't say anything about it . ","Oh, I just remember, I made these awful calls, and you didn't even answer.","I'm reminded that I made terrible calls, and you didn't address it.","I'm reminded that I made terrible calls, and you didn't address it.","I'm reminded that I made terrible calls, and you didn't address it.",The only thing you said to you was that you cut me off after making terrible calls.,The only thing standing out from you was knowing that all hell happened after I cut off all those terrible calls you made.,The only thing standing out from you was knowing that all hell happened after I cut off all the terrible calls I got from people.
 You mean I am groaned a few words ? ,Is it just me or do you think I'm going to cry for a few words?,Is it just a few words to express my frustration?,Is it just a few words to express my frustration?,Is it just a few words to express my frustration?,Would you be able to paint a picture of yourself on Facebook?,Wouldn't you be able move ONE word that's gonna touch me?,Wouldn't u be utterly horrified if you could rewind the clock?
 Totally not . Perhaps it's about our marriage . ,Totally not. Maybe it's about our marriage.,Totally not. Maybe it's about our marriage.,Clearly not. Perhaps it's about our relationship and marriage.,Certainly not. Maybe it's about our relationship as a couple.,Completely never!! Wouldn't it be true? Probably centered on marriage.,Completely never!! Wouldn't it be true?? It's all based.,"Completely never!! Wouldn't it be true - it's all in all caps, right?"
"Hi , Mary . You look pale today . What's the matter with you ? ","Mary, I noticed you're pale today. What's the issue?","Hi Mary, I noticed you're pale these days. What's up with your pale skin? I'm wondering.","Hi Mary, I noticed you're pale these days. What's up with your pale skin? I'm wondering.","Hi Mary, I noticed you're pale these days. What's up with your pale skin? I'm wondering.",Mary! You guys look pale now! What the heck is wrong with you?,Mary Jane! You look pale now :D Can you tell me what's happening?,Mary Jane! You are so pale now - what could be wrong with you?
 I think I've caught a cold . Now I'm aching all over . ,I believe I've been sick with a cold. Now I'm feeling a lot of pain all over my body.,I believe I've been sick with a cold. Now I have aching muscles all over my body.,I believe I've been sick with a cold. Now I have aching muscles all over my body.,I believe I've been sick with a cold. Now I have aching muscles all over my body.,"All over my body, incredibly aching all over it. I would only be able to move on completely.",All over me - the only thing that seems to move is aching everywhere... I think I'm pretty rad.,All my blood would go down. I'm in a good place.... I think I have shingles on my back.
 You'd better take some medicine and have a good rest . I hope you'll be yourself pretty soon . ,I suggest you take some medicine and have a good night's sleep. I hope you're feeling better soon.,I suggest you take some medicine and have a good night's sleep. I hope you're feeling better soon.,I suggest you take some medicine and have a good night's sleep. I hope you're feeling better soon.,I suggest you take some medicine and have a good night's sleep. I hope you're feeling better soon.,"Wouldn't you be f****** fine now? Just barefoot, I hope you're doing pretty well.",Wouldn't make it urs day if you could take u ur the medicine n take any rest. RIP you're on the road a couple of weeks and you should be sleeping well you will be fine soon.,Wouldn't make it urs day if you could do it yourself. RIP you're fast!
 Thank you . I suppose I should go to see a doctor . ,I appreciate it. It would be helpful for me to visit a doctor.,I appreciate your response. I think I should visit a doctor.,I appreciate your response. I think I should visit a doctor.,I appreciate your response. I think I should visit a doctor.,Would you be able to help me? I would love to see a doctor.,Wouldn't go out if you saw a doctor. Way to go.,Wouldn t have gotten med hygienist. Way to go to the doctor - thank u.?
"I feel like going for a drink , it's been a long day . ","I want to have a drink, it's been a long day.","I'm longing for a drink, it's been chilly today.","I'm longing for a drink, it's been chilly today.","I'm longing for a drink, it's been sour.",Tireless end of work day.,Tireless - it's already been yer day'still have a drink on me and I haven't gone out yet.,Tireless - it's already been rained.
" Great idea ! Peter , I could use the drink . ",Great idea! Thanks Peter - I might have to try that drink!,"I'm tempted to grab a drink, Peter - thanks, great idea.","I'm tempted to grab a drink, Peter - thanks, great idea.","I'm tempted to grab a drink, Peter - thanks, great idea.",Awesome idea!! Peter - I would be able to get you a drink.,Awesome idea!! Peter - I would be able to make u up.,Awesome idea!! Peter - I would be entrusted with that drink.
 How about the new bar across road ? ,What about the new bar on the other side of the road?,What about the new bar on the other side of the road?,What about the new bar on the other side of the road?,What about the new bar on the other side of the road?,Would the bar on Broadway now be reopened like the new one?,Would the bar upmarket on the street still be a regular spot on any bar menus or drinks menu items?,Would the bar upmarket on the street still be a regular spot on bbq nightclub nights?
" Sounds good . The food there is fantastic , too . ",The food at that place is simply mouth-watering — what a great meal it is.,There's a good feeling to it. The food at that place is simply mouth-watering.,There's a good feeling to it. The food at that place is simply mouth-watering.,There's a good feeling to it. The food at that place is also outstanding.,"All in ONE word - fantastic. The food sounds amazing, too.",All in song. The food sounds amazing there too.,"All done. The food sounds amazing, too."
" I agree , I had lunch there last week . ","I concur, I had lunch there last week.","I concur, I had lunch there last week.","I concur, I had lunch there last week.","I'm with you, I had lunch there last week.","Adorable, lunch had u.","Adorable mate,, it was lunchtime there last week.","Adorable mate,, it was lunch last week there."
 excellent ! That sounds like a plan . ,Excellent! That sounds like a plan.,I think that's a great idea! That sounds like snobbish.,I think that's a great idea! That sounds like snobbish.,I think that's a great idea! That sounds like snobbish.,Awesome!! That looks really good!,Awesome!!That looks really good! It sounds amazing!,Awesome!! You're right - it's all a big deal.
"Could you tell me the right time , please ? ",Can you inform me of the correct time?,When is the appropriate time to respond?,Is there a specific time that you would suggest I should start?,Is there a specific time that you would suggest I should start?,"Would you be able to let me know when it is, please specify the correct time?",Would the frist you are releasing be right now - if you could rsquo; can you tell?,Would the frist you are releasing be shattered right now!?
 Well . My watch says five past two . But it ’ s no use rely on it because it has been gaining and losing these last a few days . ,"My watch has been fluctuating for the past few days, and although it says five past two, it's not worth relying on it.","My watch has been fluctuating for the past few days, and although it indicates five past two, I don't believe it.","My watch has been fluctuating for the past few days, and although it indicates five past two, I don't believe it.","My watch has been fluctuating for the past few days, and although it indicates five past two, I don't believe it.",The last 365 seconds have already been pounding on my watch. Despite it showing five past two on it... well my wrist is giddy with dread.,The last 365 seconds have already been pounding on my watch..Right now it says five past two - it has been on and off for a couple of days now.,The last 365 tracks right on my watch - it says five past two. WRONG! It's in vogue!
 You have to go and fix it . ,It's your responsibility to mend it.,It's your responsibility to mend it.,It's your responsibility to mend it.,I encourage you to take responsibility for fixing it.,All you need to do is patch it up.,All you need to do now is patch it all over.,All it up - you are the one to go.
 Yes . I will . ,Yes. I will.,Yes. I will - I said if I can.,Yes. I will - I said 'yes'.,Yes. I will - I said 'yes'.,Would you be emcee?,Wouldn't go either - yes you can!,"Wouldn't change anything already agreed! ""Yes"". ""I won'!!"""
does your family have a record of your ancestors ? ,Are there any records in your family that reveal the ancestors of your lineage?,Is there any documentation of your ancestors in your family tree?,Is there any documentation of your ancestors in your family tree?,Is there any documentation of your ancestors in your family tree?,Would you be able to invent all of your ancestors' names in your family tree?,Would the familly if you were in the family possesses a record of your ancestors?,Would the familly if you were in the family reprint one of your ursans be alive?
 sure . My mom has been working on our family tree for years . She ’ s always updating it . ,My mom has been working hard for years to update our family tree. I can honestly say that she's a pro at it.,My mother has been diligently working on updating our family tree for several years. I'm sure that she's right.,My mother has been diligently working on updating our family tree for several years. I'm sure that she's right.,My mother has been diligently working on updating our family tree for several years. I'm sure that she's right.,The family heirloom tree has already been up in the air! My mom has been working on it for years. She's always fixing it.,Every single year has my mom updated our family tree. I know exactly what she is talking about — she’s been working on it for years.,"Every single year has my mom racked up 8,000 pound of her fingernails.’ My mother is always on top of updating our family tree."
 do you have a copy of your family tree in your house ? I ’ d love to see it . ,Do you keep a copy of your family tree in your house? I’d like to see a copy.,Is there a copy of your family tree that you keep in your house? I'd like to see it.,Is there a copy of your family tree that you keep in your house? I’d like to see if you can share it with me.,Is there a copy of your family tree that you keep in your house? I’d like to see if you can share it with me.,Would you be able to photograph your family tree in the privacy of your home?,Would you be helen holding ur family tree in house? I would love to see a copy.,"Would ever be able to have ur family ancestors photographed in your house, sir if you had one in the house at the moment?"
" I can show it to you now , if you like . I think it goes back about 8 generations so far . ","I would be happy to show you it now, if you want to see it. I believe it has been around for 8 generations.","I'd be delighted to show you it now, if you want to see it. I believe it has been around for 8 generations.","I'd be delighted to show you it now, if you want to see it. I believe it has been around for 8 generations.","I'd be delighted to show you it now, if you want to see it. I believe it has been around for 8 generations.","Would you be able to catch a glimpse of it now, if you so desire - I believe it has been around for 8 generations.",Would anyone be able to touch it if you so desired - it is rumored to have existed for 8 generations now.,Would anyone be enticed to go upstairs now if you wanted to see it? I reckon it has been around for 8 generations.
 that ’ s amazing . Do you have a large extended family ? ,"I'm wondering if you have a large extended family, can you share that with us?","I'm wondering if you have a large extended family, can you share some insights on how it might be?","I'm wondering if you have a large extended family, can you share some insights on how it might be?",I'm wondering if you have a significant extended family. Can you share some insights on this?,Would you be able to share the wealth of your massive family if you have a large extended family?,Wouldn't have ot any other way besides having a big family?,Wow!! How big AFWAY you have an extended family?
