Sentence,Paraphrase,Formal_10,Formal_15,Formal_20,Informal_10,Informal_15,Informal_20
 Here we are . You find us a table and I'll get the drinks . ,We're sitting down and I'll take the drinks. You find a table and I'll get the drinks.,We're at a table and I'll take the drinks. You find.,We're at a table and I'll take the drinks. You find.,We're at a table and I'll take the drinks. You find.,The first person on the table is here. You choose a table and I'll go out and buy drinks.,The first person on the table is here. You spot a table and I'll go get the drinks.,The first person on the table is here. All you need to do is order drinks and set up a table.
How about going to the cinema tonight ? ,"I'm planning on going to the movies tonight, any recommendations?","I'm planning on going to the movies tonight, can you tell me how I can make it?","I'm planning on going to the movies tonight, can you tell me how I can make it?","I'm planning on going to the movies tonight, can you tell me how I can make it?",Wouldn't go anywhere close to movie theater tonight?,Wouldn't go anywhere close to movie theater tonight?,Wouldn't watching movie at the theatre tonight off my mind?
 That's great . What's on tonight ? ,That's great. What's on the menu for tonight?,I think that's great. What'll be happening tonight?,I think that's great. What'll be happening tonight?,I think that's great. What'll be happening tonight?,Awesome mate! :) What's up tonight?,Awesome mate! :) What the hell is happening tonight?,Awesome mate!! What's on tap right now?
" I am not sure about the name of the film , but I know it's a romantic one . ","I haven't seen the movie yet, but I can't recall the title, which is a romantic romantic movie.","I'm not entirely familiar with the movie's title, but I do acknowledge it'd be a romantic drama.","I'm not entirely familiar with the movie's title, but I do acknowledge it'd be a romantic-themed movie.","I'm not entirely familiar with the title of the movie, but I do acknowledge it as a romantic drama.","The one movie that is out right away is a romantic one, but I am clueless about its title.","The one movie that is out right away is a romantic one, regardless of whether you're familiar with it or not.","The one movie that is out right away is a romantic one, regardless of whether you're familiar with it or not."
 Romantic ? I am afraid I like thrillers better . ,Is it safe to say that I am more interested in Romantic thrillers?,"Is it possible that I am not into Romance novels? I have a preference for thrillers, but I find them more thrilling.","Is it possible that I am not into Romance novels? I have a preference for thrillers, but I find them more thrilling.",Is it possible that I am more drawn to Romantic novels or thrillers?,"Wouldn't you be able to resist a Romantic book? I have ten books of suspenseful novels, regardless of it.",Wouldn't have it any other way if it were a Romantic novel based on cliffhangers - it's incredibly thrilling.,Wouldnt you be?!? *smile* I am dREASE a thriller?
 Don't you think it's too bloody ? ,"Isn't it too much of a stretch to say ""No, not at all""?","Isn't it too much of a stretch to say ""No, not at all""?","Isn't it too much of a stretch to say ""No, not at all""?","Isn't it too much of a stretch to say ""No, not at all""?",Wouldn't you jump on it?,Wouldn't you jump on it?,Wouldn't YOU rather be naked?
" On the contrary , very exciting . ","Very exciting, contrary to popular belief.",Quite exhilarating in the opposite direction.,Quite exhilarating on the other hand.,Quite exhilarating on the other hand.,very exhilarating -.,very exhilarating -.,very exhilarating -.
I feel so uncomfortable . ,I feel so uneasy.,I feel so uneasy.,I feel so uneasy.,I feel so uneasy.,Pain runs through my body.,Pain runs through all of me.,Pain runs inside me too.
 Are you sick ? ,Are you unwell?,Is your illness affecting you?,Is your illness affecting you?,Is your illness affecting you?,Would you be alive if you were afflicted?,Would you be alive if you were afflicted?,Wouldn't fall bare any other sickness conditions - is everyone sick?
 No . The teacher is dragging the chalk over the blackboard . It set my teeth on edge . ,"The teacher is dragging the chalk over the blackboard, and it left my teeth hurting.",My teeth are nauseous because the teacher is dragging the chalk I. am dangling over the blackboard and bringing the sand back on the lesson.,My teeth are nauseous because the teacher is dragging the chalk that I'm seeing over the blackboard.,My teeth are nauseous because the teacher is bringing the chalk and dragging it over the blackboard.,Teacher is dragging chalk over blackboard. It's like my teeth are on edge. No way.,Teacher is dragging chalk over blackboard. It's a big deal. I can't help but feel my teeth. No.,Teacher is dragging chalk over blackboard. It's a big deal. I can't help but feel my teeth.
 He ’ ll finish writing in a minute . ,He’ll be finished writing in a minute.,"In a minute's time, he'll be finished writing.","In a minute's time, he'll be finished writing.","In a minute's time, he'll be finished writing.","One hurray, he ’ ll be done writing in a minute.",One atom!’ He ’ ll be done writing.,One atom!’ He ’ ll be done writing.
I have made up my mind . I am getting a tattoo . ,I am on the verge of getting a tattoo.,"I am about to get a tattoo, but I have made.",I have decided to get a tattoo. I am not sure what to do.,I have decided to get a tattoo. I am not sure what to do.,Tattoo. Everyone has a plan. I am going to get one tattoo - I have made supplication count.,Tattoo king : I am completely convinced that I should get a tattoo.,Tattoo king : I am completely convinced that I should get a tattoo.
 Really ? Are you sure ? ,Are you convinced that what you are reading is genuine? Do you have a clear sense of what you're reading?,Is it true? Do you have confidence in your answer?,Is it true? Do you have confidence in your answer?,Is it true? Do you have confidence in your answer?,Real Guy Do? Are you sure?,Real Guy Do? Are you sure?,Real Guy Do? Are you 100% correct?
 Yeah ! Why not ? They are trendy and look great ! I want to get a dragon on my arm or maybe a tiger on my back . ,I'm not sure if you want to get a dragon on your arm or a tiger on your back - they're cool and all over the place.,I'm not sure if you want to get a tiger on your back or squirting dragon on my arm since they're cool and I can't seem to keep it from being cool.,I'm not sure if you want to get a tiger on your back or squirting dragon on my arm since they're cool and I can't seem to keep it from being cool.,I'm not sure if you want to get a tiger on your back or squirt on my arm since they're both so cool and cute.,Wouldn't you jump on it?! Stunning! Don''T miss the cute dragon on my arm! It's so pretty! I'd love to have a tiger on the back!,"Wouldn't make AFTER you guys out!! How cool is that? Because hey, I wanna have a dragon on my arm and / or tiger on the back & be cool.",Wouldn't make AFTER you guys out!! How cool is that? Because hey guys it's cool and I saw a dragon on my arm and if I had to pick it up I would have tiger on top of my back.
" Yeah but , it is something that you will have forever ! They use indelible ink that can only be removed with laser treatment . On top of all that , I have heard it hurts a lot ! ","I know it hurts, but it is a permanent issue! They use indelible ink that can only be eliminated with laser therapy. Additionally, it is known to cause severe pain.","I understand that they use indelible ink that can only be erased with laser treatment, and it can be a painful experience.","I understand that they use indelible ink that can only be erased with laser treatment, and it can be a painful experience.","I understand that they use indelible ink that can only be erased with laser treatment, and it can be painful.","The only way to get rid of it permanently is through laser treatment using leftover ink. Besides all the pain it causes, everyone else has endured it anyway.",The only way to get rid of it permanently is through laser treatment - you won't believe it's used!!,The only way to get rid of it permanently is through laser treatment... arduous!!
 Really ? ,Can you provide me with an answer?,What is the real question?,What is the real question?,What is the actuality?,Real ;D?,Real ;D?,Real ;D?
 Of course ! They use this machine with a needle that pokes your skin and inserts the ink . ,They use a needle-like device that inserts a needle through your skin and into the ink.,"They use a needle-like device that inserts inserted ink into the skin of the person and then into their own skin, of course, as if to make it conceivable.","They use a needle-like device that inserts inserted ink into the skin of the person and then into their own skin, of course, as if to make it conceivable.","They use a needle-like device that inserts inserted ink into the skin of the person and then into theirs to poke their own skin, of course, but of.",The machine is equipped with a needle that passes through your skin to insert ink.,The machine is equipped purely with a needle that pokes through your skin and inserts the ink.,The machine is equipped full-fledged with a needle that inserts ink into the skin after it is poked.
" Oh , I didn ’ t know that ! I thought they just paint it on your skin or something . ",Oh my goodness! I thought maybe they painted it on their skin or something.,I was just thinking of something that's just painted on your skin or something. I thought that was really interesting...,I was just thinking of something that's just painted on your skin or something. I thought that was really interesting...,"I didn't realize until recently that it was common practice to paint something on your skin, or something like that.",Wow!! Did you just hear of the idea of painting it on your skin or something?,Wow!! Didn't realize until now - how easy it is to paint on your skin?,Wow! All you know is you paint everything on your skin or something.
" I think you should reconsider and do some more research about tattoos . Also , find out where the nearest tattoo parlor is and make sure they used sterilized needles , and that the place is hygienic . ","I think you should reconsider and do some research before you go ahead with your tattoo. Also, where is the closest tattoo parlor, and do you use sterilized needles and maintain a clean facility?","I think you should reconsider and do some research before you go ahead with your tattoo. Also, where is the closest tattoo parlor, and make sure the needles are cleaned and used properly?","I think you should reconsider and do some research before you go ahead with your tattoo. Also, where is the closest tattoo parlor, and make sure the needles are cleaned and used properly?","I think you should reconsider and do some research before you go ahead with your tattoo. Also, where is the closest tattoo parlor, and make sure the needles are cleaned and used properly?","Wouldn't you be rushing tattoos? You should!! Also, where is the closest tattoo shop?? How can you confirm if the parlor is clean and uses sterilized needles.","Wouldn't step back anytime soon!! First things first! Map out where exactly the closest tattoo shop is, make sure it's clean and uses sterilized needles.",Wouldn't step back anytime soon!! First things first! Map out tattooed skin! Where is the closest tattoo shop? They use sterilize piercing needles perfectly! Clean up hygienic restrooms!
 Maybe I should just get a tongue piercing ! ,Is it a good idea to consider getting a tongue piercing?,Is it a good idea to consider getting pierced with my tongue?,I'm considering getting my tongue pierced. Is this something I should consider?,I'm considering getting my tongue pierced. Which is the more practical option?,Would achieving a tongue piercing be advisable?,Would achieving crookedness ringtones on my tongue be a viable option?,Would achieving crookedness ringtones on my own ear!
"Excuse me , what's the screen near your steering wheel for ? ","What is the screen situated near your steering wheel, and what is its purpose?","What is the purpose of the screen situated near your steering wheel? Excuse me, what is it's for?","What is the purpose of the screen situated near your steering wheel? Excuse me, what is that screen for?","I'm curious about the screen that's positioned near your steering wheel, can you explain what it is?",Can nothing on the screen near your steering wheel be said to answer this?,Can nothing on the screen near your steering wheel be said to exist?,Can nothing on this screen near your car's steering wheel be said to know it?
 It's a portable TV . It's a popular thing now . ,The portable TV has become a popular item among consumers.,A portable TV that is now a common choice is gaining in popularity.,A portable TV that is now a common choice is gaining in popularity.,A portable TV that is now a common choice is gaining in popularity.,One of most popular items right now is portable TV.,One big thing everyone is talking about right now is a portable TV.,One big thing everyone is talking about right now is a portable TV.
" Oh , that's new to me . So what's on everyday ? ",What's the deal with this new kid on the block?,I'm not sure what's going on with me today. I have never heard of that before.,I'm not sure what's going on with me today. I have never heard of that before.,I've just been thinking about it and I can't seem to remember anything about that. What's happening every day?,Cant even get down to emojis. What's up everyday :(?,"Cant even get down to one new thing on instagram :(( I know it's new to me ;() Anyways, what're i doing every day?",Cant even get down to one new thing ever happened to me :) What's up everybody on a daily basis?
" News about current affairs , documentaries , music , movies , noncommercial ads and so on . ","Current affairs, documentaries, films, music, noncommercial ads, noncommercial news, and more.","Current affairs, documentaries, films, music, noncommercial ads, and more.","Current affairs, documentaries, films, music, noncommercial ads, and more.","Current affairs, documentaries, films, music, noncommercial ads, and more.",The best noncommercial commercial ad space on current events - from news items to music and documentaries.,The best non-profit advertising platform delivering news breaking news on current events.,"The best nonc commercial news coverage of current affairs news headlines, news programs and documentaries, music news, movies, noncommercial news and ads, and more."
 Is there anything interesting ? ,Is there anything fascinating?,Is there anything fascinating?,Is there anything fascinating?,Is there anything fascinating?,Would anyone be able to spot all things incredibly cool?,Would anyone be enticed with anything cool you have thrown their hat on?,Wouldn't anyone have sex to talk about?
" Yes , there are something good and informative . I think that many people underestimate the value of TV in education . ",There are some good and informative things to read about... But I think there's a big misconception in the world of TV that many people have failed to realize the value of TV in education.,"I find there are good and informative things on the topic. Nevertheless, I think that TV has a significant impact on education and, and I believe that people underestimate the value of TV in this area.","I find there are good and informative things on the topic. Nevertheless, I think that TV has a significant impact on education and, and I believe that people underestimate the value of TV in this area.","I find there are good and informative things on the topic. Nevertheless, I think that TV has a significant impact on education and, and I believe that people underestimate the value of TV in this area.","Many people fail to realize the power of TV in education, despite the fact that there are many good and informative pieces available.",Many people fail to realize the power of TV on a student.,"Many people faillessly enlarge TV programs in their schools and colleges. While there are many good and informative pieces, none of them seem to recognize the immense power and worth of TV in education."
 I agree . Are there any commercials on the TV ? ,Is there any commercial airing on TV? I agree.,Is there any advertising on the television? I agree.,Is there any advertising on the television? I agree.,Is there any advertising on the television? I agree.,Would you be able to spot all of them?,Wouldn't make out AFTER YOU'RE STARTING TV MARKETING?,Wouldn't make out AFTER YOU'RE STARTING TV MARKETING?
 Of course . Because the TV stations need to make money from commercials between the programs . ,The TV stations are expected to make money from commercials between the programs.,"Of course, TV stations must make a profit from advertising in between TV shows.","Of course, since the TV stations need to generate revenue from commercials between the programs.","Of course, since the TV stations need to generate revenue from commercials between the programs.",Adverts on TV programs - one of the main drivers generating revenue 'over and above the commercials.,Adverts running on TV are a big deal because TV stations are required to earn revenue from them.,"Adverts running on TV are incredibly profitable for the stations, given that they are required to make a profit from advertising in between programs."
 That makes a lot of sense . Does the TV work well ? ,Is the TV efficient in its operation? That sounds good.,Is the TV efficient in its performance?,Is the TV efficient in its performance?,Is the TV efficient in its performance?,Would the televised show be a great invention?,All in ONE word.. FINALLY. The TV works aLOT.?? Doesn't the TV work taht?,All in ONE word. The TV working perfectly. Is it a good idea?
 Not always . It depends on the transmission of the satellite signals . ,"The transmission of satellite signals is a determining factor in this. However, it may not be constant.",Not every situation is identical. It depends on the transmission of satellite signals.,"However, it is not always the case. It is dependent on the transmission of satellite signals.","However, it is not always the case. It is dependent on the transmission of satellite signals.",The teledance is based on satellite signal transmission.,Satellite signal reception is still king. It is not always.,Satellite signal reception is still king. It is not a requirement.
 I got it . Do you pay for the programs ? ,Is it your practice to pay for programs?,Is it your practice to pay for programs?,Is it necessary for you to pay for the programs?,Is it necessary for you to pay for the programs?,Would you be donating money to show offs?,Would buying the programs outright pay you?,Would buying the same things you own cost only for the program is you paying for them now..do you pay for it if you have them all paid for a year?
" Yes , 50 Yuan per month . ",Is it true that I can earn 50 Yuan per month with a monthly budget of 50 Yuan?,Is it true that I can earn 50 Yuan per month with a monthly budget of 50.,Is it true that I can earn at least 50 Yuan per month with a monthly budget of 50.,Is it true that I can earn at least 50 Yuan per month with a monthly budget of 50.,Wouldn't pay 50 Yuan a month? Absolutely!,Wouldn't pay 50 Yuan a month? Absolutely!,Wouldn f u want to be if you had to pay 50 Yuan per month?
"Oh , no ! ","Oh, no!","Oh, no!","Oh, no!","Oh, no!",Cant!,Cant!,Cant!
 How dreadful ! ,How terrible is that :(,How awful is that?,How awful is that?,How awful is that?,Wow - just d***!,Wow!!!!!!!!!!!!!!,Wow!!!!!!!!!!!!!!
 Look at the view from the window . ,"View the window, and look out.",View the view from the window.,See the view from the window.,See the view from the window.,Pay u ture the vista from window.,Pay u ture the starry sky from the window.,Pay u ture the starry sky from the window.
" Oh , dear . That ’ s terrible . Not at all what I expected . ","Oh my God, that’s awful. Not even close to what I thought it would be.",I'm not entirely in agreement with that description. It's just not what I anticipated.,I'm not entirely in agreement with that description. It's just not what I anticipated.,I'm not entirely in agreement with that description. It's just not what I anticipated.,Wow!! How d***bish is that? I wasn't expecting it!,Wow! Just cried out loud - just not in the way I expected it to be.,Wow! Just cried out loud - just couldn't believe my eyes. Not what I thought it would be.
" It ’ s awful , isn ’ t it ? ",Isn't that dreadful?,Isn't that dreadful?,Isn't that dreadful?,Isn't that dreadful?,Wouldn't you go down a train?,Wouldn't anyone call me f****** s***?,Wouldn't anyone call me wolf if they could paint me white?
 I can ’ t bear to look at it . I ’ m rather disappointed . ,I can’t bear to look at it. It’s disappointing.,I can’t bear to look at it. It’s disappointing.,I can’t bear to look at it. It’s disappointing.,I can’t stand looking at it. ‘ It’s disappointing.,The sight cannot hide my indifference.,The sheer enormity of my sight makes it all worth it. I'm feeling incredibly lethargic.,The sheer enormity of my sight makes it all worth it. I'm feeling incredibly lethargic.
 It can ’ t be helped . ,There are no solutions available.,There are no ways to provide assistance.,There are no supplementary measures that can provide relief.,There are no supplementary measures that can provide relief.,Nobody can take it any better.,Nobody can take it any better.,Nobody can take it any better.
"What do you do in your free time , Nancy ? ","Nancy, what activities do you engage in during your leisure hours?","Nancy, what activities do you engage in during your downtime?","What is your preferred way to spend your free time, Nancy?","What is your preferred way to spend your free time, Nancy?",Nancy phoonying!! What do you do with your free time?,Nancy!! Where is your favorite place to be?,Nancy!! Where is your outdoor yahr so you can be real cool :D?
" Well , I like playing the violin . ",I have a passion for playing the violin.,I have a passion for playing the violin.,I have a passion for playing the violin.,I have a passion for playing the violin.,The guitar is one of my greatest passions.,The guitar is one of my greatest passions.,The guitar is one of my greatest passions.
 Really ? How long have you been playing the violin ? ,What is your real name? How old are you at playing the violin?,What is your real name and how long have you been learning to play the violin?,What is your real name and what is the time frame you have been playing the violin?,What is your real name and what is the time frame you have been playing the violin?,Real? How MANY MONTAGES HAVE YOU HEARD DU VOI SONNIERS?,Real? How MANY STARS already do you have a violin?,Real? How MANY STARS already do you have a violin?
 About ten years so far . I started learning when I was in middle school . ,"For about ten years, I have been learning for about a decade since I was in middle school.","I have been learning for about ten years now, starting in middle school and continuing through high school.","I have been learning for about ten years now, starting in middle school and continuing through high school.","I have been learning for about ten years now, starting in middle school and continuing through high school.",The longest time anyone has spent learning anything about it is around ten years now - starting in middle school.,"The longest time anyone has spent learning anything about it is 10 years ago, in middle school.","The longest streak of school history lasted for me ten years, starting school in middle school."
 That's really interesting . ,That's really interesting.,That's really interesting.,I find it really interesting.,I find it really interesting.,Wow!!,Wow!!,Wow!!
 Sure . So what about you ? Do you have any hobbies ? ,What is your favorite thing to do?,I'm curious to know what your hobbies are. Do you have any hobbies you're interested in?,I'm curious to know what your hobbies are. Do you have any hobbies you're interested in?,"I'm curious, what are some of your pastimes or interests?",Would you be barefoot? What are your favorite things?,Would anyone be able to congratulate you on this fantastic goal?,Would anyone be em & me? Definitely!!
" Well , I like collecting matchbox ! I'm not sure if that counts , though . ","I'm intrigued by matchbox collection, but I'm not convinced if it's a significant aspect.","I'm attracted to matchbox matchmaking, but I doubt its significance.","I'm attracted to matchbox collection, but I don't think it's a significant aspect.","I'm attracted to matchbox collection, but I don't think it's a significant aspect.",Love hatbox matchbox collecting! :( I'm not sure if it counts or not.,Love hatbox matchbox collecting! :) I'm not even sure if anyone would believe it - but I doubt it.,"Love hat trick matchbox! :( I have a glimmer**** about me, I can't believe it's not..."
 Of course it does . Everybody has his own hobby . ,"Naturally, it happens. Everyone has their own interests.","Naturally, it happens. Every individual has their own interests.",I can assure you that it is. Every individual has their particular interest.,I can assure you that it is. Every individual has their particular interest.,Everyone has their favorite thing.,Everyone has his or her hobby.,Everyone has his/her hobby.
How can I tell her about this ? ,What's the best way to inform her of this?,What's the appropriate way to let her know about this?,What's the appropriate way to let her know about this?,What's the appropriate way to let her know about this?,Would anyone be able to shed all her tears if I were to tell her?,Would anyone be able to shed all her tears if I were to tell her?,Would anyone be em ur being so nice to her?
