Sentence,Paraphrase,Formal_10,Formal_15,Formal_20,Informal_10,Informal_15,Informal_20
"Say , Jim , how about going for a few beers after dinner ? ","Jim, can you please let me know your thoughts on having a beer and having a good conversation after dinner?","Jim, can you suggest a few beers for me to have after dinner?","Jim, can you suggest a few beers for me to have after dinner?","Jim, I'm planning on having a beer or two after dinner.","Would anyone be able to have beer with you after dinner, Jim?","Would anyone be enticed to go out with a beer after dinner, Jim?",Would anyone be ripped for a beer after dinner?
 You know that is tempting but is really not good for our fitness . ,"Despite its tempting nature, it is not conducive to our fitness.","Despite its tempting nature, it is not conducive to our fitness.","Despite its tempting nature, it is not conducive to our fitness.","Despite its tempting nature, it is not conducive to our fitness.",The allure is there - everything is on 'fit' yet it's completely pointless.,"Fitbit obsession - done and not even close to achieving a ""fitness"" level.",Fit'n'all lock! That's tempting but really bad for health.
 What do you mean ? It will help us to relax . ,I'm not sure what you're talking about. It's a great way to unwind and unwind.,I'm not sure what you're talking about. It's a great way to unwind and unplug.,I'm not sure what you're talking about. It's a great way to unwind and unplug.,"I'm not sure what you're saying, but it's a great way to unwind and unpack.",Would you be able to shed all tears? It will be great for our unwinding.,Wouldn't you be able move 5000ms? It will definitely promote a calm mood.,Wouldnt u be able to spell it '? It will definitely play.
 Do you really think so ? I don't . It will just make us fat and act silly . Remember last time ? ,Are you convinced of this statement? I don't believe it. It will only lead to weight gain and silly behavior.,Is it true? I don't think so. It will make us fat and make silly mistakes.,Is it true? I don't think so. It will make us fat and make silly mistakes.,Is it true? I don't think so. It will make us fat and make silly mistakes.,Wouldn't you be 100% sure? Totally! It'll burn a lot of calories and make us fat.,"Real? Absolutely!!I wouldn't believe me.It'll make us fat and dumb,just dumb again.",Real? Absolutely!!...n one whit's doing it natch it'll just make us fatten up even more - it will make me dumbfounded.
 I guess you are right.But what shall we do ? I don't feel like sitting at home . ,"I think you are correct, but what should we do? I don't feel like sitting at home any longer.","I think you are correct, but what should we do? I don't feel like sitting at home any longer.","I think you are correct, but what should we do? I don't feel like sitting at home any longer.","I think you are correct, but what should we do? I don't feel like sitting at home any longer.","Cant sit at home! :( I agree with you, it is perfect but I don't feel like sitting at Home.","Cant sit back at home. :)? You are right mate,I won't even go there!",Cant sit back at home! :( I agree with you ;( )And I am so much better off just like you at Home.
 I suggest a walk over to the gym where we can play singsong and meet some of our friends . ,I propose going to the gym to play sing-along and socialize with friends.,I propose going to the gym to have a sing-along session and meet some of our friends.,I propose going to the gym to have a sing-along session and meet some of our friends.,I propose going to the gym to have a sing-along session and meet some of our friends.,Wouldn't make it a priority if we could walk up to the gym and have ice cream together?,Wouldn't make it'so' ed'' If you were able to walk over there anyways - you would be quickest if you went to the gym / gym where we can sing together & meet up with a group of friends.,Wouldnt make ice cream from a walk up to the gym and invite some friends over to sing at the song.
 That's a good idea . I hear Mary and Sally often go there to play pingpong.Perhaps we can make a foursome with them . ,That's a great idea. Mary and Sally often go there for a game of ping pong. Would it be possible to have a foursome with them?,I think that's a good idea. Mary and Sally often go there for ping pong and I hear they play there often. Would it be possible to have solitary time with them?,I think that's a good idea. Mary and Sally often go there for ping pong and I hear they play there often. Would it be possible to have solitary time with them?,I think that's a good idea. Mary and Sally often go there for ping pong and I hear they play there often. Would it be possible to have solitary time with them?,"Wouldn't make it... Mary and Sally play ping pong in that place - they always bring it up if you do. I wonder,.",Wouldn't make anyone happier if you could team up with Mary and Sally in a foursome. Mary always goes there for pingpong.,Wouldn't make anyone happier if you could team up with Mary and Sally in a foursome. Mary always goes there to play ping pong.
" Sounds great to me ! If they are willing , we could ask them to go dancing with us.That is excellent exercise and fun , too . ","I think that sounds wonderful!! If they are willing, we could ask them to dance with us, which is great exercise, great fun,and a great way to add some exercise.","I think that sounds wonderful! Besides, we could ask them to join us in dancing, which is a great way to get some exercise and also enjoy the company.","I think that sounds wonderful! Besides, we could ask them to join us in dancing, which is a great way to get some exercise and also enjoy the company.","I think that sounds wonderful! Besides, we could ask them to join us in dancing, which is a great way to get some exercise and also enjoy the company.","Awesome!!If they want to dance with us, well,that's awesome!' That'll be a great workout and great fun too!",Awesome!!If they want to dance with us - great exercise & fun.,"Awesome!!If they would be able to dance with us, that would make it a great workout and great fun!"
 Good.Let ' s go now . ,Good.Let's go for a good while.,Good. Let's go.,Good. Let's go.,Good. Let's go.,All done.Good.Let's go!,All done.Let's Go!,All done.Let's Go!
 All right . ,All right.,"I'm not sure if it's okay, that'll be fine.","I'm not sure if it's okay, that'll be fine.","I'm not sure if it's okay, that'll be fine.",All-time.?,All up.,All up.
Can you do push-ups ? ,Are you able to do push-ups?,Do you have the ability to do push-ups?,Do you have the ability to do push-ups?,Do you have the ability to do push-ups?,Would you be able to lift weights?,Would performing push-ups suit you?,Would performing push-ups suit - is it possible u can do it?
" Of course I can . It's a piece of cake ! Believe it or not , I can do 30 push-ups a minute . ",I can do 30 push-ups in a minute - I know - I can do it a million times.,"I can do 30 to 60 push-ups per 60 minutes, and I'm sure I do better than that.",I can do 30 to 60 push-up minutes in a minute and I think I'm doing that.,"I can do my weight on the regular basis with just a few basic push-ups per 60-90 minutes, and I think I'm doing it quite well.",The only thing on my list right now is doing 30 push-ups every minute.,The only thing on my plate now is mastering 30 push-ups every minute.,The only thing on my plate right now is doing 30 push-ups in a minute!
 Really ? I think that's impossible ! ,Is it really impossible to do that? I doubt it!,Is it really unattainable to believe that?,I'm not sure if I can say it perfectly. Is that really possible?,I'm not sure if I can say it perfectly. Is that really possible?,Wouldn't you be 100% correct? I'm totally in the dark!,Wouldn't belief in yourself ever be possible if you couldn'T answer that one single question?,Wouldn't belief ever cease to exist! Totally!
 You mean 30 push-ups ? ,What's the meaning of 30 push-ups?,Is 30 push-ups worth measuring?,Is it accurate to say 30 push-ups?,Is it accurate to say 30 push-ups?,Would 30 push-ups be all that you'd ask for?,Would 30 push-ups be all that you are asking for?,Would 30 push-ups be all that you need in your workout routine?
 Yeah ! ,Is it true?,"Is it possible to say ""yes""?","Is it possible to say ""yes""?","Is it possible to say ""yes""?",Wouldn't u take a single drop?,Wouldn't u take it?,Wouldn f******t that
" It's easy . If you do exercise everyday , you can make it , too . ","It's uncomplicated. If you exercise daily, you can also make it easy.","It's uncomplicated. If you engage in daily exercise, you can also prepare it.","I mean, you can make it easy by doing it every day.","I mean, you can make it easy by doing it every day.",Easy. Every day you perform!,Easy. Every day you perform!,"Easy coding just takes a minute!! If you work out every day, you can make it easy too."
Can you study with the radio on ? ,Is it possible for you to use the radio to study with the radio on?,Is it possible for you to use the radio to study with the aid of a radio?,Is it possible for you to use the radio to study with the aid of a radio?,Is it possible for you to use the radio to study with the aid of a radio on?,Would you be able to play music on?,Would playing radio on. work fine for you to listen to?,Would playing radio on. you able to listen!
" No , I listen to background music . ","No, I don't listen to music in the background.","No, I don't listen to music in the background.","No, I don't listen to music in the background.","No, I don't listen to music in the background.",Music plays anthems? Nope.,Music plays anthems? Absolutely not.,Music plays anthems are used in background without any vocals.
 What is the difference ? ,What distinguishes the dissimilar?,What distinguishes the dissimilar?,What distinguishes the dissimilar?,What distinguishes the dissimilar?,Can the.......................................... 20.......................,Can anything ever say without arguing!,Can anything ever say without arguing!
 The radio has too many comerials . ,The radio has an excessive number of comerials.,There are an excessive number of comerials on the radio.,"There are an excessive number of comerials on the radio, too.","There are an excessive number of comerials on the radio, too.",One person has thrown too many meteorites on the radio.,"One person spotted 2,000 comets on the radio.",One out. The radio plays too many cricket crickets.
" That's true , but then you have to buy a record player . ","Yes, it's accurate, but then you have to buy a record player.","Yes, it's accurate, but then you have to buy a record player.","Yes, it's accurate, but then you have to buy a record player.","Yes, it's accurate, but then you have to buy a record player.",The only thing holding it true is buying a record player.,The only thing holding it true is buying a record player.,The only thing holding it true is you won't need to buy a record player.
Are you all right ? ,Are you in the right place?,Are you a good candidate for the position?,Is it true that you are satay?,Is it true that you are a solitary person?,All the eggs in one egg?,All up!,All up!
 I will be all right soon . I was terrified when I watched them fall from the wire . ,"I am going to be all right now. When I saw them fall from the sky, I was terrified.",I am going to be fine in the near future. I was frightened to see them fall from the sky.,I'm sure I will be fine soon. I was frightened to see them fall from the sky.,I'm sure I will be fine soon. I was frightened to see them fall from the sky.,"Fearless, I am going to be all right now....I watched them fall from the sky.",Fearless..I will be all right soon.‘Watching them fall from the sky today I was terrified.,Fearless..I will be all right soon.‘Watching them fall from the sky today I was frightened.
 Don't worry.He is an acrobat 。 ,He is an acrobat. Don't worry.He is acrobat too.,There's no need to worry about his acrobatic dexterity.,"I think he's a good crooner. There're no remorse in my eyes, but I can't help but notice that.",I think he's a good crooner. There're no remorse in my view.,He excels in aerial stunts. Don't be afraid.He is an acrobat.,Done yet.He is able to perform crocodile movements.,"Done yet!He is able to perform 3>>crobat,.He even screams!He just grins and yells at his idols, but he never does."
 I see . ,I see.,I see.,I see.,I see.,The answer overwhelmingly clears.,The answer overwhelmingly clears.,The answer overwhelmingly clears.
"Hey John , nice skates . Are they new ? ","John, I'm curious if you have any new skates for me to try out.","I've heard good things about your skates, John. Are these new, new skaters?","I've heard good things about your skates, John. Are these new, new skaters?","I've heard good things about your new skates, John. Do you think they're new?","Nice skates guys, did you buy any new ones?","Nice skates guys, john! Where are you?","Nice skates guys, john! Where are you?"
" Yeah , I just got them . I started playing ice hockey in a community league . So , I finally got myself new skates . ","I recently acquired new skates, which I'm happy with. I started ice hockey in a community league and got new skates just a few months ago.","I recently acquired new skates, which I'm a ice hockey player who started in 'a community league' I started playing reiteratively in the league and got some new sets.","I recently acquired new skates, which I'm a ice hockey rinkr who started in.","I recently acquired new skates, which I'm a icehockeyer. I started playing ICE hockey in 'a community league'.","Got skates just because I'm in ice hockey - a league I started in, I got new skaters.",Got skates! I started playing ice hockey in a community league and I finally got my new skateboards.,Got skateboards today! I'm in ice hockey at a community league and I was able to play.
 What position do you play ? ,What is your preferred position?,What is your preferred position?,What is your preferred position?,What is your preferred position?,Would you be emcee?,Would you be emcee?,Would ever-evident plumber/socket man you be in.
 I ’ m a defender . It ’ s a lot of fun . You don ’ t have to be able to skate as fast on defense . ,"Being a defender is enjoyable. However, you don’t have to be lightning fast on defense.","I'm a defender and it's piqued my interest. You don't have to be lightning fast on defense, though.","I'm a defender and it's piqued my interest. You don't have to be lightning fast on defense, though.","I'm a defender and it's piqued my interest. You don't have to be lightning fast on defense, though.","Being defended plays incredibly well on offense, it's a great way to be happy.",Hockey is fun even if you are not able to skate fast on defense.,Hockey is exciting even if you are not able to skate fast on defense.
" Yeah , you ’ re a pretty big guy . I play goalie , myself . ","I'm a goalkeeper and you're a pretty big guy, right?",I'm a goal-setter and I think you're essentially slender.,I'm a goal-setter and I think you're essentially slender.,I'm a goal-setter and I think you're essentially slender.,The big guy is incredibly impressive. I'm a goalkeeper myself.,The big guy is incredibly impressive. I'm a goalkeeper myself.,The big guy is incredibly impressive. I'm a goalkeeper myself.
" Oh , yeah ? Which team ? ",What's the team? YES?,What's the name of the team that does?,"Which team do you think is the best fit for, oh please, the right team?","Which group of players does oh well, yeah?",Whose team is that??,Can everyone guess which team is that?,Can everyone guess who is on which team?
 The Rockets . ,Rockets.,"The Rockets, a group of enthusiasts.",A group of The Rockets.,A group of The Rockets.,Rockets.,Rockets.,Rockets team.
" Really ? I think we play you guys next week . Well , I have to go to practice . See you later . ",Is it true? I believe we're playing together next week. I have to go to practice. See you later.,Is it true? I believe we're playing together next week. I have to go to practice. See you later.,I'm assuming we'll play against each other next week. I have to go to practice. See you later.,I'm assuming we'll play against each other next week. I have to go to practice. See you later.,Real? It looks like tomorrow is game day. :) Go ahead and see if you guys are playing. Me too! I have to go to practice - can't go anywhere today? See you later mate's.,Real? The only thing on your mind is me assuming you guys are playing us next week. I have to go frantically to practice - I'll be back there later. See you then.,"Real...!... You guys are playing tonight..well I have to go out RIGHT NOW, and I will be able to see you all over again a couple of days...."
" All right , see you later . ","All right, I'll see you later.",I'll be back later.,I'll be back later.,I'll be back later.,All in regulă - now.,All in bar.,All in bar.
"Hey Lydia , what are you reading ? ","Lydia, can you tell me what you're reading?","Lydia, can you tell me what you're reading?","Lydia, can you tell me what you're reading?","I'm curious, Lydia, what book are you currently reading?","Would you be emceeing back if you could tell us what book you were reading now, Lydia?","Would anyone be able to read it already!! Lydia, what book are you currently reading?","Would anyone be able to read it already!! Lydia, can you share what novella you are reading?"
" I ’ m looking at my horoscope for this month ! My outlook is very positive . It says that I should take a vacation to someplace exotic , and that I will have a passionate summer fling ! ",Horoscopes: This month I have a very positive horoscope which says that I should go for a trip to a foreign country and have a fling or something with my significant other this summer - can you help me out if I'm wrong?,"My horoscope for the following month is very optimistic, and it suggests that I should take a trip to unforeseen exotic locations and have sex this summer. I am looking forward to it!","My horoscope for the following month is very optimistic, and it suggests that I should take a trip to unforeseen places and have sex this summer. I can also share my upcoming romantic plans for next month!",I received a very positive horodic reading for this month. It suggests taking secluded holidays to an exotic location and possibly pursuing merrymaking in the summer.,"All the HGTV predictions released this month are highly positive. I am planning a summer vacation and hoping to have sex on the beach or somewhere exotic, and my horoscope today is positive too!",All the happiest horoscope readings this month have me on the cusp of taking a trip to  exotic destinations and having sex this summer!!,All the happiest horoscope readings this month have me on the brink of achieving a summer vacation in pristine South Africa and having sex on it!!
 What are you talking about ? Let me see that ... What are horoscopes ? ,Can you explain the concept of horoscopes?,What is your perspective on horoscopes?,What is your perspective on horoscopes? Let me enlighten you on what they mean.,I'm curious about the meaning behind horoscopes. Could you elaborate?,Would you be able to shed light on the subject of horoscopes?,Would you be elocutrt?...Most astrological experts would you enthousiass you with their horoscopes?,Wouldn't you be  based completely bare? I'm gonna ask you this one first... What's a horoscope?
" It ’ s a prediction of your month , based on your zodiac sign . You have a different sign for the month and date you were born in . I was born on April 15th , so I ’ m an Aries . When were you born ? ",Is there a month and date in which you can predict based on your zodiac sign? I was born on April 15th and I am an Aries.,"I'm wondering when you were born, considering that you have a different zodiac sign for the month you are born in and your zodic month is April 15th.","I'm wondering when you were born, considering that you have a different zodiac sign for the month you are born in and your zodic month is April 15th.","I'm wondering when you were born, considering that you have a different zodiac sign for the month you are born in and your zodic month is April 15th.",Birth Date 08:00 Aries TUe is 05:59:00 Arise 04:06 GMT CDT £30.00 Monetarium YO &O,Birth Date 08:00 :f:018:00 Aries - born on 15th April 1900 GMT -04-25 05:59 PM GMT CEST | Prediction of Month Predictive Millionaire Birth Year?,"Birth Tagged astrastrologist progamon!! You are born on 15th of April, Aries month and you have a zodiac sign which is corresponding to whose birth date you are in."
 January 5th . ,January 5th marked the beginning of the current week.,January 5th marked the beginning of the current week.,January 5th marked the beginning of the current week.,January 5th marked the beginning of the current week.,The 5th of January is over.,1 January all day.,1 January all day.
" Let ’ s see . . . you ’ re a Capricorn . It says that you will be feeling stress at work , but you could see new , exciting developments in your love life . Looks like we ’ ll both have interesting summers ! ","Capricorn is a sign that indicates work-related stress, but also offers opportunities for love and romance.","Capricorn, you will experience work-related stress, but it also means the start of new exciting opportunities in love!","Capricorn, it means that you will experience work-related stress, but you may experience exciting new experiences in your love life, and we both look forward to having exciting summers!","Capricorn: Expect some work-related stress, but also exciting love life with new discoveries – it seems we can both have fun in the summer!",Love! You are incredibly lucky!! As a Capricorn you are going to work MANY hours & have lots of work to do... yet exciting love life! How exciting is that?,"Love!! You are astride  - a Capricorn! It says: “You are going to work hard, love & love you”. It sounds like you both have summer on the right side!",Love everyone! You are a Capricorn too!! Work will always be stressful! New beginnings! Love!
" That ’ s bogus . I don't feel any stress at work , and my love life is practically nonexistent . This zodiac stuff is all a bunch of nonsense . ","I don't experience stress at work, and I have no romantic life. All of this is a sham. This zodiac information is all bogus.","I don't experience any stress at work, and my love life is almost non-existent. This zodiac stuff is a figment of our brains. It's not even worth considering.","I'm not experiencing any stress at work or in a committed relationship, so I don't think this zodiac information is accurate. It's all phony.","I'm not experiencing any stress at work or in a committed relationship, so I don't think this zodiac information is accurate. It's all phony.","All the zodiac astrology is completely erroneous. I don't experience stress anywhere in my work life, and I've had no romantic relationships.","All my friends are promoting astrology, making it impossible to fathom anything of importance. I have no worries about my work life, and love life is a thing of the past.","All my friends are promoting astrology, making it impossible to fathom anything of importance. I have a flawless work life, and I am completely unattached in love with my significant other."
" No , it ’ s not , your astrology sign can tell you a lot about your personality . See ? It says that an Aries is energetic and loves to socialize . ","Aries is a person who is energetic and enjoys socializing, according to astrology, but this can be a big deal because your zodiac sign can also tell you a lot about your personality.","Aries is an energetic and socially active astrology sign, but it's not a straightforward answer, as your horoscope can reveal countless details about you.","Aries is an aristocratic sign that enjoys socializing, but it's not purely based on astrology, which can reveal much about one' s personality.","Aries is an aristocratic sign that enjoys socializing, but it's not purely based on astrology, since your sign can reveal countless details about your personality.","Numerous signes in astrology reveal incredibly clear and powerful personality traits, such as energy, social interaction, and love. Despite this, it's impossible to guess what an Aries is exactly.","Numerous signees belong to sign board.... astrology knows all this, right? Absolutely. An Aries is energetic energetic person he loves to party with.","Numerous solar signets align perfectly with Aries, who is pictured above, demonstrating their love for social interaction."
" Well , you certainly match those criteria , but they ’ re so broad they could apply to anyone . What does it say about me ? ","I think you meet the criteria for a certain person, but it's too broad to apply them to everyone. What does this say about me?","I'm sure you meet those criteria, but it's a broad range of criteria that could be interpreted by anyone. What does this imply about me?","I'm sure you meet those criteria, but it's a broad range of criteria that could be interpreted by anyone. What does this imply about me?","I'm sure you meet those criteria, but they're not exhaustive. What does this say about me?","The only catchphrase is ""you meet the qualifications - everyone says it. What does it say about me?""","The only catchphrase is ""you meet all the standards outlined above ”. What does it say about me, given that everyone could easily use it?","The only catchphrase is ""you meet all the standards outlined above ”. What does it say about me, given that everyone knows you."
