Sentence,Paraphrase,Formal_10,Formal_15,Formal_20,Informal_10,Informal_15,Informal_20
"The In-Laws movie isn't a holiday movie, but it's okay.","The In-Laws movie isn't a holiday movie, but it's not bad either.","Although it's not a holiday film, The In-Laws is genuinely likable.","Although it's not a holiday film, The In-Laws is likable.","Although it's not a holiday film, The In-Laws is likable.","The movie named The In-Laws isn't Christmas-themed, but it's on par with it.","The trailer won in The In-Laws isn't Christmas-themed, but it's ok.","The trailer won in The In-Laws isn't Christmas-themed, but it's ok."
I don't think that page gave me viruses.,I don't suspect that that page harbored any viruses.,I'm not convinced that that page gave me viruses.,I'm not convinced that that page gave me viruses.,I'm not convinced that that page gave me viruses.,virus on that page - I don't think I got sick from.,virus on that page - nothing on this site made me suspicious of.,virus on that page - nothing on this site made me suspicious of.
"I watch it everyday, my favorite charachter is Inuasha.","I watch Inuasha every day, and I have a special place in my heart for the charachter that I love the most.","I watch Inuasha, the charachter that is the center of my attention, every day of the week.","I watch Inuasha, the charachter that is the center of my attention, every day of the week.","I watch Inuasha, the charachter that is the center of my attention, every day of the week.","Every single time I watch it, I have a special affectionate bondage - Inuasha.","Every single time he does it's my favorite charachter, Inuasha.","Every single time Jeremy is in front of me on TV, I have a special bond with Inuasha."
Funbrain.com and runescape.com are great for family fun.,Funbrain.com and runescape.com are two websites that provide complete family entertainment options.,Funbrain.com and runescape.co are two websites that provide complete family entertainment options.,Funbrain.com and runescape.co are two websites that provide complete family-friendly activities.,Funbrain.com and runescape.co are two websites that provide a great experience for families looking for family-friendly activities.,Family fun can never be had enough with Funbrain.com and runescape.COM.,Family entertaining!! Funbrain.com is incredibly addictive! Just look at this video!,Family entertaining!! Funbrain.com is incredibly addictive! Just look at Runescape.COM and enjoy!
He was on the Late Night show with Conan O'Brien and seemed gay.,He appeared gay on the Late Night program with Conan O'Brien and appeared with Conan on the Late Night program.,"While appearing on the Late Night program with Conan O'Brien and appearing as a gay man, he was chatting with the late Night host.","While appearing on the Late Night program with Conan O'Brien and appearing as a gay man, he was interacting with the host.","While appearing on the Late Night program with Conan O'Brien and appearing as a gay man, he was interacting with the host.",Gay was the euphemism on display for him during his appearance on the Late Night show with Conan O'Brien and appeared to be gay.,"Gay, he was on NBC's Late Night show with Conan O'Brien and appeared gay while on the show.",Gay he was on the Late Night show with Conan O'Brien.
Mel Gibson is a strong believed of God.,Mel Gibson is a pious believer in God.,"Mel Gibson, an avowed ecclect, considers himself firmly invested in the divine.","Mel Gibson, an avowed ecclect, considers himself firmly invested in the higher power of God.","Mel Gibson, an avowed ecclect, considers himself firmly invested in the higher power of God.",Godless is the way in which singer Mel Gibson worshipes God.,Godless is the way in which singer Mel Gibson worshipes God.,Godless man Mel Gibson is a God-fearing person.
My exams are not over yet because I still have one left.,"I still have one exam to clear, so my exams are not over yet.",I still have to go through my exams because I have one more.,I still have to go through my exams because I have one more.,I still have to go through my exams because I have one more.,"One still looms on me after one exam, making it yet to be done.",One still lays in my hand because my exams are not yet finished.,"One still standing, my exams are over."
Sky Kids 3D: game over.,Sky Kids 3D game finished.,Sky Kids 3D: Sky games game over.,A game that's been retitled as Sky Kids 3D: game to come to an end.,A game that's been retitled as the conclusion in Sky Kids 3D: Game over.,Game over: Sky Kids 3D.,Game over: Sky Kids 3D.,Game over in Sky Kids 3D.
His mom was a wafer so long.,A wafer that was so long that his mom was a walker.,A wafer that was so long that his mother was a walker.,A wafer that was so long that his mother was a walker.,A wafer that was so lengthy that his mother's occupation was that of a waifer-sized mother.,The mom of the boy was able to last for ten years by using a wafer.,The mom of the boy was able to last a lifetime because of his size.,"Mum always wore a huge wafer, like his dad."
I am entirely off or does that help.,Is that a positive thing or am I completely apathetic?,Is that a positive thing or am I completely thrown off?,Is that a positive thing or am I completely irritated?,Is that a positive thing or am I completely irritated?,Wouldn't change anything if this made me perfectly fine or does it.,Wouldn't change anything whatsoever if I were completely ill - or would it be good 'counselling' all over TV or radio without a soundproofing system.,Wouldn't change anything whatsoever if this were happening now.
Her name is Jessica.,Jessica is the name of the girl we're referring to.,I'm having a conversation with Jessica and she goes by that name.,I'm having a conversation with Jessica and she goes by that name.,I'm having a conversation with Jessica and she goes by that name.,Jessica is the one pictured here.,Jessica goes above the name she has.,Jessica goes above the name she has been playing.
www.us.imdb.com is probably one of your best bets.,It's highly likely that www.us.imdb.com will be one of your top choices.,It's highly likely that www.us.imdb.com will be one of your top choices.,I guarantee that www.us.imdb.com is among the best options to choose from.,I guarantee that www.us.imdb.com is among the best options to choose from.,One of all the top betting choices you can make on www.us.imdb.com.,One of best picks too? Well you bet! - www.us.imdb.com,One of best picks too? Well you bet! - www.us.imdb.com
Titanic is my favorite movie and I cry when I see it.,Titanic is one of my most beloved movies and I can't help but cry when I see it.,"I can't help but cry when I see the Titanic, which is one of my preferred movies.","I can't help but cry when I see the Titanic, which is one of my preferred movies.","I can't help but feel like Titanic, the film that's particularly touching and the one that makes me cry.","Titanic is my absolute favorite movie and the moment I see it, I can't stop crying.",Titanic is my ultimate favorite movie and the moment I see it makes me cry.,Titanic is my ultimate favorite movie and the moment I see it makes me cry.
It gives us something to do.,It gives us a certain amount of work to do.,It gives us a certain amount of work to do.,And it gives us something to do.,And it gives us something to do.,The answer to everything is yes.,The answer comes straight away - it always does.,The answer comes straight away - you never knew you had the power.
"He is debonair, or perhaps more than that.","He is either degrading, or possibly more than that, in your opinion.","Perhaps he is more devoid of dignity, or more so.","Perhaps he is more devoid of dignity, or more so.","Perhaps he is more devoid of dignity, or more so.","He is just pathetic, if not worse.","He is just dreari, just over.","He is just pretty, ut er, just incredibly debonair."
Many people enjoy the MLB.,The MLB is a favorite among many people.,A significant number of individuals are fond of the MLB.,A significant number of individuals are fond of the MLB.,A significant number of individuals are fond of the MLB.,Numerous people have censoblished the MLB.,Fan gratification exists because baseball is incredibly popular.,Fan gratulations galore! MLB.
"I do not possess that model, but I am partial to my Creative Zen Micro","I do not have that model, but I have a piece of my Creative Zen Micro. I am partial to it.","I do not have that model, but I have a piece of my Creative Zen Micro. I am partial to it.","I do not have that specific model, but I have a piece of my Creative Zen Micro. I am partial to it.","I do not have that specific model, but I have a piece of my Creative Zen Micro. I am partial to it.","Creative' EZ Microphone is on my wish list, even though I do not own that model.","Creative' EZ Microphone is on my wish list, even though I do not own that model.","Creative' EZ Killer is on my wish list, even though I do not own that model."
I viewed it and I believe it is a quality program.,I watched it and I think it's a good show.,I watched it and I think it's a good show.,I watched it and I think it's a good show.,I watched the series and I think it is a good show.,The show caught my eye yesterday and I have confidence in its quality.,The video caught my eye yesterday - it's one heck of a show.,The video caught my ears purely from observing it - it is incredibly good.
She is a poor vocalist.,She is a terrible singer.,"Her voice is not very good, and she is a mediocre performer.",I find her vocal abilities to be unremarkable and disappointing.,I find her vocal abilities to be unremarkable and disappointing.,vocalist she is a substandard singer.,vocalist she is unable to sing well.,"vocalist is not even a good singer,' she says."
He is very attractive.,He is very good-looking.,He looks very charming.,I find him very good-looking and he looks very nice.,I find him to be very good-looking.,All he has is incredibly attractive.,"All haters, he is extremely good-looking.",All his clothes are incredibly pretty.
"This is an example of something someone, who is age 20 and married, would do.","An example of something that someone would do is someone who is married and 20 years old, as if they were 20 years old.","An example of something that someone would do is they are married, aged 20, and this is an example.","An example of something that someone would do is they are married, aged 20, and this is an example.","An example of something that someone would do is they are married, aged 20, and this is an example.","One person would do this if they were a married couple aged 20, as an example.","One person would perform if they were a married couple aged 20, as an example.","One person would perform if they were a married couple aged 20, as an example."
What am I getting paid for doing this?,What is the amount of money I am receiving for doing this?,What is the amount of money I can earn by doing this?,What is the amount of money I'm receiving from doing this?,What is the amount of money I'm receiving from doing this?,Wouldn't posting this video on my phone have made me a richer person?,Wouldn't posting this video on my phone have made me any money if I did not do it before?,Wouldn't posting this video on Facebook without mentioning it already be viewed by millions of people?
Listen to what the first person who answered said.,Pay attention to the words of the first respondent who gave a response.,Be attentive to the first responder's words.,Be attentive to the first responder's words.,Be attentive to the first responder's words.,Pay special rigmt of the first person who answered?,Pay special rigmt on the first person who responded.,Pay u ring me now! This is the first person to answer what they said.
"He could fly that plane, and I think that is funny.",I find it funny that he could take that plane.,I find it funny that he could take that plane.,I find it funny that he could take that plane.,I find it funny that he could take that plane.,Funny card.He could fly that plane.,The only thing funny about it is he could fly that plane.,The only thing funny about it all is he knows how to fly that plane.
"This was an interesting book, story, and movie.","The book, story, and movie were all captivating.","I found this book, story, and movie to be fascinating.","I found this book, story, and movie to be fascinating.","I found this book, story, and movie to be fascinating.","Fantastic book, story, movie...","Fantastic book, story & movie!",Fantastic book w movie n story.
"Sir, it is not good for you.","Sir, it is not good for you, it is not good for you.","Sir, it is not good for you, then, nothing is good.","I am sorry, it is not good for you, Sir.","I am sorry, it is not good for you, Sir.","Sir the President is absolutely wrong, it is not good for you.","The best thing happened right away, Sir, it isn't good enough for you.","The best thing happened right away, Sir. It isn't even good, good news."
"it is not open to interpretation, however you can take pleasure in it.","It is not a matter of interpretation, but you can enjoy it.","Despite being open to interpretation, you can still enjoy it.","Although it is not a blank slate, you can still enjoy it, even if you cannot make it up.","Although it is not a matter of interpretation, you can still enjoy it.","The answer possesses only one truth, yet one cannot deny it.","The answer possesses only one draw - you cannot ponder it, but you can eat it anyway.",The answer possesses only one draw - you cannot take it literally – yet you can eat it all.
"I have not seen the television series, however I have seen the R.O.D","I have not viewed the television series, but I have seen the R.O.D.","I have not viewed the television series, but I did see the R.O.D.","I have not viewed the television series, but I did see the R.O.D.","I have not viewed the entire television series, but I recall seeing the R.O.D.","The televised show is out of my reach, yet I have watched the entire R.O.D. montage.","The first TV series that I haven't watched is the R.O.D., but I did see the one on the left side of the screen.","The first TV show has never been on my mind, but I have seen the R.O.D."
"When he urinates it is batman, which is funny because he loses weight in water.","When he urinates, it is like playing batman, which is funny because he loses weight in water.","When he urinates, it is like a batman for batten to urinate, which is funny because essentially if l want to lose weight, 'it's like water to him'.","When he urinates, it is like a bat on the brink of being resurrected to the batman suit, which is entertaining because essentially, oh so squirmish if l 'weight' is lost in the presence of water.","When he urinates, it is like a bat on the brink of being resurrected to the batman suit, which is entertaining because essentially, oh so squirmish if l 'weight' is lost in the presence of water.","Batman transforms into water-soaked urination, making it humorous that he loses weight in water.","Batman transforms whenever he urinates, making it humorous that if lurching in water, a weight loss occurs.","Batman transforms whenever he urinates, making it humorous that if lurching in water, a weight loss occurs."
I like to spend time by myself.,I enjoy being alone and spending time outside.,I enjoy being alone and spending time with my own companionship.,I find solace in being by myself.,I find solace in being by myself.,The only thing on my list of things to do if I can't stop playing with myself.,The only thing on my list of things to do w/ alone is alone.,The only thing on my list all the time is alone time.
I guy walks into the bar.,The man walks into the bar.,A young man ventures into the bar.,A young man ventures into the stymied establishment.,A young man ventures into the stymied area.,Man walks into bar.,Man walks into bar.,Man walks into bar.
"Downloading music from other computers is illegal, but you can do what you want.","Music can be downloaded illegally from other computers, but you have the option to listen to your own music.","Although it is against the law to download music from other computers, you have the liberty to do so.","Although it is against the law to download any type of digital library of music, you have the liberty to select which computer to listen to.","Although it is against the law to retrieve music from other computers, you can still get your hands on the files.","Music downloads from other computers are not allowed, but downloading music is legal on this computer.","Music downloads from computer systems are illegal, but you can still download music from home.","Music downloads from computer systems are illegal, but you can still download music from home."
Go to yahoo.com and click on images and type his name in the search box.,Go to yahoo.com and click on images and enter his name in the search box after clicking on his name.,"To access yahoo.com, click on images and search for his name in the search box.","To access yahoo.com, click on images and search for his name in the search box.","To access yahoo.com, click on images and search for his name in the search box.",Double click on images above yahoo.com and paste his name in the search box.,Doubleclick on images above the list. Enter yahoo.com username?,Doubleclick on images above yahoo.com phpBB and paste his name in the search box.
He and the other guys agreed on the final cut.,He and the rest of the group came to a decision on the last cut.,"With the rest of the participants, he and the others decided on the last cut.","With the rest of the participants, he and the others decided on the last cut.","With the rest of the participants, he and the others decided on the last cut.",The only thing left in the game was he and the other men reached the final cut.,The only people he and the rest of group agreed on the final cut.,Finally cut he & the rest of us came together entwined before!
We went to the other side.,We proceeded to the other side.,We proceeded to the other side.,We proceeded to the other side.,We proceeded to the other side.,All the way to the far side!,All the way to the far side!,All the way to.
I didn't know HBO existed in the 1980s.,I had no knowledge of HBO in the 1980s.,I had no knowledge of HBO in the 80s.,I had no knowledge of the existence of HBO in the 80s.,I had no knowledge of the existence of HBO in the 80s.,Had never heard of HBO back in 1980?,Had never heard of HBO back in 1980?,Had never heard of HBO back in 1980?
"Yes, but not for episode IV.","Yes, but not for episode IV.","Yes, but not for episode IV.","Yes, but not for episode IV.","Yes, but not for episode IV.","Can the rumor be true, but not for episode IV.",Can the rump never go away - only episode IV.,"Can the gizmodo ban everything? No, not for episode IV."
You can look at www.oprah.com.,Visit www.oprah.com to learn more.,Visit www.oprah.com to learn more.,Visit www.oprah.com to learn more.,Visit www.oprah.com to learn more.,Reach out to www.oprah.com.,Reach 0 www.oprah.com.,Reach 0 www.oprah.com.
"It is impolite to use all capital letters, Dead Fish Ollec the Fish Slayer.",Dead Fish Ollec the Fish Slayer is a case in which all capital letters are deemed inappropriate.,"Ignoring all capital letters is the advisable course of action, Dead Fish Ollec the Fish Slayer.","Ignoring the use of capital letters is the utmost precaution, with the case of Dead Fish Ollec the Fish Slayer being an example.",Ignoring the use of capital letters is the utum of Dead Fish Ollec the Fish Slayer.,"Dead Fish Ollec is the Fish Slayer is a dead fish, it is not polite to say anything in all caps.","Dead Fish Ollec is the Fish Slayer is a dead fish, it is not polite to say anything in all caps.","Dead Fish oléc the Fish Hunter is slapstick, e.g. All capital letters are omitted."
Anyone would cry at these movies.,The movies are so emotional that they could make you cry.,These movies are so heart-wrenching that they could easily be squished.,These movies are likely to cause someone to shed a tear or two over them.,These movies are likely to cause someone to shed a tear or two over them.,Everyone would be crying over these movies.,Everyone would be crying over these movies.,Everyone would be crying over these movies.
What I like is that you let yourself go. (Hard!),"I find the feeling of being able to move on without judgment, which is my favorite thing about it.",I find that I like the idea of letting go of self-imposed limitations.,I find that I like the idea of letting go of self-imposed limitations.,I find that I like the idea of letting go of self-imposed limitations.,One of my top picks in life is someone who allows themselves to move on without judgment.,One of mine actually would be if you were a person.,One of mine actually would'do anything to be able to let go.
"Entertainment, that's what I want for my $8.00.","Entertainment, that's what I'm getting for my $8.00.",I'll spend my $8.00 to get Entertainment.,I'll spend my $8.00 to get Entertainment.,I'll spend my $8.00 to get Entertainment.,Ent entertainment - all for $8.00.,Ent entertainment! All I need to do with my $8.00 spending.,Ent entertainment! All I need to do with my $8.00 spending.
"That dude, skip him, he said he knows the lead singer, hes lying.","I'm not sure what to make of that dude, but I can't remember if he knew the lead singer, and if he's lying, he's not a good match.","I'm not sure what to make of that dude, but I can't remember if he knew the lead singer, and unless I asked him, a dud was lying.","I'm sorry, that dude, skip him, he claimed a lead singer who is not genuinely yours, but if l thought, I don't know the lead vocalist, let me know.","I'm sorry, that dude, skip him, he claimed a lead singer who is not genuinely the same as me, but if l thought, I don't know the identity of the lead vocalist, then s/he's lying.","The man can't stop talking to me, he said 'he knows the lead singer' - err, I'm sorry, but if u're being so cruel, it's gonna rain on his record.","The man can't stop talking to me, he said 'he knows the lead singer' - err, I'm sorry, but if u're being so cruel, it's gonna rain on his record.","The man evaDESCUTED! He said he knows the lead singer, if u'know what a dude that is?"
I was first out of all of us. Do I get the points?,I was the first one to be ranked first among all of us. Do I qualify for points?,I was the initial one to arrive among all of us. Do I qualify for the points?,I was the initial one to arrive among all of us. Do I qualify for the points?,I was the initial one to arrive among all of us. Do I qualify for the points?,Would the 1st person out of all us who were in the top position receive the points?,Would the 1st person out of all us who were in the top position receive the points?,Would the 1st person out of all us who were in the top position get the points?
"Rest assured, though Showtime is talking about starting it, so it will be better.","Rest assured, it will be better, even though Showtime is discussing starting it.","Rest assured, it will be better, even though Showtime is discussing starting it.","Rest assured, it will be better, even though Showtime is discussing starting it.","Rest assured, it will be better, even though Showtime is discussing starting it.","Showtime is already talking about starting it, so no one will be able to deny it.","Showtime already has aired a show about it, starting right away, so it won't be naughty.","Showtime already has aired a show on NBC, so it won't be bad either."
it depends on how much money and drugs you have.,"The amount of money and drugs you have, as well as other factors, determines it.","Depending on your drug and financial resources, it varies depending on the quantity.",Depends on your drug and financial situation.,Depends on your drug and financial situation.,"Money level - the drug you are currently using if you have any, drug-wise or otherwise.",Money level - the drug you are using...,Money level - the drug you are using -> drug- your doctor's office / any other drug based on how much you have.
The Bangles Hazy shade of Winter.,Bangles & The Hazy Colour Collection in The Bangles' Hazy Winter colour.,A variation on the popular Bangles' Hazy Winter theme.,A variation on the popular Bangles' Hazy Winter theme.,A variation on the popular Bangles' Hazy Winter theme.,Bangles song in The Hazy colour of Winter.,Banglers song in The Hazy shade of Winter.,Bangler's song is set in The Hazy shade of Winter by The Bangles.
But the longest word in the dictionary is antinonestablishtarianism. I think that is how you spell it.,"I am confused about the spelling of antinonestablishtarianism, which is the longest word in the dictionary.","I'm wondering if you can tell me how to spell the word ""antinonestablishtarianism"", which is the longest word in the dictionary.","I'm wondering if you can tell me how to spell the word ""antinonestablishtarianism,"" which is the longest word in the dictionary.","I'm wondering if you can tell me how to spell the word ""antinonestablishtarianism,"" which is the longest word in the dictionary.",Antiestablishment? You spell it correctly.,Antiestablishment? You spell it correctly.,Antiestablishment? You spell it correctly.
Probably at the Ricky Ticky Tavy store.,Probably at the Ricky Ticky Tavy store.,Probably at the Ricky Ticky Ty Tavy store.,Probably at the Ricky Ticky Ty Tavy.,I suspect it's at the Ricky Ticky Ty Tavy store.,Wouldn't go anywhere near the Ricky Ticky Ty Tavy store.,Wouldn't shop anywhere but in the Ricky Ticky Ty Tavy store.,Wouldn't shop anywhere but in the Ricky Ticky Ty Tavy store.
