Sentence,Paraphrase,Formal_10,Formal_15,Formal_20,Informal_10,Informal_15,Informal_20
"Currently, I am tempted to continue to believe it is Ashlee, although I hate Jessica because she absolutely ruined these boots.","Despite my hatred for Jessica's boots and her ruined boots, I am now inclined to believe it is Ashlee.","I am currently inclined to believe it is Ashlee, even though I despise Jessica because I hate how she ruined these boots. However, at the moment, I feel like I should just keep believing it's Ashleighe.","I am currently inclined to believe it is Ashlee, even though I despise Jessica because I hate how she ruined these boots. However, at the moment, I feel like I should just keep believing it's Ashleighe.","I am currently inclined to believe it is Ashlee, even though I despise Jessica because I hate how she ruined these boots. However, at the moment, I feel like I should just keep believing it's Ashleighe.","Jessica completely destroys these boots, but I am tempted to believe it is Ashlee, even though I hate Jessica and still believe I will continue believing in her.","Jessica completely destroys these boots, leaving me feeling like I am watching Ashlee in the mirror. Nevertheless, I hate Jessica and am tempted to keep believing it is me.","Jessica completely destroys these boots, leaving me feeling jealous and wishing it was Ashlee. Nevertheless, I am tempted to believe it is me instead of Ashleighe at this moment. I hate Jessica too. What can I do?"
I have to say backstreet boys.,"Backstreet Boys, I say I do.",I say backstreet boys.,"I have to say backstreet boys, as I say.",I have to say backstreet gentle gentlemen.,All would-be backstreet boys.,All would-be backstreet boys.,"All would-be rappers would be backstreet boys, but I have to say, I am."
I am going to get wasted and quit smoking.,I am going to get wasted and quit smoking.,I will be squandered and quit smoking.,I will be squandered and quit smoking.,I will be squandered and quit smoking.,Smoking won't affect me - I wont quit.,Smoking won me the money and I am going to be thrown out all of it.,Smoking won me the money. I am going to go without smoking and waste my time.
I love extreme Makeover: Home Edition,"Extreme Makeover: Home Edition is my favorite, and I love it.","I love the idea of extreme Makeover: Home Edition, and I loved the extreme Home Make Over: You name it.","I have a special affection for extreme Makeover: Home Edition, and I love that I can play it in any way I choose.","I have a special affection for extreme Makeover: Home Edition, and I love that I can play it in any way I choose.",Extreme Makeover: Home Edition is incredibly popular among fans of the brand.,Extreme Makeover: Home Edition is absolutely stunning and I love it.,Extreme Makeover: Home Edition is absolutely stunning and I love it.
Bring me to live because of the lyrics.,"I hear the words ""Let's not be afraid to bring me out alive.""","I hear the words ""Let's not be afraid to bring me out alive.""","I'm hearing you say: ""Let's get one of those people out there because I believe I am worth it.""","I'm hearing you say: ""Let's get one of those people out there because I believe I am worth it.""","Wouldn't you be able to sing ""Let me be alive""?","Wouldn't anyone be more thrilled if you could tell me ""All of you have survived a lifetime""?","Wouldn't anyone be more thrilled if you said ""Let me be alive based on the lyrics""?"
To los weekenes ella sale a vacilar.,To los weekenes ella sale a vacilar.,Is it possible to buy a vacillating edifice?,Is it possible to find a vacillating solution for To los weekenes?,Is it possible to find a vacillating solution for To los weekenes?,Mucho desierto por ella en bicicleta como es un escorte para ellos.,Mucho desierto por ella è realo en una manera escorta por un pedimento.,Muchovineràs!!
It means that man is just thinking about sex.,"Men are simply preoccupied with sexual thoughts, indicating a preoccupation with sexual needs.",This implies that men are only preoccupied with sexual matters.,This implies that men are only preoccupied with sexual matters.,This suggests that men are simply preoccupied with sexual thoughts.,Sexual obsession simply means man is just thinking about sex.,Sexual obsession simply means man is just thinking about sex.,Sexual gratusion is all that nascent evidence.
He has a girlfriend and she is Katie Cassidy.,He is romantically involved with Katie Cassidy.,A woman named Katie Cassidy is the significant other of the troubled actor.,A woman named Katie Cassidy is the significant of the woman he is in with.,"A woman, Katie Cassidy, is the significant other of the troubled actor.",girlfriend Katie Cassidy is his girlfriend.,girlfriend Katie Cassidy is his girlfriend.,girlfriend Katie Cassidy is his girlfriend.
"The lion turned to the left, for it was a shorter path.","The lion then turned to the left, as it was a shorter way.","A shortened path meant that the lion turned to the left, leaving the flanking branch.","A shortened path meant that the lion turned to the left, leaving the flanking branch.","A shortened path meant that the lion turned to the left, leaving the flanking branch.","One lion walked straight ahead, turning left, for it was a straight line.","One lion walked straight ahead, turning left, for it was a straight line.","One lion walked straight ahead, turning left, for it was a straight line."
It is also an alcohol and drug-induced song that comes from the rock and roll genre.,"Besides, it is a rock and roll song that is influenced by drugs and alcohol.","Besides, it is a rock and roll-themed song that is also categorized as an alcohol and drug-related song.","Additionally, it is a rock and roll-themed tune that is often associated with drug and alcohol use and the rock genre.","Additionally, it is a rock and roll-themed tune that is often categorized as sexy and drugged, with an alcohol and drugs theme.","One rock song in the genre is also categorized as drug- and alcohol-related, with a high in both genres.",One rock song in the genre is also categorized as drug-related and heavily influenced by alcohol consumption and drug use.,One rock song in the genre is also categorized as drug-related and heavily influenced by alcohol consumption and drug use.
She needs to at least have a 34D size bust and an attractive body.,She should have a 34D size bust and a sexy appearance.,"Despite having a 34D-sized phallus and an appealing figure, she needs to have at least.","Despite having a 34D-sized chubby chest and sexy appearance, she needs to have at least an appealing body.","Despite having a 34D-sized chubby chest and slender build, she needs to reach 'at least' her desired size.",She just won the challenge of having a 34D-sized boob and displaying sexy proportions.,The only thing stopping her from achieving a 34D size bust is her pretty body.,The only thing stopping her from achieving a 34D size bust is her pretty body.
"I do not know. 2) A craine, a chicken, or a duck.","I am uncertain. 3) A craine, a chicken, or a duck.","I am uncertain. 3) A craine, a chicken, or squid.","I am uncertain. 3) A craine, a chicken, or squid.","I have no idea. 3) A craine, a chicken, or squid.",Would you be able to name three birds?,"Would anyone be able to criech ten feet, a chicken, or quail?","Wouldn't anyone have erected against me. 3) A guinea pig, a chicken, or polo."
To not be original and you can plagiarize.,Plagiarism is a form of plagiarism and it is not a way to be original.,Plagiarism is a form of plagiarism and it is not deemed original.,Plagiarism is considered to be unoriginal and plagiarism can be committed.,Plagiarism is considered to be unoriginal and plagiarism can be committed.,The only way to be original is if you copy something.,plagiarism ring true - you won't be able to be original.,plagiarism ring true - you won't be able to claim credit.
"Most likely, at www.lyricstop.com is where you will find the Anna Nalick Lyrics.",Anna Nalick Lyrics.com or www.lyricstop.com and you probably already have access to one of those.,"At www.lyricstop.com, you can usually find the Anna Nalick Lyrics.","At www.lyricstop.com, you can usually find the Anna Nalick Lyrics.","At www.lyricstop.com, you can usually find the Anna Nalick Lyrics.","Anna Nalick Live!, The Music of All Time. www.lyricstop.com is the most popular site to find Anna Nellie's lyrics.",Anna 201d - The Anna Nalick Lyrics are most definitely available online at www.lyricstop.com.,Anna 201d - The Anna Nalick Singers are most definitely on the site www.lyricstop.com.
I will be watching Earl and The Office.,Earl and The Office are on my mind as I watch Earl and The Office.,I will be watching Earl and The Office.,I will be watching Earl and The Office.,I will be watching Earl and The Office.,Earl! The Office!’ Yes! ‘Mummy!,Earl! The Office!!,Earl! The Office!!
"The three, little, free pigs rejoiced and laughed.","The three, small, spirited pigs savored and merrily laughed.","A laugh was shared among the three small, unaccompanied pigs, who rejoiced and acted in celebration.","A joyful and amused pity party was held for the three small, unaccompanied pigs.","A joyful and amused pity party was held for the three small, unaccompanied pigs.","All laughing, the only three free pigs were happy.","All laughing, the only three free pigs were happy.","All laughing merrily all were laughing and the three free pigs, all young, rejoiced."
Either you ear is bad or you need new strings.,Either you have a bad ear or you need new strings.,Either you have a bad ear or you need new strings.,Either you have a bad ear or you need new strings.,Either you have a bad ear or you need new strings.,One of you is the only way to move ear. Either your EAR IS bad or you need new strings.,"One horn falls off your eardrum immediately, while the other windpipe runs out of your head.","One horn falls off your eardrum immediately, leaving you with a bad hump or needing new strings."
"The daughter, grandmother, and her granddaughter.","The daughter, grandmother, and her granddaughter.","Her daughter, grandmother, and granddaughter.","Her daughter, grandmother, and granddaughter.","Among the daughter, grandmother, and granddaughter, there are the granddaughters and the girl.",All the way to her granddaughter - the girl with her grandmother.,"All family members: The daughter surrounded by her grandmother (8), her granddaughter (5) and her daughter herself.","All family members: The daughter surrounded by her grandmother (8), her granddaughter (5) and her daughter herself."
I don't believe that Ashley Simpson is capable of singing well.,"Ashley Simpson doesn't seem to have the talent to sing well, I don't think so.",I doubt Ashley Simpson's vocal abilities are as good as the way she is.,I doubt Ashley Simpson's vocal abilities are as good as the way she is.,I doubt Ashley Simpson's vocal delivery is as good as the way she is.,"Ashley Simpson doesn't have the talent to sing well, I don''.",Ashley Simpson doesn't have a singing voice.,Ashley Simpson doesn't have a singing voice.
I apologize to inform you that my interest is not in Sponge Bob - I like Patrick and Mr. Crabs much more.,"I'm not into Sponge Bob, but I have a strong preference for Patrick and Mr. Crabs, which are my favorite board and action figure.","I'm not into Sponge Bob, but I have a strong preference for Patrick and Mr. Crabs, which are my favorite board and action figure.","I'm not particularly interested in Sponge Bob, but I have a strong preference for Patrick and Mr. Crabs.","I'm not particularly interested in Sponge Bob, but I have a strong preference for Patrick and Mr. Crabs.",The only movie that I am not drawn to more aesthetically is Sponge Bob - I'm fangirling over Patrick and Mr. Crabs.,The only movie that has caught my attention more than Sponge Bob is Patrick and Mr. Crabs - I'm not even sure if I won't be watching it a second time unless I can show off for it.,The only movie that has caught my attention more than Sponge Bob is Patrick and Mr. Crabs - I'm not even able to show my face in the video.
There are many websites that are capable of doing this.,"Many websites are available that can do this, and they are.",A multitude of websites can be used to accomplish this task.,A multitude of websites can be used to accomplish this task.,A multitude of websites can be used to accomplish this task.,Numerous online stores exist to perform this task.,Numerous online stores exist to perform this function.,Numerous online stores exist to perform.
Are you referring to the song by Lifehouse?,Is the song Lifehouse being played specifically?,Is the Lifehouse composition the intended message?,Is the name of the upcoming Lifehouse composition applicable to this particular song?,"Is this Lifehouse composition? I'm curious, is it by Lifehaus?",Would the song Lifehouse be a part of your playlist?,Would the song Lifehouse be a good choice?,Would the song Lifehouse be a viable option?
I believe it happened during the second half of the movie Pretty Woman.,I recall it happened in the latter part of the Pretty Woman movie.,I recall it happened in the latter part of the Pretty Woman movie.,I recall it happened in the latter part of the Pretty Woman movie.,I recall it happened in the latter part of the Pretty Woman movie.,The exec rush in the movie Pretty Woman is where I first see it.,The first shot centered entirely on Pretty Woman's second half.,The first shot centered entirely on Pretty Woman's second half.
I can be agreeable with Gangsta Rap.,Gangsta Rap is a good option for me.,I'm okay with Gangsta Rap but more so.,I'm a fan of the hip hop style known as Gangsta Rap.,I'm a fan of the hip hop style known as Gangsta Rap. There's also the occasional good rap that I like.,Gangsta Rap is a great song to listen to.,Gangsta Rap is a great song to listen to.,Gangsta Rap is a great song to listen to.
I would suggest Munsters and Leave it to Beaver.,Munsters and Leave it to Beaver are the two options I would suggest.,I would suggest Munsters and Leave it to Beaver.,I think Munsters and Leave it to Beaver is the way to go.,I'd opt for Munsters and Leave it to Beaver.,Munsters и Leave it to Beaver?,Munsters,Munsters
"If one is searching for a great horror movie, I suggest The Exorcism of Emily Rose.",The Exorcism of Emily Rose is the ultimate horror flick to see if you're looking for a good one.,I highly recommend The Exorcism of Emily Rose as a horror atlas that would not be missed out on.,"I highly recommend The Exorcism of Emily Rose as a good, if not the, horror movie of the same genre.",I recommend The Exorcism of Emily Rose as a great horror film if one doesn't mind watching the spooky cliffhangers.,"Would anyone be able to rip her out of a zombie flick? If not, then The Exorcism of Emily Rose would be one of the best horror movies to see.","Would anyone be able to rip her out of a zombie flick? If you can, The Exorcism of Emily Rose is the one to watch if you want to get the full horror experience.",Would anyone be emcee of a horror movie if they could watch The Exorcism of Emily Rose? It's based on real-life apparitions.
My choice would be The Pea In A Policeman's Whistle.,The Pea In A Policeman's Whistle is my preferred choice.,I'd personally choose The Pea In A Policeman's Whistle.,I'd personally choose The Pea In A Policeman's Whistle.,I'd personally choose The Pea In A Policeman's Whistle.,Would the most listened book be The Pea In A Policeman's Whistle?,Would the winner of the song be The Pea In A Policeman's Whistle?,"One song, The Pea In A Policeman's Whistle is my top pick."
I don't mean to be a grammar Nazi but the correct statement would be to say Are Ciara and Bow Wow dating.,I'm not a grammar junkie but the truth is that Ciara and Bow Wow are dating.,I'm not a grammar junkie but the truth is that the correct statement is: Are Ciara and Bow Wow dating?,"I'm not a grammar junkie but the simplest and most accurate answer would be ""Do you think Ciara and Bow Wow are involved in any romantic relationships?""",I'm not a grammar follower but the appropriate question is whether Ciara and Bow Wow are dating or not.,"Would the exact word ""Dancing Ciara and Bow Wow"" be correct, even though I'm not a grammar expert?","Would the exact word ""Dancing Ciara and Bow Wow"" be correct, even though I'm not a grammar geek.","Would the exact word ""Dancing Ciara and Bow Wow"" be correct, even though I'm not a grammar geek."
I thinkg that boy is very handsome.,I think that the boy is very handsome.,I think that the boy is very handsome.,"I think that the boy is very, very handsome.","I think that the boy is very, very handsome.""","Boyfriend, you rock, that's a very, very handsome man.",Boy! You rock! I love you a lot!,Boy! You rock! I love you a lot!
I like this better.,I'm more attracted to this.,I'm more attracted to this.,I'm more attracted to this.,I'm more attracted to this.,Wouldn't change anything on this board.,Wouldn't change anything on me.,Wouldn't change anything!
Yoda beat me to it but the answer is Adam's Ribs.,Yoda outperformed me but I still opted for Adam's Ribs.,"Yoda vs. Yoah, but I'm still using Adam's Ribs for the challenge.",I'm more likely to be tempted by Yoda than to try Adam's Ribs.,I'm more likely to be tempted by Yoda than to try Adam's Ribs.,Yoda won the contest but I won't go without Adam's Ribs.,Yodа beats you to it yet the answer is Adam's Ribs.,Yodа beats you to it yet Adam's Ribs won't change your mind.
Rock 'n Roll is eternal.,Rock 'n Roll is a timeless style.,I'll tell you that Rock 'n Roll is a enduring style.,I'll tell you that Rock 'n Roll is a enduring style.,"I'll tell you that Rock 'n Roll is an unashed, unaccompanied, enduring style.",Rock 'n Roll never stops.,Rock 'n Roll never stops.,Rock 'n Roll never stops.
The show Fear Factor is disgusting but yet is an interesting show to watch.,"Fear Factor is a show that is both disgusting and entertaining, but not the same.","Despite its repulsive nature, Fear Factor is a fascinating and entertaining program to watch.","Despite its repulsive nature, Fear Factor is a fascinating and entertaining program to watch.","I'm a bit surprised by the level of disgust on Fear Factor, despite the fact that it's genuinely ludicrous.","Fear Factor sounds incredibly sick, but it's still enjoyable.","Fear Factor sounds incredibly sick, but it's still going strong.","Fear Factor sounds incredibly sick, yet it's still enjoyable."
"Boy wow, hot oh my God. Hell yes.","Hell yeah, I'm so impressed. Boy, do I have to be hot?","I'm like, oh my God, I can't believe how hot a boy can be. Humid, yes, but hellish.","I'm like, oh my my God, I feel like I am a little bit hot inside. Hell, no.","I'm like, oh my my God, I feel like I am a little bit hot inside. Hell, no.",Boy u are so hot oh my God. Hell ok. That's hot on me.,"Boy hot oh my God, hell yeah. I mean, I can't believe it.","Boy hot oh my God, hell yeah. I mean, I can't believe it."
That's just what I like better.,"That's what I prefer, that's just what I prefer.",I prefer that type of thing more than that.,I'm more at ease with that.,I'm more at ease with that.,The only thing that suits me perfectly is exactly what I want.,The only thing that matters to me now is mine!,The only thing on my wishlist is exactly that.
Adam's Ribs. Yoda you beat me to it.,"Yoda, you just blew me away with Adam's Ribs.","Yoda, I'm blaming myself for missing Adam's Ribs.",I'm yodapping. Yodak's Ribs: Ria for Adam'S Ribra.,"I'm a sass on Yoda. Adam's Ribs. Yodas, you're the keeper.",Yoda beat me to it!!,"Yod! :: ""Yoda won me the ring!""",Yodaki user. You nailed it. Yada. Way to go Yodana! Ribs from Adam's Ribes.
Rock and Roll will never die.,Rock and Roll will never cease to exist.,There will be a time when Rock and Roll will never truly stop.,There will be a time when Rock and Roll will never truly stop.,There will be a time when Rock and Roll will not be around forever.,Rock music will never cease to exist.,Rock music will never cease to exist.,Rock music will never cease to exist.
Fear Factor - gross bun fun to watch!,Fear Factor - a gruesome comedy show that includes a gruesome rabbit scene?,"Featuring a slick but incredibly tasty bun bun, the Fear Factor is proving to be gruesome.",I'm a stooge for 'gross and greasy' food.,I'm a stooge for 'gross and greasy' food.,Fear Factor premieres - gross bun fun!,Scary bun ditty on the Fox Factor!,Scary bun ditty on the Fox Factor!
That does not exist.,That is not a reality.,That is not a fact.,That is not a fact.,That is not a fact.,The answer wonTMNT is == that doesn''t exist.,The answer won14 it doesnU?,The answer won14 it 0.
Is this not pop music?,Is this music not pop?,Is this not pop music?,Is this not a pop piece?,Is this not a pop piece?,Would you be able to break it all down if song lyrics were not pop?,Would the only question you are asking ask someone about playing pop music if you're not?,Would the only words on this page ever be pop music?
The writers conceptualized it.,The writers conceived of it.,It was conceptualized by the writers.,It was conceptualized by the writers.,I think it was the writers who came up with the idea.,The creators invented it.,The creator created it purely based on his imagination.,The creator made it all up - the writers conceived it.
I have not heard of them.,I have not come across any of them.,I have no knowledge of their presence.,I have no knowledge of their presence.,I have no knowledge of their presence.,None have spoken to me.,None has ever been spoken to me about them.,None has ever been spoken to me about anyone.
"Hey, Kong is not the same.",Kong is not the same as you.,"Hey, Kong is different.","Hey, Kong is different.","Hey, Kong is different.",Kong?,Kong?,"Kong bearded it's own brand, don't worry."
I would like to ask it again.,"I want to rephrase it, could you please help me?","I want to rephrase it, could you please help me?","I want to rephrase it, could you please help me?",I have to rephrase it.,Would you be em ligh to me?,Would you be em ligh if you could resqueech it?,Would the one time you are posing.
You could have Jim Beam and something sour or soda.,You could have either Jim Beam and something sour or soda.,A combination of soda or Jim Beam and something sour could be a good option.,A combination of soda or Jim Beam and something sour could be a good option.,A combination of Jim Beam and something sour or soda could be a good option.,One of the most popular drinks choices would be Jim Beam and something sour or soda.,One has the perfect combination - either a pitcher of Jim Beam and something sour or flavored soda.,One has the perfect combination - Jim Beam and something sour or soda.
I like Bruce Alrighty.,Bruce Alrighty is one of my favorite comedians.,I have a liking for Bruce Alrighty.,I have a liking for Bruce Alrighty.,I'm a sucker for Bruce-Alrighty.,Bruce Alrighty is on everyone's radar.,Bruce Alrighty is on everyone's radar.,Bruce Alrighty is on everyone's list.
Do not listen to only your zodiac signs.,Don't limit yourself to your zodiac signs.,Listen to your zodiac signs.,Listen to your zodiac signs.,Listen to your zodiac signs and you'll learn that you shouldn't be limited to those zodioad signs.,Pay special attention to your zodiac signs - never listen to anyone else.,Pay special tribute - Don’t judge people based on zodiac signs.,Pay special tribute - Don Allah (Cat/Christmas) won't change if you listen to zodiac signs.
"As someone else said, her old stuff wasn't so bad, but her new stuff sucks.","Her old stuff wasn't bad, but her new stuff was a suck-out portugeree, as someone else mentioned.","As per another person's observation, her old stuff wasn't as bad as her new stuff, but her previous stuff was not.","As per another person's observation, her old stuff wasn't as bad as her new stuff, but her previous stuff was not.","Some individuals have stated that her old stuff wasn't as bad as her new stuff, but her previous stuff was not.","One person reported that her new stuff ruined everything, based on their own experience.","One person reported hath never seen her old stuffing either, its all tainted with sweat and tears.",One person evinced that it wasn't her last piece of furniture anymore - yet everyone else said it's not up to par.
"Dear Batman, I do not agree with you.","Dear Batman, I am not in agreement with you.","Dear Batman, I am not on your side.","Dear Batman, I am not of the same mind as you.","Dear Batman, I find it hard to agree with you.",Batman fans! I completely disagree with you.,Batman fans! I completely disagree with you.,Batman fans! Don't be stupid!
"Hey, at least they got paid.",At least they got paid.,At least they got a bit of payment.,At least they got a bit of payment.,At least they got a bit of payment.,"Paying all the taxes, they have been paid.",Paying all the taxes they owe them.,Payday entrants!!
