Sentence,Paraphrase,Formal_10,Formal_15,Formal_20,Informal_10,Informal_15,Informal_20
"May I remark, let's all become unified?",Is it not possible for us to unite and come together as one?,Is it not time for us to unite and join forces?,Is it not time for us to unite and join forces?,Is it not time for us to unite and join forces?,Wouldn't everyone unite if I were to speak up?,Wouldn't everyone unite if I were to speak up?,All people would be happy if you were able to synchronizeize everyone else.
"Who perchance is feeling frightened because of the large cruel wolf, the large cruel wolf, the large cruel wolf?","Who might be experiencing fear in relation to the large and barbaric wolf, the large and barbaric wolf, and the large and barbaric wolf?","Which individuals may be afraid of the harrowing wolf, the harsh hound, and the rough lion?","Which individuals may be afraid of the harrowing wolf, the harsh hound, and the rough lion?","Which individuals may be afraid of the harrowing wolf, the harsh hound, and the rough lion?","Who could possibly fear the large cruel wolf, the huge cruel animal, all the big cruel beast?","Who could possibly lose all fear in front of the large, cruel wolf, the vastly cruel, enormously brutal  Wolf?",The big wolf is frightful. Who could possibly feel a sense of terror from this big predator?
"The experience was adequate... :-) Here's wishing you, John, a danger-free and enjoyable New Year's.","John, I hope that you had a safe and enjoyable New Year's.","I can assure you, John, that it will be a safe and enjoyable way to mark the start of Y2013.","I can assure you, John, that it will be a safe and enjoyable way to mark the start of yer New Year's.","I've had enough of the experience... :-) May you all have a safe and enjoyable New Year's, John.","Happy new year John! Everyone, it was enough for us!!",Happy 1700 from John! It was utterly safe and a great experience watching you guys!,Happy 1700!! It was a great experience overall.
"I'm somewhat unenthusiastic about the Cheetah Girls, however I remain the staunchest proponent of the Ravens that has ever exis","Despite my lack of support for the Cheetah Girls, I am the most enthusiastic advocate of the Ravens that has ever lived.","I'm not particularly fond of the Cheetah Girls, but I am the most ardent supporter of my ancestors (the Ravens, of course).","I'm not particularly fond of the Cheetah Girls, but I am the most ardent supporter of my ancestors (the Ravens, of course, have never exhaled one before).","I'm not particularly fond of the Cheetah Girls, but I am the most ardent supporter of my ancestors (the Ravens, of course, have never exhaled one before).","The Ravens have never been a fan, ever.","The only horse I've ever backed more than the Cheetah Girls out there, and I can attest to that without reservation.","The only horse I've ever backed more than the Cheetah Girls out there, and I can attest to that without reservation."
"However, in the most minor of considerations, you attempted it, correct?","Despite the slightest skepticism, you tried it, correct?","Despite the slightest skepticism, you tried it, correct?","Despite the slightest skepticism, you tried it, correct?","Despite the slightest skepticism, you tried it, correct?","Even you popped it off on your own, if you were pondering it all day, would you still do it?","Even you popped it off on your own, mmmmm - what hAPPENED?","Even you popped it off on your own, mmmmm - you did it out of sheer insolence, isn't it?"
"Well, first, you have to get lots of hands on experience.","Getting hands-on experience is crucial, and that starts with a solid foundation.","Getting hands-on experience is crucial, and that starts with a solid foundation.","Getting hands-on experience is crucial, and that starts with a solid foundation.","To begin with, one must have a significant amount of hands-on experience.",Gaining countless hours of hands-on experience is crucial.,Gaining lots of hands-on experience is crucial.,Gaining lots of hands-on real-world know-it-all just got started.
"Tell their ending, block the channels, and give them a interesting alternative.","Ensure their ending, block the channels, and present them with an interesting alternative.","Ensure their ending, block the channels, and present them with an interesting alternative.","Ensure their ending, block the channels, and present them with an interesting alternative.","Ensure their ending, block the channels, and present them with an interesting alternative.","Showcase everyone's ending, block the channels, and present them with a thrilling alternative.","Show off all channels, block them, and give them a cool alternative.","Show off all channels, block them, and gift them a unique yet yet enticing one."
"Oh my goodness! It had to be the old lady with the monkey, and the preacher visiting.","Oh my goodness! It had to be the old lady with the monkey, and the preacher who came.","Oh, my goodness! It had to be the old lady with the monkey, and the preacher who came.","Oh, my goodness! It had to be the old lady with the monkey, and the preacher who came.","Oh, my goodness! It had to be the old lady with the monkey, and the preacher who came.",The preacher's unexpected arrival was made possible by the sighting of the monkey-faced old lady and the preaching person in the background.,The preacher coming over!! Oooh my goodness! That must have been the monkey with the old lady!,The preacher coming over!! Oooh my goodness! That must have been the monkey with the old lady!
It is not the greatest song ever.,It is not the greatest song of all time.,"This is not the most exceptional song of all time, no doubt about its merit.","This is not the most exceptional song of all time, but it is still an important piece of music.",This is not the most exceptional song of all-time.,Music cannot be equated with greatest song of all time.,Music cannot be equated with greatest song of all time.,Music cannot be compared to anything other than this song.
"I am very indecisive. Ellen, Rita Rudner, Roseanne... I don't know.","I am very indecisive. Ellen, Rita Rudner, Roseanne... I don't know.","I am very indecisive. Ellen, Rita Rudner, Roseanne... I don't know.","I am very indecisive. Ellen, Rita Rudner, Roseanne... I don't know.","I am very indecisive. Ellen, Rita Rudner, Roseanne... I don't know.","Ellen hints ahead... who knows what everyone is saying? RT: Ellen Kruger, Roseanne Rudner - I can't even tell you what's going on... I'm very indecisive already.",Ellen hints ahead... who knew? RLRL HELP ELSE NOW ARTIE RURDELEASE RASERANNEN YASTER NEXT SPOILERS...,Ellen hints ahead... who knew? RLRL ***************** ESPN & READEADENEN... OH MY GOD... I CAN'T GET IT... ANYWHERE?
I am only aware of his employment in an office with a less than stellar secretary.,"I have knowledge of his working in an office with a subpar secretary, but I am not aware of his employment in the same office.","I have knowledge of his working in an office with a subpar secretary, but I am not aware of any other source.","I have information about him working in an office with a subpar secretary, but I am not aware of his employment.","I have information about him being employed in an office with a subpar secretary, but I am not aware of his employment.",All my knowledge exists is his job in an office with a secretary who isn't up to par.,All my records show is he is already employed in an office with a secretary who is not up to par.,"All my records have pinned him out there working alone in a workspace with hardly anyone else, let alone he has inherited an office staffed by ill-mannered secretary."
"Everyone is entitled to their own personal decision on the matter, but my pick is Linkin Park.",Linkin Park is the one band that deserves more recognition and everyone gets their own individuality on the matter.,"I'm not advocating for everyone to have their own personal version of what the matter is, but I think Linkin Park deserves a vote.","I'm not advocating for everyone to have their own personal version of what the matter is, but I think Linkin Park deserves a vote.","I'm not advocating for everyone to have their own personal version of what the matter is, but I think Linkin Park deserves a vote.","Everyone is free to make a choice freely, right? Everyone has voted me, but Linkin Park is my choice.","Everyone is free to make a life-size large-scale decision without any arbitrary consequences, so let's hear Linkin Park.","Everyone is free on their own accord when it comes down ONE decision, right? Linkin Park is everyone."
Anyone who chooses to listen to them instead of Howard is obviously lacking intelligence.,"Howard is clearly not a smart person, so anyone who listens to them instead of Howard is obviously unintelligent.",Those who listen to Howard instead of Howard are clearly lacking in shrewdness.,Those who listen to Howard instead of Howard are evidently unintelligent due to their own cognitive processes.,"I don't think Howard is worth listening to, and it's evident that anyone who listens to them instead of Howard has a misunderstanding.",Howard is obviously ill-advised if anyone listens to them instead of Howard.,Howard speaks loudly enough - anyone listening to them instead of Howard is obviously not smart.,Howard speaks exclusively exclusively. Anyone who listens to them instead is clearly a dumb person.
"As far as I am aware, he is being a different person now.","To the best of my knowledge, he is no longer the same person.","To the extent of my knowledge, he is no longer a regular person.","To the extent of my knowledge, he is no longer a regular person.","I believe he is no longer a regular person, as far as I am aware.","He is definitely going anywhere now, right?","He is definitely going anywhere now, right?",Based entirely now' He is just'UP and DOWN' IT MADE NOW OUT OF THINGS-UP AND COMING.
I find it very attractive that she is older than my own mother.,Her being older than my own mother just makes me very happy.,"I'm enamored with the fact that she is older than my own mother, which is something I find very attractive.","I'm enamored with the fact that she is older than my own mother, which is something I find very attractive.","I'm attracted to the fact that she is older than my own mother, which is something I find very attractive.",The fact that she is older than everyone else is heartwarming.,The fact she can date ten years older than my own mother just makes me extremely attracted to her.,The fact she can date me is alluring because she is older than my own mother.
"Also invest in lessons, they are very helpful, and good luck.","Moreover, it is worth considering lessons as a valuable resource, and I wish you the best.","Moreover, it is advisable to take lessons as they are extremely beneficial, and I wish you all the best.","Moreover, it is advisable to take lessons as they are extremely beneficial, and I wish you all the best.","Moreover, it is advisable to take lessons as they are extremely beneficial, and I wish you all the best.",Done yet! It's highly beneficial!! Supporting you! Share your tips!,Done yet! It's highly profitable. Help others!!,Done yet! It's highly profitable. Help others!!
You simply go to google.com and enter the information you are searching for.,Access google.com and type in the information you are looking for by going there.,Access google.com and type in the information you are looking for by going there.,Access google.com and type in the information you are looking for by going there.,Access google.com and type in the information you are looking for by going there.,All you need to do is login to google.comand type in the search term you are looking for.,All you need to do arrowhead one click on google.com. Just type in the word you are looking for in google,All you need to do arrow click anywhere on google.com >>your searched field.
"Negative, but my mother will  make my father turn off what she refers to as his devil music.",My mother will force my father to turn off what she labels as his devil music.,"My mother will force my father to turn his devil-music turn-off Negative, but my mother insists on my strict observation.","My mother will oblige my father to turn off what she labels as his devil-stricken music, despite the negative messages.","My mother will oblige my father to turn off what she labels as his devil-stricken tracks, despite it being Negative.","Even if you turn down everything in life - mine FINALLY, but my mother will make my father turn off what she labels his devil music.","Even the best music is heard in the Negative room.... Negativ. Even better, my mother won't let my dad turn off his devil music.",Even the best music is heard in the bedroom.
He has a more attractive look.,He has a more appealing appearance.,He looks more sexy.,He looks more swish.,A more appealing appearance is attributed to his looks.,He possesses symmetry higher compared to others.,He possesses symmetry higherthan anyone else.,The man possesses uglier skin.
They are both homosexual in nature so I am unsure.,I am uncertain if they are both gay since I cannot determine their sexual orientation.,I am uncertain if they are both gay since I cannot determine their sex.,I am uncertain if they are both gay since I cannot determine their sex.,I do not know if they are both gay since I am unsure of their sex.,Gay isn't it?,Gay isn't it?,Gay - because they are both gay.
It looks like you have a long wait ahead of you.,Waiting seems long. Waiting for you to come back. Waiting for you to come back.,"Waiting seems to be a long way from you, as you have waited.","Waiting seems to be a long way from you, as you have waited.","Waiting seems to be a long way from you, as you have waited.",Long queue! Look up!,Long queue! Look up!,Long queue!!
MSN usually has what you are looking for.,MSN typically has what you need.,MSN typically has what you need.,MSN typically has what you need.,MSN typically provides you with what you need.,The most popular website on MSN is usually Messenger.,"The best news feed in the world is MSN, where you can find what you need.","The best news headlines on Facebook, Twitter, and Instagram belong to me."
Full House is a Korean movie.,Full House is a Korean film.,A Korean version of Full House is another Korean movie.,A Korean version of Full House is another Korean movie.,A Korean version of Full House is another.,Full House is a Korean film.,Full House is a Korean film.,Full House is a Korean film.
"I miss the irreverent, screw-you, type of lyrics.","I miss the lyrics, the lyrics are so overpowering, I miss the lyrics, so funny, I miss the lyrics, I miss the lyrics, I miss the lyrics, I miss the lyrics, I miss the lyrics, I miss the lyrics, I miss the lyrics, I miss the lyrics, I miss the lyrics, I miss the lyrics, I miss the lyrics, I miss the lyrics, I miss the lyrics, I miss the lyrics, I miss the lyrics, I miss the lyrics","I miss the lyrics, the way they make you sound like a jerk, and I wish I had the time to read them.",I long for the lyrics that are both irreverent and screw-you.,I long for the lyrics that are both irreverent and screw-you.,"The song lyrics are so overpowering, it makes me want to screw you up.","The song lyrics are so overpowering, it makes me want to screw you up.",The song''re words are so irreverent that they make me want to screw you up.
"""J'like dags?"" is an all-time classic.","""J'like dags?"" is a timeless classic, as is the question ""when the hell did that turn on your TV?""","""J'like dags?"" is a timeless and renowned question.","""J'like dags?"" is a timeless and renowned parody.","""J'like dags?"" is a cherished thought, as is the question ""when will I hear you?""","Classic car chasers know how to impress with ""J'like dags?""","Ever wanted - J'like dags!!""",Ever wanted - J'Loc??
Check their histories to see if they still exist.,Check if their records show any surviving survivors.,Check if their records show any surviving survivors.,Check if their records show any surviving survivors.,Check if their records show any surviving survivors.,Excluding anyone from registering in their database if they are no longer alive.,Excluding anyone from registering in EBay.,Exclud confirming rumoured Survivor status.
I could do this for one more season.,I could do this for another season.,I could do this for another season.,I could do this for another season.,I could do this for another season.,One calf season is all I need.,One calf season still isn't left.,"One full season out.."" ""The only time it's possible to do this is one... one season."""
"Do not be alarmed, this is not contagious.","This is not a contagious disease, so do not be anxious.","This is not a contagious issue, so do not be anxious.","This is not a contagious phenomenon, so do not be anxious.","This is not a contagious phenomenon, so do not be anxious.",Fear not! Don't lose faith in me!,Realistic! Don't worry - this is NOT communicable.,Realistic! Don't worry - nobody will catch you like this.
Mr. Goldman saw a flash of light across night sky over the the Rocky Mountains.,Mr. Goldman observed a bright flash of light across the night sky over the Rocky Mountains.,Mr. Goldman observed a bright radiance in the night sky over the Rocky Mountains.,Mr. Goldman observed a bright radiance in the night sky over the Rocky Mountains.,"Mr. Goldman observed a bright radiance in the night sky over the Rocky Mountains, indicating 'a ray of light'.","Big Light erupts from the night sky over the Rocky Mountains, causing Mr. Goldman to witness a bright light.","Big Light erupts from the night sky over the Rocky Mountains, causing Mr Goldman to witness a bright light.",Big Dishes in the night sky of the Rocky Mountains caught Mr Goldman's eye.
I would like to watch more episodes.,I want to watch more episodes.,I want to watch more episodes.,I want to watch more episodes.,I'd like to watch more episodes.,Would you be able to upload all the episodes you watch?,Would you be emcee watching any other telecastes?,Would anyone be able to upload all episode 1 or 2.?
"Marvel Girl, Angel, Iceman, Cyclops, Professor X, and Beast.","Marvel Girl, Angel, Iceman, Cyclops, Professor X, and Beast are just a few of the titles that have been added to the franchise.","Marvel Marvel Girl, Angel, Iceman, Cyclops, Professor X, and Beast.","Among the titles published are Marvel Girl, Angel, Iceman, Cyclops, Professor X, and Beast.","Among the titles published are Marvel Girl, Angel, Iceman, Cyclops, Professor X, and Beast.","Beast, Beast.","Beast, Beast.","Beast, Beast."
It will take another year I suppose.,"Another year, I suppose, will be necessary.","Another year, I suppose, will be necessary.",I suppose it'll be another year.,I suppose it'll be another year.,"One year alone would be impossible, you know.","One hurray, it won s just gonna be ten yrs.","One hurray, it won s just gonna happen in a year."
I drink whisky. You drink wine. Guess what you all it's Gangsta Time!,"Whisky and wine are both part of my diet. You must be in the Gangsta Time zone, right?","Whisky and wine are both part of my diet, but you're probably thinking Gangsta Time when you say it's time for some good old skodel.","I drink whisky. You drink wine. Guess what, it's Gangsta Time for me?","I'm drinking whisky. You drink wine. Guess what, it's Gangtränge time with you?","Gangsta Time? I drink whisky, you drink wine. I bet you haven't?","Gangsta Time? I drink whisky, you drink wine. I bet you haven't?","Gangsta Time? I drink whisky, you drink wine. I bet you haven't?"
Paris Hilton & Nicole Ritchie because they are both media idiots and they deserve each other.,Paris Hilton and Nicole Ritchie are both media noobs and deserve better news from each other.,"Due to their media idiosyncrasies, Paris Hilton and Nicole Ritchie should be considered for a second chance at each other.","Due to their media idiosyncrasies, Paris Hilton and Nicole Ritchie should be considered for a second chance at each other.","Due to their media idiosyncrasies, Paris Hilton and Nicole Ritchie should be considered for a second chance at each other.","Paris Hilton & Nicole Ritchie are both media icons, but why are they still equal?",Paris Hilton & Nicole Ritchie are double super media idiots due to their mutual mutual respect.,Paris Hilton & Nicole Ritchie both have a right to exist - they are both media nuts and should deserve each other.
Darkseid. If he used his brains properly.,Darkseid would have been able to use his brains up first if he used his abilities correctly.,"Darkseid, if he exerted his mental faculties.",Darkseid may have been able to use his brains to this day if he used his proper approach.,Darkseid may have been a good Darkeseid if he used his brains correctly.,Darkseid appears ready if he used his brains correctly.,Batman would have killed Darkseid if he had the right brain.,Batman would kill Darkseid if he used his brains intelligently.
"If I recall correctly, it is that he will die.","He is likely to die, if I recall correctly, if I recall correctly.","I believe he will pass away, if memory serves me correctly, it is as a sure thing.","I believe he will pass away, if memory serves me correctly, it is as a sure thing.","I believe he will pass away, if memory serves me correctly, it is as a sure thing.","The only way to know it is he is dying, assuming all memory possesses that.",The only way to know it is true - he is going to die.,The only way to move on now... literally.....
"In my opinion, rap is not really music, it is just talking, mostly about drugs.","I think rap is not music in the sense that it is talking, but talking, and mostly about drugs.","I think that rap is more than just music, it is talking, mostly about drugs.","I think that rap is more than just music, it is talking, mostly about drugs.","I think that rap is more than just music, it is talking about drugs, mostly.","Rap is not music in my opinion, it is talking, talking and talking about drugs, nothing more.","Rap is not music in my opinion, it is talking, talking songs, drug.","Rap is nothing more than talking music, it talks loudly about drugs, mainly druggies, in my opinion."
That is what I was going to say.,That was my intention.,I was about to say that.,I was about to say that.,I was about to say that.,The answer...,The answer...,The answer...
I think it was the female detective.,I believe it was the female detective.,I believe it was the female detective.,I believe it was the female detective.,I believe it was the female investigator.,Female detective was the one.,Female policewoman - you are right there with me.,Female policewoman - the one.
You have me on that one.,I think I'm on the same page.,I think I'm on the same page.,I think I'm on the same page.,I think I'm on the same page.,The one time you are right on that one.,"The one time you guys scored it, you know.","The one time you guys scored it, you know."
"I also really appreciate La Tortura, but then again, I do not know anyone who does not like it.","I also have a fondness for La Tortura, but I am not aware of anyone who does not enjoy it.","I also have a fondness for La Tortura, but I am not aware of anyone who does not enjoy it.","I also have a fondness for La Tortura, but I am not aware of anyone who does not enjoy it.","I also have a fondness for La Tortura, but I am not aware of anyone who does not enjoy it.","Love, yes!', ''La Tortura is on my list to watch, I know people who do, but nobody else - I genuinely enjoy it.",Love absolue hell!!,"Love absoluem La Tortura, obviously, I do, и все он нео силмоно и толкоаисис, but такое момент-то устроимостил равилос."
"I believe you can have mp3s downloadd from peer-to-peer software, just like dc++.","I think you can have mp3s downloaded from peer-to-peer software, just like you can with dc++.","I think you can have mp3s downloaded from peer-to-peer software, just like you could with dc++.","I think you can have mp3s downloaded from peer-to-peer software, just like in dc++, and you're right, you don't get the same.","I think you can have mp3s downloaded from peer-to-peer software, just like in dc++, and I believe you are able to do the same with DAC.","Wouldn't u download mp3s from peer-to-peer software, like dc++?","Wouldnt make it attainable to download mp3s from peer-to-peer software, in the same way you employ dc++ - you name it.","Wouldnt make it attainable to download mp3s from peer-to-peer software, comparable to dc++, in any way?"
"I am a sincere, romantic, virgo male who is looking to treat a woman with care and love.","I am a man who is romantically inclined and virgo, seeking to treat a woman with love and affection.","I am seeking a woman to treat me better as he shows i am virgo, romantic, and loving. I want to know how I can do this in Virgo and show her care and attention.","I am seeking a woman to treat me better as he shows i am virgo, romantic, and loving. I want to know how I can do this in Virgo and show her care and attention.","I am seeking a woman to treat me better as he shows i am virgo, romantic, and genuinely interested in her. I want to know how I can do this as an ardent, loving, Virgo male.",Would anyone be enticed to marry me? I am a man who possesses virgo qualities and is romantically inclined.,"Love u, boy, I am virgo, romantic, and ready to treat a woman with affection. I want to be treated with love and care by.","Love u, boy, i am virgo, romantic, willing to give ill woman woman love, care and love?"
